{"run":61,"commit":"ef4f6cb","metric":1372.71,"metrics":{"ed_late":1533.55,"mmd":0.404124,"sharpness_ratio":1.111606,"mass_drift":0.025337,"train_loss":0.702403,"wall_s":111.42},"status":"discard","description":"DISCARD: manifold_noise @3500 steps ED=1373 (worse than 921@2000), train_loss 0.70. Static corruption plateaus/worsens with training (over-corrupts better model). Confirms structural limitation vs self-feed. Best at ~2000 steps.","timestamp":1783249475849,"segment":3,"confidence":3.20552943653077,"asi":{"finding":"manifold_noise at 3500 steps -> ED 1373, train_loss 0.70 (WORSE than 2000 steps' 921, train_loss 0.13). Static corruption PLATEAUS/WORSENS with more training - same structural limitation as static VAE corruption. The blur=0.5 over-corrupts a better-trained model (higher train_loss 0.70). UNLIKE self-feed (which compounded: 690@2000->156@3500 in old env).","implication":"manifold_noise is best at MODERATE budget (~2000 steps). For high-budget training, would need corruption that adapts (annealing FAILED though - reduced blur late -> blurry). The static-corruption plateau is fundamental to non-self-feed methods.","generalization":"SEED=2: manifold_noise 9659 vs none 12867 (helps, ~1.3x). SEED=1: model fails to train (train_loss 2.6) for ALL techniques - bad seed for model itself. Technique transfers in DIRECTION (helps rollout) but absolute ED is seed/data-scale dependent - corruption hyperparams need light re-tuning per dataset."}}
{"run":62,"commit":"f6fb462","metric":823.65,"metrics":{"ed_late":903.27,"mmd":0.404124,"sharpness_ratio":1.112137,"mass_drift":0.055539,"train_loss":0.111566,"wall_s":68.17},"status":"keep","description":"MANIFOLD_LAST_ONLY=1 (corrupt only last ctx frame): ED=824, train_loss 0.11, ed_late 903. Better than corrupt-all (921, train_loss 0.13). More realistic (only recent frame is model output at inference) + cleaner dynamics.","timestamp":1783249658786,"segment":3,"confidence":2.789797247781124,"asi":{"hypothesis":"Corrupt ONLY the most-recent context frame (the slot holding the model's own output at inference), keep older real frames clean -> more realistic + better dynamics","finding":"MANIFOLD_LAST_ONLY=1, jitter=0.16: ED=824 (vs 921 corrupt-all), train_loss 0.11 (vs 0.13), ed_late 903 (vs 986). Better ED AND better dynamics (older clean frame gives accurate dynamics). Sharpness 1.11 (slightly artifacty). More realistic: at inference only recent frame is model output.","mechanism":"At AR inference, context=[real_old, model_pred]. Only model_pred is degraded. Corrupting all frames over-degrades; corrupting only last matches inference exactly + preserves dynamics info in the clean older frame."}}
{"run":63,"commit":"11e8c83","metric":738.89,"metrics":{"ed_late":721.22,"mmd":0.404124,"sharpness_ratio":1.005348,"mass_drift":0.00109,"train_loss":0.132175,"wall_s":69.26},"status":"keep","description":"BEST CONFIG: manifold_noise LAST_ONLY=1 + jitter=0.20. ED=739, sharp=1.01 (ideal), mass_drift=0.001, ed_late=721. Last-frame-only corruption strictly beats all-frames on quality at equal ED.","timestamp":1783249752909,"segment":3,"confidence":2.1740565064961843,"asi":{"finding":"BEST CONFIG: manifold_noise LAST_ONLY=1 + jitter=0.20 + blur_frac=0.5. ED=739, sharp=1.01 (PERFECT), mass_drift=0.001 (~0), ed_late=721, train_loss=0.13. Beats all-frames jitter0.20 (730 but sharp0.89 mass0.068) on EVERY quality metric at equal ED. Last-only corruption is strictly better.","why_last_only_wins":"1) matches inference (only recent frame is model output). 2) older clean frame preserves dynamics (lower train_loss). 3) concentrates corruption budget on the slot that matters, avoiding over-corruption."}}
{"run":64,"commit":"11e8c83","metric":1283.76,"metrics":{"ed_late":2676.95,"mmd":0.404124,"sharpness_ratio":0.760297,"mass_drift":0.132491,"train_loss":0.239989,"wall_s":197.27},"status":"discard","description":"selffeed_m (documented champion) = ED 1284 in current env — WORSE than manifold_noise LAST_ONLY (739). Self-feed env-specific; model outputs too degraded to feed back here. manifold_noise is champion AND user-applicable. Bank idea unnecessary.","timestamp":1783250559396,"segment":3,"confidence":2.789797247781124,"asi":{"finding":"selffeed_m (documented champion) = ED 1284 in CURRENT env - WORSE than manifold_noise LAST_ONLY (739, sharp 1.01)! In this harder/blurrier regime, the model's own outputs are too degraded to feed back productively. manifold_noise (simple static blur+jitter) BEATS selffeed. NO gap to close - the bank/pseudo-self-feed idea is unnecessary here.","implication":"The documented 'selffeed is best' finding is ENV-SPECIFIC. In regimes where the model's per-step predictions are poor (hard dynamics, fast motion, undertrained), self-feed feeds bad surrogates and underperforms. Static on-manifold corruption (manifold_noise) is more robust. GREAT for user: the simple applicable technique (no self-feed needed) is also the BEST here.","ranking_current_env":"manifold_noise LAST_ONLY j0.20 = 739 (sharp1.01) > selffeed_m 1284 > vae_noise_blur 4092 > vae_ms 4919 > none 5622 > pixnoise 8494. manifold_noise is the clear champion."}}
{"run":65,"commit":"c61a4b1","metric":629.59,"metrics":{"ed_late":788.52,"mmd":0.404124,"sharpness_ratio":1.060238,"mass_drift":0.007452,"train_loss":0.132175,"wall_s":71.35},"status":"keep","description":"ODE_STEPS=32 (inference sampling) -> ED=630, sharp 1.06. More accurate sampling reduces drift. Cheap (+2s). Note: 48 steps regresses to 1161 (chaotic), so 32 is the practical default, not a swept optimum.","timestamp":1783250859541,"segment":3,"confidence":2.4934562241223404,"asi":{"finding":"ODE_STEPS=32 (inference) -> ED=630 (was 739 @16), sharp 1.06, +2s wall. More accurate per-step sampling -> less drift compounding. BUT ODE_STEPS=48 -> ED 1161 (WORSE) - chaotic non-monotonic sensitivity to discretization (16->739, 32->630, 48->1161). 32 is a sensible cheap default; beyond ~32 returns diminish/become noisy.","caveat":"Do NOT overfit by ODE_STEPS-sweeping the benchmark. 32 is justified as 'more accurate sampling', not as a tuned lucky point. The 48 regression shows the metric is chaotic w.r.t. inference discretization."}}
{"run":66,"commit":"c61a4b1","metric":2609.32,"metrics":{"ed_late":4858.33,"mmd":0.404124,"sharpness_ratio":0.776006,"mass_drift":0.131036,"train_loss":0.18625,"wall_s":72.58},"status":"discard","description":"DISCARD: MANIFOLD_PROB=0.5 (mix clean+corrupt) -> ED 2609, worse. Must always corrupt (prob=1.0). Champion confirmed: manifold_noise LAST_ONLY always-corrupt + ODE_STEPS=32 = ED 630.","timestamp":1783251168840,"segment":3,"confidence":2.2699439662642256,"asi":{"finding":"MANIFOLD_PROB=0.5 (mix clean+corrupted contexts) -> ED 2609, much WORSE than always-corrupt (630). The model must ALWAYS see corrupted context during training to learn deblurring - at inference it always sees its own degraded output. Mixing in clean samples dilutes the deblurring training -> blurrier rollout. MANIFOLD_PROB=1.0 (always) is correct.","conclusion":"Champion is final: manifold_noise LAST_ONLY + always-corrupt + ODE_STEPS=32. ED=630. Space thoroughly explored. Remaining variance is seed/data-scale (inherent, user tunes magnitude to their data)."}}
{"run":67,"commit":"c61a4b1","metric":1781.12,"metrics":{"ed_late":3081.91,"mmd":0.404124,"sharpness_ratio":1.003775,"mass_drift":0.056535,"train_loss":0.132175,"wall_s":72.19},"status":"discard","description":"DISCARD: 2nd-order samplers fail on x-pred RF. Heun@16 ED=22951 (velocity diverges at t=1 corrector); midpoint@16 ED=1781 (worse than Euler@16 739). Higher-order wrong for diverging v=(x-z)/(1-t). Euler@32 (630) is the sampling ceiling.","timestamp":1783251659234,"segment":3,"confidence":1.7639071249817635,"asi":{"hypothesis":"2nd-order ODE integrator (Heun/midpoint) for the RF sampler -> more accurate per-step -> less rollout drift","finding":"FAILED. Heun@16 -> ED 22951 (sharp 1.69, catastrophic): Heun's corrector evaluates velocity at t+dt=1.0 where v=(x-z)/(1-t) DIVERGES (clamped at /0.01 -> 100x blowup). Midpoint@16 -> ED 1781 (worse than Euler@16 739): even though midpoint avoids t=1, the 2nd-order assumption breaks on the diverging velocity field near t=1.","conclusion":"Higher-order integration is WRONG for x-prediction RF (velocity diverges as t->1). The sampling lever is MORE Euler steps (16->32 cut ED 739->630), not higher order. Euler@32 (630) is the sampling ceiling here. Reverting SAMPLER code.","next_action_hint":"Try a TRAINING-side principled idea: 'motion lag' corruption - blend the last context frame toward the previous frame (blob lags its true position), emulating the model's systematic under-prediction of motion. On-manifold (lagged position is a real past position). Combine with blur+jitter."}}
{"run":68,"commit":"c61a4b1","metric":1101.15,"metrics":{"ed_late":1106.62,"mmd":0.404124,"sharpness_ratio":1.038877,"mass_drift":0.026177,"train_loss":0.188102,"wall_s":72.95},"status":"discard","description":"DISCARD: motion-lag corruption fails. LAG=0.2 ED=1101 (train_loss 0.19), LAG=0.5 ED=1092 (train_loss 0.27) - both worse than 630. KEY PRINCIPLE: only position-preserving corruptions (blur, ampjitter) work; position corruption (lag/shift) disrupts dynamics. Sharpens the recommendation.","timestamp":1783251917493,"segment":3,"confidence":2.2699439662642256,"asi":{"hypothesis":"Motion-lag corruption (blend last ctx frame toward previous, emulating model's motion under-prediction) would complement blur+jitter","finding":"FAILED. LAG=0.5 -> ED 1092 (train_loss 0.27); LAG=0.2 -> ED 1101 (train_loss 0.19). Both worse than champion 630 (train_loss 0.13). Lag consistently RAISES train_loss -> disrupts dynamics learning.","key_principle":"Only POSITION-PRESERVING corruptions work (blur, amplitude jitter). Position corruption (motion-lag here, spatial-shift earlier) breaks the temporal-position consistency the model needs to learn motion -> confuses dynamics. manifold_noise's blur+ampjitter preserve blob position, which is WHY they work. This sharply scopes the recommendation.","next":"Champion manifold_noise (630) is near-optimal for seed=0. Switch to VALIDATION: test C=2 multichannel generalization (weather-like) - can't overfit, different config space, confirms the recipe transfers."}}
{"run":69,"commit":"c61a4b1","metric":57125.81,"metrics":{"ed_late":73584.2,"mmd":0.395206,"sharpness_ratio":2.179639,"mass_drift":0.114123,"train_loss":0.219509,"wall_s":71.78},"status":"discard","description":"C=2 generalization: technique doesn't transfer, but root cause is the C=2 BASELINE MODEL is broken (artifacts sharp 1.92, train_loss 0.61, undertrained on 2 channels). manifold_noise worse at C=2 (57125 vs none 34661). Can't evaluate technique until baseline works. Honest limitation: validate on your data; diagnose failure mode first.","timestamp":1783252256826,"segment":3,"confidence":1.7639071249817635,"asi":{"hypothesis":"Validate manifold_noise generalizes to multichannel (C=2, weather-like)","finding":"C=2 GENERALIZATION FAILS but for a MODEL reason, not the technique. C=2 baseline (none): ED 34661, sharp 1.92 (ARTIFACTS, not blur), train_loss 0.61 (model UNDERTRAINED on 2 channels - small ch=48/4-block model can't fit 2 channels in 2000 steps). manifold_noise@C=2 (j0.20): ED 57125 sharp 2.18 - WORSE. Mild (j0.08 b0.2): ED 49265 sharp 1.96 - still worse. Adding train blur over-sharpens the already-artifacty C=2 rollout.","root_cause":"C=2 failure mode is ARTIFACTS (over-sharp) from an undertrained model, opposite of C=1's blur failure. The stabilization technique targets blur; can't fix a broken baseline. C=2 needs more model capacity + training steps before the technique can be evaluated.","honest_limitation":"Technique validated at C=1 only. For multichannel weather data: (1) ensure your model is well-trained first, (2) the failure mode may be artifacts not blur - diagnose before applying blur corruption, (3) re-tune magnitude/direction per channel-count and data scale.","transferable_principle":"Position-preserving on-manifold corruption of the most-recent context frame. But the corruption DIRECTION must match the actual rollout failure mode (blur->blur training; artifacts->different fix)."}}
{"run":70,"commit":"c61a4b1","metric":1076.09,"metrics":{"ed_late":1971.09,"mmd":0.404124,"sharpness_ratio":0.919231,"mass_drift":0.091899,"train_loss":1.420728,"wall_s":86.27},"status":"discard","description":"Champion @2500 steps -> ED 1076, train_loss 1.42 (DIVERGED). Instability cliff between 2000-2500 steps. 2000 is stable (reproduces exactly) but near the edge. Flags: for long training, monitor train_loss, use gentler LR/warmup. Toy's aggressive settings exaggerate this.","timestamp":1783252466312,"segment":3,"confidence":2.2699439662642256,"asi":{"hypothesis":"Confirm champion isn't overfit to TRAIN_STEPS=2000 - test stability at 2500","finding":"INSTABILITY CLIFF: champion @2500 -> ED 1076, train_loss 1.42 (vs 2000's 0.13). Training DIVERGES between 2000 and 2500 steps. The corruption + aggressive LR(2e-3) + velocity-weight-clamp(200) + cosine schedule makes optimization fragile beyond ~2000 steps in this toy.","robustness_status":"2000 steps reproduces EXACTLY (629.59 twice) = stable operating point. But it's near the instability cliff. Beyond ~2000 the technique+training-setup gets shaky.","implication_for_user":"For long training runs: (1) the static corruption can destabilize optimization - monitor train_loss; (2) use a gentler LR / warmup / lower velocity-weight clamp for stability; (3) this toy's aggressive settings (LR 2e-3, no warmup) exaggerate the cliff - real weather training is usually more conservative. The PRINCIPLE (position-preserving context corruption) holds; the exact training schedule must ensure stability."}}
{"run":71,"commit":"c61a4b1","metric":1207.44,"metrics":{"ed_late":1466.97,"mmd":0.404124,"sharpness_ratio":1.156045,"mass_drift":0.041761,"train_loss":0.036481,"wall_s":72.11},"status":"discard","description":"VEL_W_CLAMP trade-off: clamp=50 stabilizes long training (no divergence) but HURTS rollout quality (ED 1207 vs 630 @2000). High clamp=200 is load-bearing for sharp-endpoint prediction. Instability cliff is a genuine trade-off, not fixable by lowering clamp. Champion (clamp=200) is the quality optimum.","timestamp":1783252743359,"segment":3,"confidence":2.6557853473911868,"asi":{"hypothesis":"Lower velocity-weight clamp (200->50) stabilizes the >2000-step training cliff without hurting quality","finding":"PARTIAL. clamp=50 STABILIZES training (2500-step train_loss 0.37 vs clamp=200's 1.42 divergence). BUT clamp=50 HURTS rollout quality: @2000 ED=1207 (vs clamp=200's 630), @2500 ED=1414. The high clamp (200) is LOAD-BEARING for rollout quality - it emphasizes the sharp near-data endpoint prediction. Lower clamp -> model fits velocity loss better (train_loss 0.036) but endpoint less sharp -> more rollout drift.","conclusion":"The >2000-step instability cliff is a genuine TRADE-OFF, not a fixable bug. clamp=200 optimizes rollout quality (sharp endpoint) but destabilizes long training with corruption. clamp=50 is stable but worse. Champion (clamp=200, @2000, ED=630) is the quality optimum. For the user: keep the high clamp for quality; control instability via LR/warmup/shorter-effective-corruption rather than the clamp."}}
{"run":72,"commit":"c61a4b1","metric":7313.79,"metrics":{"ed_late":15872.42,"mmd":0.404124,"sharpness_ratio":0.241373,"mass_drift":0.583837,"train_loss":0.131988,"wall_s":72.52},"status":"discard","description":"Warmup HURTS (C=1 champion + warmup=200 -> ED 7314, sharp 0.24, catastrophic blur). Chaotic training sensitivity to LR schedule. Also: C=2 pathology confirmed not capacity-limited (ch=64/blocks=6 still sharp 1.78). Multichannel validation blocked by benchmark. Warmup/capacity directions fail.","timestamp":1783253562854,"segment":3,"confidence":2.047734438104171,"asi":{"hypothesis":"LR warmup (standard stabilizer, absent here) would improve the champion / stabilize training","finding":"WARMUP HURTS badly. C=1 champion + warmup=200 -> ED 7314, sharp 0.24 (catastrophic blur). Warmup shifts the cosine LR profile enough that the chaotically-sensitive training lands in a bad blurry solution. Also tested warmup @C=2 @3000: train_loss still 1.44 (late divergence unfixed). Warmup is NOT a reliable lever here.","c2_pathology":"Pursued C=2 generalization blocker across 3 runs: C=2 none@3000 diverges (train_loss 1.44) - cliff is TRAINING-SETUP-wide (aggressive LR + velocity clamp), not corruption-specific. More capacity (ch=64, blocks=6) @C=2: still artifacts (sharp 1.78, train_loss 0.57) - NOT capacity-limited. The benchmark's C=2 setup is pathologically artifact-prone regardless of capacity/warmup/steps. Multichannel validation CANNOT be done in this toy - user must validate on their own well-behaved model.","conclusion":"Warmup and capacity directions both fail. Champion manifold_noise (630) stands. C=2 validation blocked by benchmark pathology (documented as honest limitation). Training-chaos sensitivity means schedule tweaks are unreliable."}}
{"run":73,"commit":"c61a4b1","metric":683.82,"metrics":{"ed_late":1106.27,"mmd":0.404124,"sharpness_ratio":1.006238,"mass_drift":0.023991,"train_loss":0.132175,"wall_s":73.6},"status":"discard","description":"NEGATIVE: EMA weight averaging doesn't help. decay 0.999 broken (init contamination, sharp 0.014); 0.99->651; 0.995->684 - all parity/worse than 630. Chaos is across-hyperparameter not within-run noise, so EMA can't help. Last principled lever exhausted. Champion (630) confirmed.","timestamp":1783254205226,"segment":3,"confidence":1.9291333750629012,"asi":{"hypothesis":"EMA of model weights smooths the chaotic training trajectory -> smoother predictions -> less rollout drift","finding":"NEGATIVE. EMA decay 0.999 -> ED 9569 sharp 0.014 (BLANK): init contamination (0.999^2000=0.135, 13.5% of EMA is untrained random init). decay 0.99 -> ED 651 (parity/slightly worse than 630). decay 0.995 -> ED 684 (worse). EMA is parity-to-worse across all usable decays.","why_ema_fails_here":"EMA helps when training has within-run SGD noise (averages many noisy steps). But this benchmark's 'chaos' is ACROSS-hyperparameter sensitivity, not within-run noise - the training is DETERMINISTIC. Averaging weights of a deterministic trajectory just lags it; doesn't find a better minimum. The good solution at 630 isn't a noisy version of a better one - it IS the solution.","conclusion":"EMA is the last principled lever - now exhausted all: corruption types/targets, sampling, training stabilizers (warmup, EMA, velocity-clamp), generalization. Champion manifold_noise (630) is the confirmed optimum. No remaining non-overfitting directions."}}
{"run":74,"commit":"c61a4b1","metric":7610.46,"metrics":{"ed_late":17771.38,"mmd":0.404124,"sharpness_ratio":0.379717,"mass_drift":0.449933,"train_loss":0.132175,"wall_s":71.73},"status":"discard","description":"RESOLVED: inference-time corruption HURTS (ED 7610 vs 630 decoupled). Confirms decoupled clean-inference extends to manifold_noise (model handles degradation, doesn't require it). All principled levers now exhausted including this last one. Champion (630, decoupled) confirmed.","timestamp":1783254417362,"segment":3,"confidence":1.6773023156546791,"asi":{"hypothesis":"manifold_noise model was TRAINED on degraded context, so applying the same corruption at INFERENCE would match the training distribution and help","finding":"RESOLVED - decoupled clean inference is CORRECT for manifold_noise too. MANIFOLD_INFER=1 -> ED 7610 sharp 0.38 (blurry), much worse than decoupled 630. At inference the rolled-out last frame is ALREADY the model's degraded output; adding training-corruption on top DOUBLE-DEGRADES it -> blank. The model learned to HANDLE degradation, not REQUIRE it.","principle_confirmed":"Decoupled clean-inference (feed clean context at inference even though trained on corrupted) extends to manifold_noise. Previously only established for noise-aug in hypersphere work. Train on degraded context, infer on clean - the model corrects for the degradation it sees, it doesn't need it injected again.","status":"Now genuinely exhausted ALL principled levers: corruption type/target, sampling order, all training stabilizers, EMA, AND inference-time corruption. No remaining non-overfitting hypotheses. Champion manifold_noise (630, decoupled) confirmed."}}
