{"type":"config","name":"Rollout stability for rectified-flow 2D video forecaster","metricName":"rollout_mmd","metricUnit":"","bestDirection":"lower"}
{"run":1,"commit":"e79b5b3","metric":0.404124,"metrics":{"sharpness_ratio":0.267066,"mass_drift":0.588021,"train_loss":0.16333,"mmd_floor":0.000306,"wall_s":63.09},"status":"keep","description":"BASELINE: decoupled Gaussian pixel-noise context aug (TECHNIQUE=pixnoise, SIGMA=0.4). Reproduces user's finding: pixel noise fails on structured image data — sharpness_ratio=0.27 (very blurry, ideal 1.0), mass_drift=0.59. This is the bar to beat.","timestamp":1783161526943,"segment":0,"confidence":null,"asi":{"hypothesis":"Pixel-noise context aug is the known-weak baseline for image data; should reproduce blur/mass-drift failure","setup":"2D video, IMG=32, C=1, K=2 ctx, Lorenz-driven blob, RF x-pred 1/(1-t)^2 weighted, 2000 train steps","finding":"Confirmed: pixnoise mmd=0.40, sharpness 0.27 (blurry), mass_drift 0.59. Noise floor mmd_floor~3e-4 (healthy). 64s/run.","technique":"pixnoise","sigma":0.4,"next":"Try blur (known to help per user) — should beat this and validate benchmark"}}
{"type":"config","name":"Rollout stability for rectified-flow 2D video forecaster (energy distance)","metricName":"rollout_ed","metricUnit":"","bestDirection":"lower"}
{"run":2,"commit":"5c57c8f","metric":9770.123047,"metrics":{"ed_late":15570.855469,"mmd":0.404124,"sharpness_ratio":0.176553,"mass_drift":0.649276,"train_loss":0.155876,"ed_floor":0,"wall_s":64.1},"status":"keep","description":"BASELINE (re-metric): pixnoise, now measured with energy distance (non-saturating). rollout_ed=9770, ed_late=15570. Metric switched because Gaussian-kernel MMD saturated identically at 0.404 for both pixnoise and blur.","timestamp":1783161830550,"segment":1,"confidence":null,"asi":{"finding":"Switched primary metric from Gaussian-kernel MMD (saturated at 0.404 for both pixnoise and blur — k_ab->0, mbb->1 ceiling) to ENERGY DISTANCE which is non-saturating. pixnoise ED=9770, ed_late=15570 (late drifts worse - good temporal signal), ed_floor=0 (healthy). huge dynamic range now.","metric_history":"MMD saturated identically (0.404124) for pixnoise AND blur -> useless. Energy distance fixes this.","next":"Run blur to confirm metric now discriminates (should differ from pixnoise). Then iterate techniques."}}
{"run":3,"commit":"4c7eadc","metric":5214.19873,"metrics":{"ed_late":6240.205566,"mmd":0.404124,"sharpness_ratio":1.649746,"mass_drift":0.28178,"train_loss":3.366411,"ed_floor":0,"wall_s":65.57},"status":"keep","description":"blur context aug BLUR_SIGMA=0.8: ED 9770->5214 (-47%), ed_late 15570->6240. Reproduces user finding that blur beats pixel noise. Cost: train_loss 0.16->3.37 (blur degrades condition), sharpness 1.65 (slight artifacts).","timestamp":1783161939208,"segment":1,"confidence":null,"asi":{"finding":"Blur(0.8) ED=5214 vs pixnoise 9770 (-47%). ed_late 6240 vs 15570. Confirms benchmark reproduces user's real-world finding: blur >> pixel noise for image rollout stability. BUT sharpness=1.65 (>1=artifacty) and train_loss=3.37 (blur degrades condition, harder to learn dynamics). Tradeoff: stability up, precision down + slight artifacts.","technique":"blur","blur_sigma":0.8,"next":"Try smaller blur sigma (0.5) for better dynamics learning; then novel techniques (selffeed scheduled sampling, manifold_noise) to beat blur without the artifact/precision cost"}}
{"run":4,"commit":"4a4b929","metric":725.313416,"metrics":{"ed_late":906.372986,"mmd":0.404124,"sharpness_ratio":0.881683,"mass_drift":0.078166,"train_loss":0.124715,"ed_floor":0,"wall_s":168.28},"status":"keep","description":"selffeed (scheduled sampling, prob=0.3) + mild blur 0.4: ED 5214->725 (7x better than blur, 13x vs pixnoise). sharpness 0.88 (ideal!), mass_drift 0.08, train_loss 0.12 (low). Fixes blur's artifacts+precision loss. The principled exposure-bias fix wins decisively.","timestamp":1783162146483,"segment":1,"confidence":2.01493444325497,"asi":{"finding":"BREAKTHROUGH: selffeed (scheduled sampling) ED=725 vs blur 5214 (7x) vs pixnoise 9770 (13x). sharpness 0.88 (near ideal 1.0!), mass_drift 0.08, train_loss 0.12 (lower than pixnoise - model learns dynamics fine since mostly real data). Fixes ALL of blur's problems (artifacts 1.65, precision loss 3.37). This is THE technique for rollout stability.","mechanism":"Feeds model its own 1-step predictions as context during training (prob 0.3) + mild blur 0.4 -> directly closes train/inference gap. Principled exposure-bias fix.","cost":"wall 168s vs 65s (2.6x) due to extra sampling in train loop","next":"Tune selffeed prob; try pure selffeed without blur; test deeper rollout stability"}}
{"run":5,"commit":"4a4b929","metric":1200.502808,"metrics":{"ed_late":2987.849609,"mmd":0.404124,"sharpness_ratio":0.647428,"mass_drift":0.236824,"train_loss":0.121897,"ed_floor":0,"wall_s":164.76},"status":"discard","description":"DISCARD: pure selffeed (no blur). ED 725->1200, ed_late 906->2988. Mild blur on self-fed context is needed — smooths model errors.","timestamp":1783162346815,"segment":1,"confidence":4.02986888650994,"asi":{"finding":"Pure selffeed (no blur) WORSE: ED 725->1200, ed_late 906->2988. The mild blur (0.4) on self-fed predictions is important - it smooths model errors giving cleaner degraded contexts. Combo selffeed+mild-blur is the winner, not pure scheduled sampling.","next":"Tune selffeed prob up (0.5); maybe multi-step selffeed (2-step predictions) for deeper exposure"}}
{"run":6,"commit":"4a4b929","metric":5868.844238,"metrics":{"ed_late":15739.15625,"mmd":0.404124,"sharpness_ratio":0.831942,"mass_drift":0.085069,"train_loss":0.122625,"ed_floor":0,"wall_s":171.08},"status":"discard","description":"DISCARD: selffeed prob=0.5 too aggressive. ED 725->5869, ed_late 906->15739 (late divergence).","timestamp":1783162545848,"segment":1,"confidence":2.253486513869498,"asi":{"finding":"selffeed prob=0.5 MUCH worse: ED 725->5869, ed_late 906->15739 (diverges late, near pixnoise level). Too much self-feeding on early bad predictions harms dynamics learning. Sharp phase transition around prob 0.3-0.5. sharpness/mass still ok (0.83/0.09) but late rollout explodes -> compounding error sensitivity.","next":"Try prob=0.2 (less aggressive). Note: high run-to-run variance in ed_late due to chaotic rollout amplification - may need multi-seed confirmation of best config."}}
{"run":7,"commit":"4a4b929","metric":1410.235718,"metrics":{"ed_late":3786.554199,"mmd":0.404124,"sharpness_ratio":0.727855,"mass_drift":0.16063,"train_loss":0.147024,"ed_floor":0,"wall_s":174},"status":"discard","description":"DISCARD: selffeed prob=0.2 ED=1410 (worse than 0.3). Optimum near 0.3.","timestamp":1783162746795,"segment":1,"confidence":3.8749563486833485,"asi":{"finding":"selffeed prob=0.2 ED=1410 (worse than 0.3's 725). Bracket: 0.2->1410, 0.3->725, 0.5->5869. Optimum near 0.3. But single-run variance on chaotic rollout is high - need to confirm 0.3 reproduces.","next":"Re-run prob=0.3 to confirm 725 reproduces (not noise)"}}
{"run":8,"commit":"4a4b929","metric":773.092468,"metrics":{"ed_late":1327.255249,"mmd":0.404124,"sharpness_ratio":0.777288,"mass_drift":0.140227,"train_loss":0.131145,"ed_floor":0,"wall_s":178.4},"status":"discard","description":"CONFIRM (discard dup): selffeed prob=0.3 reproduces ED=773 (vs 725 first). Robust.","timestamp":1783162999466,"segment":1,"confidence":13.205599532368565,"asi":{"finding":"CONFIRMED reproducible: selffeed prob=0.3 re-run ED=773 (first run 725), ed_late=1327. Robust ~7x better than blur. sharpness 0.78, mass_drift 0.14. Technique is real, not noise.","next":"Implement 2-step compounded selffeed (selffeed2) to expose deeper rollout errors"}}
{"run":9,"commit":"4a4b929","metric":988.777039,"metrics":{"ed_late":1695.052124,"mmd":0.404124,"sharpness_ratio":0.773591,"mass_drift":0.179197,"train_loss":0.17264,"ed_floor":0,"wall_s":280.28},"status":"discard","description":"DISCARD: selffeed2 (2-step compounded) ED=988 (worse than 1-step 725), 280s wall. 1-step self-feed sufficient.","timestamp":1783163388513,"segment":1,"confidence":16.26277839826263,"asi":{"finding":"selffeed2 (2-step compounded) ED=988 WORSE than 1-step selffeed 725, ed_late 1695, and 280s wall (1.6x slower). Deeper compounding doesn't help - 1-step exposure is sufficient, compounded context is noisier. Optimum is single-step scheduled sampling.","next":"Try manifold_noise (cheap on-manifold perturbation); then write up findings"}}
{"run":10,"commit":"946a605","metric":747.69574,"metrics":{"ed_late":1050.812866,"mmd":0.404124,"sharpness_ratio":0.895369,"mass_drift":0.06999,"train_loss":0.185955,"ed_floor":0,"wall_s":168.53},"status":"keep","description":"selffeed_m (selffeed + on-manifold amplitude jitter): ED=747 (parity w/ selffeed within noise) + sharpness 0.78->0.90, mass_drift 0.14->0.07. Quality win at equal stability. New champion config.","timestamp":1783163698706,"segment":1,"confidence":19.974974487368208,"asi":{"finding":"selffeed_m (selffeed + amplitude jitter): ED=747, TIED with selffeed (725/773 bracket, within noise) but sharpness 0.78->0.90 and mass_drift 0.14->0.07. On-manifold amplitude perturbation improves per-frame quality without hurting stability. Best overall config: sharp frames + stable rollout.","config":"TECHNIQUE=selffeed_m, SELFFEED_PROB=0.3, BLUR_SIGMA=1.0 (internal blur 0.4 + 8% amplitude jitter)","next":"Robustness: test on multichannel (C=2) and harder dynamics to confirm generalizes; write up findings"}}
{"run":11,"commit":"946a605","metric":5539.781738,"metrics":{"ed_late":11394.927734,"mmd":0.404124,"sharpness_ratio":0.462859,"mass_drift":0.411893,"train_loss":0.146145,"ed_floor":0,"wall_s":64.53},"status":"discard","description":"DISCARD: diff_forcing (per-frame pixel noise) ED=5540, sharpness 0.46. Fails like pixnoise - confirms all pixel-noise augs fail on image data.","timestamp":1783164167192,"segment":1,"confidence":15.899755898891843,"asi":{"finding":"diff_forcing (per-frame pixel noise) ED=5540, sharpness 0.46 - FAILS like pixnoise (only marginally better). Confirms: ALL pixel-noise-based context augmentation fails on structured image data regardless of schedule (pixnoise 9770, diff_forcing 5540). The noise TYPE matters more than the schedule. Only blur (structured) and selffeed (model-error) work.","next":"Curriculum selffeed: ramp p 0->0.3 over training to avoid early bad-prediction poisoning"}}
{"run":12,"commit":"946a605","metric":2908.159668,"metrics":{"ed_late":9470.994141,"mmd":0.404124,"sharpness_ratio":0.547134,"mass_drift":0.259479,"train_loss":0.103546,"ed_floor":0,"wall_s":174.12},"status":"discard","description":"DISCARD: curriculum selffeed (ramp 0->0.3) ED 747->2908. Reduces total exposure; early predictions don't poison. Constant p=0.3 is better.","timestamp":1783164439873,"segment":1,"confidence":13.205599532368565,"asi":{"finding":"Curriculum selffeed (ramp p 0->0.3 over 40%) WORSE: ED 747->2908, ed_late 9471, sharpness 0.55. Hypothesis (early bad predictions poison training) was WRONG - the ramp just reduces total self-feed exposure (avg p~0.21). Constant p=0.3 from start is better. Model benefits from MORE self-feed exposure, not less. Negative result, useful.","next":"Conclude - champion is selffeed_m (constant). Could try ramping DOWN or higher constant p with longer training, but diminishing returns."}}
{"run":13,"commit":"60b5cc4","metric":5939.73291,"metrics":{"ed_late":12283.242188,"mmd":0.404124,"sharpness_ratio":0.573457,"mass_drift":0.270486,"train_loss":0.438406,"ed_floor":0,"wall_s":65.97},"status":"discard","description":"DIAGNOSTIC: none (no aug) ED=5940. Shows pixnoise (9770) is WORSE than no-aug on slow image data - pixel noise actively harmful. selffeed_m 8x better than no-aug.","timestamp":1783165385015,"segment":1,"confidence":6.3575268170184405,"asi":{"finding":"none (no aug) on default slow regime: ED=5940, sharpness 0.57. CRUCIAL: pixnoise (9770) is WORSE than no augmentation (5940) on slow/weather-like image data - pixel noise is actively HARMFUL, not just unhelpful. selffeed_m (747) is ~8x better than no-aug and ~13x better than pixnoise. Completes the regime story: augmentation is essential (none fails), but the WRONG augmentation (pixel noise) is worse than nothing on slow image data, while scheduled sampling is dramatically the best.","regime_summary":"slow/weather: none=5940, pixnoise=9770 (harmful!), blur=5214, selffeed_m=747. fast/chaotic: none=7336, pixnoise=438 (works), selffeed_m=931."}}
{"run":14,"commit":"4bff33f","metric":1231.345581,"metrics":{"ed_late":2572.255859,"mmd":0.404124,"sharpness_ratio":0.726079,"mass_drift":0.187163,"train_loss":0.190526,"ed_floor":0,"wall_s":181.48},"status":"discard","description":"DISCARD: selffeed_m + inference blur 0.4. ED 747->1231. Inference-time blur hurts once scheduled sampling is in place.","timestamp":1783165668857,"segment":1,"confidence":13.205599532368565,"asi":{"finding":"selffeed_m + inference-time blur (0.4) HURTS: ED 747->1231, sharpness 0.90->0.73, ed_late 1051->2572. Once scheduled sampling handles stability, blurring clean rollout context is pure degradation. FINDINGS.md suggestion #3 (inference blur) does NOT compose with selffeed - it's only useful without scheduled sampling. Negative but useful: don't stack inference blur on selffeed.","next":"Loop has thoroughly explored the space (14 exps). Champion selffeed_m is robust. Could next try EMA-teacher surrogate or consistency loss but diminishing returns."}}
{"run":15,"commit":"4bff33f","metric":1218.218384,"metrics":{"ed_late":2480.970703,"mmd":0.404124,"sharpness_ratio":0.759739,"mass_drift":0.161294,"train_loss":0.216103,"ed_floor":0,"wall_s":180.25},"status":"discard","description":"DISCARD: selffeed_ema_m (EMA teacher surrogate) ED 747->1218. Live model is the correct surrogate for scheduled sampling (matches inference distribution); lagging EMA is worse.","timestamp":1783166064397,"segment":1,"confidence":15.480104818825895,"asi":{"finding":"selffeed_ema_m (EMA teacher surrogate, decay 0.999) WORSE: ED 747->1218, ed_late 1051->2481, sharpness 0.90->0.76. Hypothesis (cleaner EMA surrogate) was WRONG. Reason: for scheduled sampling the LIVE model is the correct surrogate - at inference the model sees its own CURRENT predictions, so training on live-model predictions matches the inference distribution. A lagging EMA teacher (stale ~1000 steps behind) gives lower-quality contexts that mismatch inference. EMA teacher suits consistency DISTILLATION (stable target), not scheduled sampling (match own behavior).","next":"Try selffeed_m + spectral/TV regularizer (cheap, targets sharpness 0.90->1.0); distinct mechanism"}}
{"run":16,"commit":"4bff33f","metric":750.729187,"metrics":{"ed_late":1241.022339,"mmd":0.404124,"sharpness_ratio":0.811789,"mass_drift":0.124458,"train_loss":0.180181,"ed_floor":0,"wall_s":202.65},"status":"discard","description":"DISCARD: selffeed_spec (spectral loss) ED=750 tied w/ champion 747, sharpness 0.81 slightly worse. Spectral regularizer doesn't help.","timestamp":1783166358267,"segment":1,"confidence":18.701152909094,"asi":{"finding":"selffeed_spec (selffeed_m + spectral/TV HF-penalty loss, w=1e-2): ED=750.7 TIED with champion 747 (within noise), sharpness 0.81 slightly WORSE than 0.90. The one-sided Laplacian-energy penalty doesn't push sharpness to 1.0 and doesn't help ED. Champion selffeed_m robust against EMA-teacher and spectral-loss challenges.","champion_status":"selffeed_m (ED~747, sharpness 0.90) confirmed robust. Tried-and-failed additions: EMA teacher (1218), spectral loss (750 tie), curriculum (2908), 2-step (988), inference blur (1231), prob!=0.3 (worse).","next":"Try restart/noise-injection during ODE sampling (stochastic sampler) - distinct sampling-side mechanism attacking error compounding directly"}}
{"run":17,"commit":"29aac15","metric":284.919464,"metrics":{"ed_late":274.718353,"mmd":0.404124,"sharpness_ratio":1.106511,"mass_drift":0.051774,"train_loss":0.15271,"ed_floor":0,"wall_s":184.04},"status":"keep","description":"selffeed_m BLUR_SIGMA=1.5 (internal blur 0.6): ED 747->285 (2.6x better!). ed_late 275<ed overall -> rollout stable end-to-end, no late divergence. New champion. Sharpness 1.11 (mild artifacts).","timestamp":1783168339789,"segment":1,"confidence":19.42584992789687,"asi":{"finding":"BREAKTHROUGH: stronger internal self-feed blur (BLUR_SIGMA=1.5 -> internal 0.6 vs old 0.4) ED 747->285 (2.6x better!). ed_late=275 LOWER than overall ed=285 -> rollout stable end-to-end, NO late divergence. mass_drift 0.05, train_loss 0.15. sharpness 1.11 (slightly over 1.0, mild artifacts - stronger blur pushes texture up). The internal blur on self-fed context is a key knob - sweeeping it found a much better operating point.","mechanism":"Stronger blur on the model's self-fed prediction smooths its errors MORE into plausible degraded contexts -> better robustness signal. Optimal is higher than the 0.4 I'd been using.","next":"Sweep BLUR_SIGMA further (1.2, 2.0) to find optimum and check sharpness tradeoff"}}
{"run":18,"commit":"29aac15","metric":2349.587158,"metrics":{"ed_late":2453.661133,"mmd":0.404124,"sharpness_ratio":1.441699,"mass_drift":0.196356,"train_loss":0.236389,"ed_floor":0,"wall_s":185},"status":"discard","description":"DISCARD: BLUR_SIGMA=2.0 ED 285->2349, sharpness 1.44. Over-smoothed context hurts. Optimum near 1.5.","timestamp":1783168563603,"segment":1,"confidence":18.744270105834076,"asi":{"finding":"BLUR_SIGMA=2.0 (internal 0.8) MUCH WORSE: ED 285->2349, sharpness 1.44 (too artifacty), train_loss 0.24 (up). Over-smoothed context hurts dynamics learning. Curve: 1.0(0.4)->747, 1.5(0.6)->285, 2.0(0.8)->2349. Sharp valley, optimum near 1.5. Too much blur is as bad as too little.","next":"Try 1.3 to refine optimum (less artifacty than 1.5's sharpness 1.11)"}}
{"run":19,"commit":"29aac15","metric":1145.394043,"metrics":{"ed_late":1163.002319,"mmd":0.404124,"sharpness_ratio":1.128465,"mass_drift":0.069839,"train_loss":0.189881,"ed_floor":0,"wall_s":169.51},"status":"discard","description":"DISCARD: BLUR_SIGMA=1.3 ED=1145. Non-monotonic vs 1.0(747)/1.5(285) -> variance suspect; must re-confirm 1.5.","timestamp":1783168791297,"segment":1,"confidence":19.42584992789687,"asi":{"finding":"BLUR_SIGMA=1.3 ED=1145 - WORSE than both 1.0(747) and 1.5(285). Non-monotonic curve (747->1145->285->2349 for 1.0/1.3/1.5/2.0) is suspicious - suggests the 1.5=285 result may be partly lucky low draw due to chaotic-rollout variance. MUST re-confirm 1.5 before trusting it.","next":"Re-run BLUR_SIGMA=1.5 to confirm 285 reproduces (not noise). Critical - don't overfit to lucky run."}}
{"run":20,"commit":"29aac15","metric":758.145935,"metrics":{"ed_late":775.907776,"mmd":0.404124,"sharpness_ratio":1.14777,"mass_drift":0.071957,"train_loss":0.199999,"ed_floor":0,"wall_s":169.62},"status":"discard","description":"CORRECTION (discard): re-run BLUR_SIGMA=1.5 gives 758 not 285. The 284.9 was a non-reproducing noise outlier. Blur sweep is within noise (~750). Champion selffeed_m ~750 stands.","timestamp":1783169038126,"segment":1,"confidence":20.158867387049703,"asi":{"finding":"RE-RUN of BLUR_SIGMA=1.5 gives ED=758, NOT 285. The 284.9 (commit 29aac15) was a NON-REPRODUCING lucky low draw from chaotic-rollout variance. CORRECTION: selffeed_m is ~750 at BLUR_SIGMA 1.0 (725/747/773) AND 1.5 (285-lucky/758) AND 1.3 (1145) - the blur sweep is WITHIN NOISE, no real improvement found. Real champion remains selffeed_m at ~750. The dashboard 'best' of 284.9 is a false floor - true operating point is ~750; future improvements must clear ~750 consistently, not 285.","correction":"284.9 was noise outlier. Effective baseline to beat = ~750 (selffeed_m, BLUR_SIGMA 1.0-1.5 equivalent).","next":"Blur sweep exhausted (within noise). Revert run.env to BLUR_SIGMA=1.0. Champion selffeed_m (~750, 13x pixnoise) stands. Try a genuinely different mechanism (restart sampling) or conclude."}}
{"type":"config","name":"Rollout stability (deterministic regime) — reproducible single runs","metricName":"rollout_ed","metricUnit":"","bestDirection":"lower"}
{"run":21,"commit":"1970fd7","metric":6745.928223,"metrics":{"ed_late":10999.280273,"mmd":0.404124,"sharpness_ratio":0.221812,"mass_drift":0.640375,"train_loss":0.159699,"ed_floor":0,"wall_s":67.61},"status":"keep","description":"BASELINE (deterministic regime): pixnoise ED=6746, sharpness 0.22. Deterministic mode makes runs reproducible (fixes the false-285 noise issue). ~20% slower but trustworthy.","timestamp":1783169714481,"segment":2,"confidence":null,"asi":{"finding":"DETERMINISTIC baseline pixnoise: ED=6746 (reproducible). sharpness 0.22 (blurry), mass_drift 0.64. Deterministic mode (torch.use_deterministic_algorithms + CUBLAS_WORKSPACE_CONFIG + cudnn.deterministic) eliminates the GPU non-determinism that caused false results (the 284.9 outlier). Single runs now reproduce exactly (verified: selffeed_m gave 912.186462 twice). Cost: ~20% slower (170s->205s). All future comparisons are trustworthy.","regime_change":"Switched to deterministic CUDA. Prior non-deterministic numbers archived but ranking holds (large gaps). pixnoise 6746 is the reproducible baseline to beat."}}
