{"run":135,"commit":"1e4c0b9","metric":1900.42,"metrics":{"ed_late":2457.828613,"mmd":0.404124,"sharpness_ratio":0.802962,"mass_drift":0.105092,"train_loss":0.055821,"wall_s":189.78},"status":"discard","description":"Gentle power-norm (PROB=0.15, EMBED=0.05, BLOCK0=0.025): ED 1553→1900, sharp 0.84→0.80, mass 0.086→0.105, train_loss 0.0075→0.056. Still worse. Power-norm sharpness hit milder than old corruption (-3.6% vs -8.4%) but no ED benefit.","timestamp":1783337821697,"segment":4,"confidence":1.1410359844001148,"asi":{"finding":"Gentle power-norm (PROB=0.15, half scales EMBED=0.05 BLOCK0=0.025): ED 1553->1900, sharp 0.84->0.80, mass 0.086->0.105, train_loss 0.0075->0.056. Still worse. Train_loss rose MORE than PROB=0.3 (0.056 vs 0.033) - variance, but no ED benefit at any magnitude so far.","partial_vindication":"Power-norm sharpness hit is MILDER than old corruption: PROB=0.3 sharp -3.6% (0.84->0.81) vs old run128 -8.4% (0.83->0.76). The power-norm DOES reduce blurring as hypothesized, but doesn't translate to ED improvement on a well-calibrated model.","confound_checked":"Corruption IS gated by self.training in jit3d.forward (corrupt_embed/corrupt_block0 only run if self.training). Inference rollout uses clean context = correct decoupled protocol. Results valid.","mechanism":"On well-calibrated ViT (train_loss 0.0075), corruption is pure robustness tax: train_loss rises (model must be robust to corrupted context) but inference context is clean so no rollout benefit. Not an overfitting problem (smaller ViT was worse, run 132).","next":"Test (a) embed-only injection (block0=0) on champion, (b) WCLAMP=50 regime where OLD corruption helped SEED=0 - direct power-norm vs old-corruption comparison."}}
{"run":136,"commit":"1e4c0b9","metric":1508.02,"metrics":{"ed_late":1932.98291,"mmd":0.404124,"sharpness_ratio":0.824442,"mass_drift":0.092931,"train_loss":0.033623,"wall_s":193.48},"status":"discard","description":"Embed-only power-norm (PROB=0.3, EMBED=0.10, BLOCK0=0.0): ED 1508 vs 1553 (-2.9%, borderline). block0 stage was the harmful one. Sharp/mass/train_loss slightly worse. Re-running to confirm determinism.","timestamp":1783338133315,"segment":4,"confidence":1.0883290914621218,"asi":{"finding":"Embed-ONLY power-norm (PROB=0.3, EMBED=0.10, BLOCK0=0.0): ED 1508 vs baseline 1553 (-2.9%, borderline), sharp 0.84->0.82, mass 0.086->0.093, train_loss 0.0075->0.034. The BLOCK0 stage was the harmful one - removing it brings corruption to ~neutral.","key_insight":"Two-stage corruption (embed+block0) hurts (ED 1984); embed-only is ~neutral (1508). block0 injection (after 1 attn layer, more abstract features) is where the damage happens. This isolates the failure: corrupting post-attention features is much worse than raw patch features.","caveat":"ED gain 2.9% is within noise range (session uses deterministic mode but env drift between sessions ~28%). Sharpness/mass/train_loss all slightly worse. NOT a clear win - must re-run to confirm within-session determinism before trusting.","next":"Re-run exact embed-only config to confirm 1508 is deterministic. If reproducible, sweep EMBED magnitude (0.05, 0.20) to find optimum."}}
{"run":137,"commit":"1e4c0b9","metric":1542.59,"metrics":{"ed_late":2014.471802,"mmd":0.404124,"sharpness_ratio":0.808085,"mass_drift":0.100629,"train_loss":0.033646,"wall_s":191.18},"status":"discard","description":"CONFIRM embed-only is NEUTRAL (noise): re-run gave 1543 vs 1508. Within-session non-determinism ~2.3%. Power-norm corruption neutral-to-harmful on champion at all magnitudes/stages. Sharpness always drops, train_loss always rises. Pivoting to WCLAMP=50 regime.","timestamp":1783338397292,"segment":4,"confidence":1.0883739586776553,"asi":{"confirmation":"Re-ran embed-only (identical config): ED 1543 vs first run 1508. WITHIN-SESSION NON-DETERMINISM ~2.3% (despite CUBLAS_WORKSPACE_CONFIG + deterministic settings - torch.rand in corruption mask + residual GPU noise). The 1508 'improvement' was NOISE.","noise_floor":"~2-3% within-session ED noise. Must see >5-6% improvement to trust. Baseline 1553, embed-only 1508/1543 (avg 1525) = within noise = NEUTRAL.","conclusion_champion_regime":"Power-norm corruption on well-calibrated WCLAMP=6 champion: two-stage HURTS (ED 1984), embed-only NEUTRAL (1525 vs 1553). Sharpness ALWAYS drops (0.81-0.82 vs 0.84), train_loss ALWAYS rises 4.5x. No beneficial config found on the champion.","partial_vindication_stands":"Power-norm sharpness hit (-3.6%) milder than old corruption (-8.4%) - the normalization DOES reduce blurring, but not enough to yield ED gain on a model that doesn't need the regularization.","next":"Pivot to WCLAMP=50 regime (less-calibrated, where OLD corruption helped SEED=0: 26104->23933). Re-baseline WCLAMP=50 no-aug AVG4 in THIS env first (prior 21636 was old env), then test power-norm there for direct power-norm-vs-old comparison."}}
{"run":138,"commit":"1e4c0b9","metric":4410.03,"metrics":{"ed_late":7741.405273,"mmd":0.404124,"sharpness_ratio":0.160148,"mass_drift":0.732024,"train_loss":0.056834,"wall_s":166.51},"status":"discard","description":"WCLAMP=50 no-aug AVG4 SEED=0 (THIS env): ED 4410, sharp 0.16, mass 0.73. Degraded/blurry regime (env shifted from old 21636). Baseline for corruption test in the regime where old corruption helped.","timestamp":1783338627040,"segment":4,"confidence":1.125222467157416,"asi":{"wclamp50_baseline_this_env":"WCLAMP=50 no-aug AVG4 SEED=0 (current env): ED 4410, sharp 0.16, mass 0.73, train_loss 0.057. MUCH better than old env's 21636 - env shifted massively (confirms why old absolute numbers aren't reproducible).","regime_character":"WCLAMP=50 = blurry/degraded regime here: sharp 0.16 (vs WCLAMP=6's 0.84), mass 0.73 (vs 0.086). Model under-emphasizes t~=0 forecasting direction -> blurry mean-regressed rollout. This is the regime where corruption's regularization (force robustness to corrupted context) previously helped.","next":"Test power-norm two-stage corruption (PROB=0.3 EMBED=0.10 BLOCK0=0.05 = production defaults) at WCLAMP=50. Direct comparison to old corruption's SEED=0 win (old env 26104->23933). In THIS env baseline is 4410; if corruption < 4410 with sharpness UP, power-norm helps the undertrained regime."}}
{"run":139,"commit":"1e4c0b9","metric":1568.51,"metrics":{"ed_late":1945.914185,"mmd":0.404124,"sharpness_ratio":0.162185,"mass_drift":0.793899,"train_loss":0.268751,"wall_s":190.55},"status":"discard","description":"WCLAMP=50 two-stage power-norm: ED 4410→1568 (-64%) BUT sharp FLAT 0.16, mass WORSE 0.79, train_loss 5x. METRIC-GAMING artifact (blur→pooled-feature mean regression). Sharpness+mass tell truth: no real gain. Corruption crudely mimics the WCLAMP=6 fix.","timestamp":1783338901554,"segment":4,"confidence":1.0780288471442738,"asi":{"finding":"Power-norm two-stage at WCLAMP=50: ED 4410->1568 (-64%!) BUT sharpness FLAT (0.16->0.16), mass WORSE (0.73->0.79), train_loss 5x (0.057->0.27). This is the METRIC-GAMING artifact: ED improves because blurrier frames' pooled features regress toward reference mean, NOT real quality.","truth_tellers":"Sharpness (flat 0.16) and mass_drift (worse 0.79) reveal no real improvement. ED is fooled by mean regression. CONFIRMS prior session's warning: for the ViT, trust sharpness+mass, not ED, when corruption is active.","profound_insight":"Corruption at high-WCLAMP (blurry regime) partially mimics LOWERING WCLAMP (shifting toward t~=0 forecasting) but crudely + with metric-gaming. ED 1568 here is suspiciously close to the WCLAMP=6 baseline (1553) - corruption is a crude proxy for the clean WCLAMP=6 fix. The right lever is WCLAMP=6, not corruption.","next":"Test embed-only at WCLAMP=50 (blurs less at WCLAMP=6). If it raises SHARPNESS above 0.16 (real deblurring) with ED<4410, it's a genuine win. If sharpness stays 0.16, confirms all corruption here is metric-gaming."}}
{"run":140,"commit":"1e4c0b9","metric":913.02,"metrics":{"ed_late":1096.532104,"mmd":0.404124,"sharpness_ratio":0.156563,"mass_drift":0.788689,"train_loss":0.273542,"wall_s":189},"status":"discard","description":"DEFINITIVE metric-gaming: embed-only WCLAMP=50 ED 913 (<champion's 1553!) but sharp STUCK 0.16, mass 0.79. ED meaningless under corruption. Power-norm fails identically to old corruption. Final test: latent-dropout angle on champion.","timestamp":1783339165553,"segment":4,"confidence":1.1562596422836084,"asi":{"DEFINITIVE_metric_gaming":"Embed-only at WCLAMP=50: ED 913 (BELOW the WCLAMP=6 champion's 1553!) yet sharpness STUCK 0.157, mass 0.79, train_loss 0.27. ED keeps dropping as corruption increases mean-regression, while sharpness/mass stay at degraded values. ED is COMPLETELY MEANINGLESS when corruption is active in the blurry regime.","rule":"When corruption is active, trust sharpness_ratio + mass_drift, NEVER rollout_ed. ED is fooled by blur->pooled-feature mean regression. This is the single most important methodological lesson.","power_norm_vs_old_identical_failure":"Power-norm corruption fails identically to old global mean/std corruption: neutral-to-hurt on well-calibrated model (WCLAMP=6), metric-gaming on blurry model (WCLAMP=50). The ONLY difference: power-norm blurs slightly less (sharpness hit -3.6% vs -8.4% on champion). Normalization geometry doesn't change the fundamental failure.","next":"Final test: 'corruption as latent dropout' (gentle+frequent: PROB=0.7 EMBED=0.03 embed-only) on WCLAMP=6 champion. Rules out whether ANY power-norm config acts as a beneficial regularizer on a non-overfitting model."}}
{"run":141,"commit":"1e4c0b9","metric":1440.88,"metrics":{"ed_late":1633.409912,"mmd":0.404124,"sharpness_ratio":0.885844,"mass_drift":0.056935,"train_loss":0.045084,"wall_s":190.74},"status":"discard","description":"BREAKTHROUGH candidate: latent-dropout corruption (PROB=0.7 EMBED=0.03 embed-only) on champion → ALL metrics improve: ED 1441 (-7.2%), sharp UP 0.89, mass 0.057. Gentle+frequent=dropout regime (vs strong+sparse=blur). Confirming next.","timestamp":1783339419598,"segment":4,"confidence":1.2421512384482287,"asi":{"BREAKTHROUGH_candidate":"'Corruption as latent dropout' (PROB=0.7, EMBED=0.03, embed-only, WCLAMP=6): ALL metrics IMPROVE - ED 1553->1441 (-7.2%), sharpness UP 0.84->0.89 (SHARPER not blurrier!), mass 0.086->0.057 (-33%), ed_late 1759->1633. OPPOSITE of every prior corruption config.","mechanism":"Gentle+frequent corruption = latent dropout. Strong+sparse (PROB=0.3 EMBED=0.10) destroys info and blurs (sharp 0.81). Gentle+frequent (PROB=0.7 EMBED=0.03) prevents over-reliance on single tokens -> spreads attention -> better generalization -> sharper rollout. This IS the user's 'uniform info spread' hypothesis, but it only works in the gentle+frequent (dropout) regime, not strong+sparse.","vs_prior_embed_only":"Prior embed-only PROB=0.3 EMBED=0.10: ED neutral 1508/1543, sharp DOWN 0.81. This PROB=0.7 EMBED=0.03: ED down 1441, sharp UP 0.89. The LEVER is gentle+frequent (high PROB + low scale), exactly the dropout regime.","real_not_metric_gaming":"Sharpness UP + mass DOWN confirms REAL improvement, not blur-metric-gaming (which shows sharp flat/down + mass up).","next":"MUST confirm with re-run (noise floor ~2-3%; ED -7.2% is above but verify). Then sweep: vary PROB (0.5, 0.9) and EMBED (0.02, 0.05) to find optimum and verify SEED=2."}}
{"run":142,"commit":"1e4c0b9","metric":1751.83,"metrics":{"ed_late":2027.746582,"mmd":0.404124,"sharpness_ratio":0.867395,"mass_drift":0.065068,"train_loss":0.044777,"wall_s":192.72},"status":"discard","description":"Confirm PROB=0.7 EMBED=0.03: ED noisy (1441/1752, avg~baseline) but sharpness ROBUSTLY up (0.87-0.89 vs 0.84) and mass ROBUSTLY down (0.057-0.065 vs 0.086). Real quality gain; ED noisy from corruption RNG x chaos. Testing PROB=1.0 for lower variance.","timestamp":1783339703834,"segment":4,"confidence":1.2734210516023816,"asi":{"confirmation_result":"Re-run PROB=0.7 EMBED=0.03: ED 1752 (vs first 1441; avg 1597 ~ baseline 1553). HIGH ED VARIANCE (+21% between runs) from corruption mask RNG x chaotic rollout amplification.","robust_quality_gains":"Sharpness ROBUSTLY up: 0.89, 0.87 (both > baseline 0.84, +5-6%). Mass ROBUSTLY down: 0.057, 0.065 (both < baseline 0.086, -24-33%). These are the trustworthy ViT metrics (prior session: sharpness/mass > ED). The corruption genuinely improves per-frame forecast QUALITY.","mixed_picture":"Primary metric ED is noisy/neutral (avg 1597 ~ 1553), but secondary quality metrics robustly improve. For AR-stability the ED measures positional distribution match (chaotic, noisy); sharpness/mass measure per-frame quality (stable). The corruption helps the latter robustly.","variance_source":"torch.rand corruption mask (per-sample) differs each run -> different trained model -> chaotic rollout amplifies small trajectory diffs -> large ED swings. To reduce: PROB=1.0 (always corrupt, removes mask RNG) or accept ED noise and trust sharpness/mass.","next":"Try PROB=1.0 EMBED=0.03 (consistent corruption, lowest mask-variance). If ED robustly < baseline with sharpness up, clean win. Also consider EMBED=0.05 (slightly stronger reg) at PROB=0.7."}}
{"run":143,"commit":"1e4c0b9","metric":1825.33,"metrics":{"ed_late":1944.767456,"mmd":0.404124,"sharpness_ratio":0.836038,"mass_drift":0.073896,"train_loss":0.0074,"wall_s":164.02},"status":"discard","description":"Noise-floor established: no-corruption baseline ED 1553→1825 (+17.5%, train_loss stable). ED noise is inherent to chaotic rollout, not corruption. Single-run ED unreliable. Gentle corruption mean ED 1595 < baseline 1689 but within noise; sharpness/mass tend better.","timestamp":1783340472036,"segment":4,"confidence":1.3009531504574856,"asi":{"CRITICAL_noise_floor_finding":"No-corruption baseline re-run: ED 1553->1825 (+17.5%), but train_loss stable (0.0074-0.0075) and sharpness stable (0.836-0.844). The ~17% ED noise is INHERENT to the chaotic Lorenz rollout metric, NOT from corruption. Single-run ED comparisons are UNRELIABLE.","reframe":"Pooled gentle-corruption runs (PROB 0.7/1.0 EMBED 0.03): ED 1441,1752,1443,1744 -> mean 1595. Baseline: 1553,1825 -> mean 1689. Corruption mean is slightly BELOW baseline but within noise. Sharpness: corruption 0.867 vs baseline 0.84 (tendency up). Mass: corruption 0.065 vs baseline 0.080 (tendency down).","honest_status":"Gentle/frequent power-norm corruption shows a MODEST tendency to improve quality (sharpness/mass) and is slightly below baseline ED on average, but the benchmark's ±17% ED noise makes it impossible to confirm a clean win. It is the SAFE variant (doesn't hurt); strong/sparse clearly hurts.","implication_for_loop":"Cannot reliably optimize ED via single runs. Sharpness is the only stable metric. For production recommendation: gentle+frequent (PROB>=0.7 EMBED~0.03 embed-only) is safe and may slightly help; validate on real data where the metric may be less noisy.","next":"Probe EMBED=0.05 (slightly stronger gentle) for a more robust quality signal, then write up findings."}}
{"run":144,"commit":"1e4c0b9","metric":2543.29,"metrics":{"ed_late":3416.946045,"mmd":0.423551,"sharpness_ratio":0.799434,"mass_drift":0.089954,"train_loss":0.014049,"wall_s":212.88},"status":"discard","description":"2k trajectories @ BATCH=96/4500 steps UNDERTRAINS: ED 2543 (worse than 220's ~1689), train_loss 0.014 vs 0.0075. 9× data, same compute → 2.8 epochs vs 25. Need bigger batch/more steps. Testing BATCH=256 next.","timestamp":1783342011524,"segment":4,"confidence":1.313634438101386,"asi":{"finding":"2k trajectories at fixed compute (BATCH=96, 4500 steps) UNDERTRAINS: ED 2543 (worse than 220-traj's ~1689), sharp 0.80, train_loss 0.014 (vs 0.0075 at 220). 9x more data, same compute -> each trajectory seen ~2.8 epochs (vs ~25 at 220) -> less converged.","data_gen_cost":"2k data-gen adds ~50s (rendering 160k frames): 213s total vs ~165s for 220. Training cost per step unchanged; only startup slower.","implication":"More data needs proportionally more compute. Fully converging on 2k (156k windows) to train_loss 0.0075 would need ~9x views = impractical in 4-min budget. Compromise: scale BATCH up (parallel) to cover more data/step.","next":"BATCH=256 (2.7x) with 2k -> ~7.4 epochs, ~8min. Tests whether data diversity helps once reasonably trained. If still undertrains, 2k is impractical for this fast benchmark and we revert to 220 for the augmentor work."}}
{"run":145,"commit":"1e4c0b9","metric":1258.25,"metrics":{"ed_late":1291.594482,"mmd":0.423551,"sharpness_ratio":0.77443,"mass_drift":0.114908,"train_loss":0.029376,"wall_s":353.84},"status":"discard","description":"2k @ BATCH=256: ED 1258 (blur artifact) but sharp 0.77/mass 0.115 WORSE, train_loss 0.029 undertrained. 2k needs ~9× compute to converge; undertrained→blurry→ED metric-games. 2k not benchmarkable in 4-min budget. Pivoting augmentor work to 220-traj champion.","timestamp":1783342507748,"segment":4,"confidence":1.3157170219472052,"asi":{"finding":"2k @ BATCH=256: ED 1258 (looks better) BUT sharp 0.77 (worse than 220's 0.84), mass 0.115 (worse), train_loss 0.029 (vs 0.0075). This is the BLUR/UNDERTRAINING artifact: undertrained model regresses to mean -> lower ED via pooled-feature mean-regression, but sharpness/mass reveal WORSE quality. Trust sharpness/mass.","2k_not_benchmarkable":"2k needs ~9x compute to converge (156k windows vs 17k). At fixed/2.7x budget it undertrains -> blurry -> ED metric-games. Fully converging needs ~12-26 min/run. Impractical for the fast loop. The 2k 'ED improvement' at both BATCH=96 (2543) and BATCH=256 (1258) is NOT real - it's undertraining blur.","lr_batch_issue":"BATCH=256 with LR=1e-4 under-converged (train_loss 0.029 > BATCH=96's 0.014) - LR too low for the larger batch. Scaling LR up is risky (ViT LR-sensitive, 2e-4 knife-edge per prior session).","pivot_decision":"2k data is a PRODUCTION-scale lever (needs real compute), not benchmarkable here. For clean augmentor research: revert to 220-traj champion (well-trained, sharp 0.84, trustworthy metrics). Will validate augmentor on 2k only if it shows real promise on 220 (then a 12-min validation run is justified)."}}
{"run":146,"commit":"1e4c0b9","metric":2248.12,"metrics":{"ed_late":2685.559326,"mmd":0.404124,"sharpness_ratio":0.625728,"mass_drift":0.215612,"train_loss":0.045239,"wall_s":281.48},"status":"discard","description":"Learned adversarial augmentor (eps=0.05) HURTS: sharp 0.63, mass 0.22, ED 2248. Adversary attacks blob POSITION (highest-loss direction in position-critical task) → divergence. Same root cause as manifold_noise. Input-space adversarial unsuitable here.","timestamp":1783343279968,"segment":4,"confidence":1.413326311159469,"asi":{"result":"Learned adversarial augmentor (learned_adv, eps=0.05, warmup=500, 220-traj champion): ED 2248, sharp 0.63 (vs 0.84), mass 0.22 (vs 0.086), train_loss 0.045 (vs 0.0075). HURTS on every quality metric.","KEY_mechanism":"For a POSITION-CRITICAL forecasting task, the adversary's worst-case input perturbation attacks the BLOB POSITION first (position is the highest-loss direction). The model then cannot trust the context position -> positional divergence. SAME root cause as manifold_noise's positional divergence (prior session: input perturbation hurts ViT ED via position loss).","fundamental_limitation":"Input-space adversarial robustness training is unsuitable for position-critical forecasting: the adversary will always attack position (the easy high-loss target), which is the one thing the model must preserve. Sensor-noise robustness (texture) is a different, weaker target the adversary ignores in favor of position.","cost":"Adversarial 2-step training ~2x cost: 284s vs ~165s baseline (within budget edge).","gan_instability_adds":"Adversary LR 1e-3 vs model LR 1e-4 (10x faster) -> adversary dominates. Even if balanced, the position-attack is fundamental.","next":"Test high-freq-CONSTRAINED adversary (high-pass filter delta so it can ONLY attack texture/amplitude, not position = realistic sensor noise). If that also fails, input-space adversarial is definitively unsuitable here."}}
