{"run":22,"commit":"c624886","metric":912.186462,"metrics":{"ed_late":1240.320679,"mmd":0.404124,"sharpness_ratio":0.870535,"mass_drift":0.075921,"train_loss":0.1864,"ed_floor":0,"wall_s":215.99},"status":"keep","description":"CHAMPION (deterministic): selffeed_m ED=912, reproducible. 7.4x better than pixnoise (6746). sharpness 0.87, mass_drift 0.08. Trustworthy baseline for fine comparisons.","timestamp":1783169985560,"segment":2,"confidence":null,"asi":{"finding":"DETERMINISTIC champion selffeed_m: ED=912 (reproducible, 3rd identical run). vs pixnoise 6746 = 7.4x better. sharpness 0.87, mass_drift 0.08, ed_late 1240 (stable). This is the trustworthy baseline-to-beat for fine comparisons going forward.","deterministic_champion":"selffeed_m ED=912.186462 (BLUR_SIGMA=1.0, SELFFEED_PROB=0.3). Reproducible. 7.4x better than pixnoise."}}
{"run":23,"commit":"c624886","metric":1015.000671,"metrics":{"ed_late":1039.161255,"mmd":0.404124,"sharpness_ratio":1.211075,"mass_drift":0.104291,"train_loss":0.233966,"ed_floor":0,"wall_s":219.77},"status":"discard","description":"DISCARD (deterministic): BLUR_SIGMA=1.5 ED=1015 > 1.0's 912. Resolves blur sweep - 1.0 is genuinely better; earlier 285 was noise.","timestamp":1783170251870,"segment":2,"confidence":56.74061803072375,"asi":{"finding":"DETERMINISTIC BLUR_SIGMA=1.5: ED=1015, WORSE than 1.0 (912). sharpness 1.21 (artifacty), mass 0.10. This DEFINITIVELY resolves the noise-confounded blur sweep: the earlier 285 was pure GPU-non-determinism noise. BLUR_SIGMA=1.0 (internal 0.4) is genuinely the better operating point. Champion selffeed_m @ BLUR_SIGMA=1.0 = 912 (reproducible) stands.","deterministic_resolution":"Blur sweep: 1.0->912, 1.5->1015 (deterministic, reproducible). 1.0 wins. The non-deterministic 285/758/1145 were all noise."}}
{"run":24,"commit":"7ba5de2","metric":690.071045,"metrics":{"ed_late":710.560303,"mmd":0.404124,"sharpness_ratio":0.91034,"mass_drift":0.021371,"train_loss":0.078161,"ed_floor":0,"wall_s":301.92},"status":"keep","description":"selffeed_ms (selffeed_m + 2-step rollout loss): ED 912->690 (-24%), ed_late 1240->710, mass_drift 0.02, train_loss 0.08. Candidate — re-confirming reproducibility next.","timestamp":1783170889199,"segment":2,"confidence":37.27488473457942,"asi":{"finding":"selffeed_ms (selffeed_m + 2-step rollout loss, MS_PROB=0.3) DETERMINISTIC: ED 912->690 (-24%), ed_late 1240->710 (stable end-to-end), mass_drift 0.08->0.02, train_loss 0.19->0.08. Multi-step loss adds a loss term on predicting tgt2 from [ctx[:,1], model_pred(tgt)] - trains consistency over the model's OWN 2-step rollout, directly targeting compounding error. NEEDS re-confirmation (learned from false-285: verify reproducibility).","hypothesis":"Multi-step rollout loss closes the compounding gap that input-only selffeed augmentation misses","next":"RE-RUN identical config to confirm 690 reproduces (deterministic) before trusting"}}
{"run":25,"commit":"7ba5de2","metric":690.071045,"metrics":{"ed_late":710.560303,"mmd":0.404124,"sharpness_ratio":0.91034,"mass_drift":0.021371,"train_loss":0.078161,"ed_floor":0,"wall_s":305.35},"status":"discard","description":"CONFIRM (discard dup): selffeed_ms reproduces exactly 690.071045. Real reproducible improvement. New champion.","timestamp":1783171218412,"segment":2,"confidence":27.264461241787647,"asi":{"finding":"CONFIRMED REPRODUCIBLE: selffeed_ms re-run gives EXACTLY 690.071045 (identical to 6 decimals). The multi-step rollout loss is a REAL improvement (deterministic regime guarantees reproducibility). New champion: selffeed_ms ED=690 vs selffeed_m 912 (-24%), vs pixnoise 6746 (9.8x). ed_late 710 < ed overall (stable end-to-end).","champion":"selffeed_ms (selffeed_m + 2-step rollout loss MS_PROB=0.3). ED=690, sharpness 0.91, mass_drift 0.02, train_loss 0.08. Reproducible.","next":"Sweep MS_PROB (0.15, 0.5) to find optimum; maybe 3-step loss"}}
{"run":26,"commit":"7ba5de2","metric":1023.002869,"metrics":{"ed_late":1135.96814,"mmd":0.404124,"sharpness_ratio":0.809224,"mass_drift":0.109436,"train_loss":0.56292,"ed_floor":0,"wall_s":379.67},"status":"discard","description":"DISCARD: MS_PROB=0.5 ED 690->1023, train_loss 0.56. Too much multi-step on bad early preds. Optimum <=0.3.","timestamp":1783172005931,"segment":2,"confidence":36.378962546998814,"asi":{"finding":"MS_PROB=0.5 WORSE: ED 690->1023, train_loss 0.08->0.56, mass_drift 0.02->0.11. Too much multi-step training on early bad predictions harms dynamics. Also 380s wall (slow). Curve: 0.3->690, 0.5->1023. Optimum <= 0.3.","next":"Try MS_PROB=0.15 (less aggressive)"}}
{"run":27,"commit":"7ba5de2","metric":724.977234,"metrics":{"ed_late":738.286804,"mmd":0.404124,"sharpness_ratio":0.947073,"mass_drift":0.017994,"train_loss":1.286562,"ed_floor":0,"wall_s":263.26},"status":"discard","description":"DISCARD: MS_PROB=0.15 ED=725 (>0.3's 690), best sharpness 0.95. Sweep done: 0.3 optimal for ED.","timestamp":1783172312244,"segment":2,"confidence":32.348069818438645,"asi":{"finding":"MS_PROB=0.15: ED=725 (slightly worse than 0.3's 690) but best sharpness 0.95 and mass 0.018. MS_PROB sweep complete (deterministic): 0.15->725, 0.3->690 (optimum), 0.5->1023. Champion = selffeed_ms MS_PROB=0.3.","ms_sweep":"0.15->725(sharp0.95), 0.3->690(sharp0.91), 0.5->1023(sharp0.81). ED optimum 0.3; sharpness improves with less MS but ED worse."}}
{"run":28,"commit":"640aabc","metric":870.427429,"metrics":{"ed_late":938.534119,"mmd":0.404124,"sharpness_ratio":0.915578,"mass_drift":0.051348,"train_loss":0.100501,"ed_floor":0,"wall_s":370.97},"status":"discard","description":"DISCARD: MS_DEPTH=3 ED 690->870, slower. 2-step is the sweet spot; deeper compounding adds noise. Champion depth=2 confirmed.","timestamp":1783172914791,"segment":2,"confidence":40.63984078416609,"asi":{"finding":"MS_DEPTH=3 (3-step rollout loss) WORSE: ED 690->870, ed_late 710->938, 371s wall. Deeper compounding (2 chained detached rollouts) gives noisier loss signal + slower. 2-step is the sweet spot (matches 'single-step suffices' pattern). Champion selffeed_ms (MS_DEPTH=2, MS_PROB=0.3, ED=690) confirmed optimal depth.","depth_sweep":"MS_DEPTH 2->690 (optimum), 3->870. Deeper doesn't help.","next":"Generalization check: does selffeed_ms (new champion) generalize to C=2 multichannel? (selffeed_m did, but the added 2-step loss could overfit)"}}
{"run":29,"commit":"31770c9","metric":950.392517,"metrics":{"ed_late":1523.96228,"mmd":0.404124,"sharpness_ratio":0.750829,"mass_drift":0.15779,"train_loss":0.085525,"ed_floor":0,"wall_s":291.13},"status":"discard","description":"DISCARD: selffeed_ms_grad (BPTT) ED 690->950, sharpness 0.75 (collapse). Detach is correct - gradient through prediction causes mode collapse. Validates champion.","timestamp":1783173888674,"segment":2,"confidence":54.64765860889172,"asi":{"finding":"selffeed_ms_grad (BPTT through multi-step loss, gradient-enabled pred1) WORSE: ED 690->950, sharpness 0.91->0.75 (mode-collapse signal), mass_drift 0.02->0.16, ed_late 710->1524. Gradient through the prediction rewards 'easy-to-predict-from' outputs -> partial collapse. DETACH is correct for both input-context selffeed AND the multi-step loss: decoupled training of tolerance/robustness beats coupled optimization. Validates champion design.","design_principle":"For scheduled-sampling / multi-step rollout loss, DETACH the model's own predictions. Gradient (BPTT) causes mode collapse. The detached version trains robustness; the gradient version rewards degenerate outputs."}}
{"run":30,"commit":"c226014","metric":156.337662,"metrics":{"ed_late":157.121506,"mmd":0.404124,"sharpness_ratio":0.919404,"mass_drift":0.030504,"train_loss":0.098784,"ed_floor":0,"wall_s":531.05},"status":"keep","description":"TRAIN_STEPS=3500: ED 690->156 (4.4x), ed_late 710->157. Model was undertrained. Rollout ED compounds per-step gains. Candidate - re-confirming.","timestamp":1783174585927,"segment":2,"confidence":44.221635907260115,"asi":{"finding":"TRAIN_STEPS=3500 (was 2000): ED 690->156 (4.4x better!), ed_late 710->157 (rock-stable end-to-end). The model was UNDERTRAINED at 2000 steps. Mechanism: rollout stability is a COMPOUNDING measure - small per-step prediction improvements compound over 50 AR steps into large ED differences. train_loss only 0.08->0.10 (similar) but rollout ED 4.4x better. Legitimate (held-out eval, not overfitting). NEEDS re-confirmation (large gain, learned false-285 lesson).","hypothesis":"Model undertrained at 2000 steps; more training improves rollout stability super-linearly (compounding)","next":"RE-RUN TRAIN_STEPS=3500 to confirm 156 reproduces (deterministic); then try 5000 to find convergence"}}
{"run":31,"commit":"c226014","metric":156.337662,"metrics":{"ed_late":157.121506,"mmd":0.404124,"sharpness_ratio":0.919404,"mass_drift":0.030504,"train_loss":0.098784,"ed_floor":0,"wall_s":556.76},"status":"discard","description":"CONFIRM (discard dup): TRAIN_STEPS=3500 reproduces exactly 156.337662. Real. Champion ED=156.","timestamp":1783175185157,"segment":2,"confidence":43.18906477346549,"asi":{"finding":"CONFIRMED REPRODUCIBLE: TRAIN_STEPS=3500 re-run = exactly 156.337662. Real. New champion ED=156 (43x better than pixnoise 6746). ed_late 157 (rock-stable). The model was undertrained at 2000.","note":"All prior comparisons (pixnoise 6746, selffeed_m 912, selffeed_ms 690) were at TRAIN_STEPS=2000. Training budget is now a lever. Fair technique comparison requires re-baselining pixnoise at the chosen budget - but the selffeed_ms>>pixnoise ranking is robust (held across budgets implicitly).","next":"Try TRAIN_STEPS=5000 to find convergence; then re-baseline pixnoise at chosen budget for fair comparison"}}
{"run":32,"commit":"c226014","metric":0,"metrics":{"ed_late":0,"mmd":0,"sharpness_ratio":0,"mass_drift":0,"train_loss":0,"ed_floor":0,"wall_s":806},"status":"crash","description":"CRASH (timeout): TRAIN_STEPS=5000 too slow. Budget is compute lever - will verify ranking budget-independence instead.","timestamp":1783176059468,"segment":2,"confidence":43.18906477346549,"asi":{"finding":"TRAIN_STEPS=5000 TIMED OUT (reached step 4500/5000, ~750s). Too slow. Training budget is a COMPUTE lever, not a technique. Need pixnoise@3500 fairness check to confirm ranking is budget-independent, then keep fixed regime."}}
{"run":33,"commit":"c226014","metric":2886.992676,"metrics":{"ed_late":5624.997559,"mmd":0.404124,"sharpness_ratio":0.670443,"mass_drift":0.261288,"train_loss":1.748758,"ed_floor":0,"wall_s":114.17},"status":"discard","description":"DIAGNOSTIC (discard): pixnoise@3500 ED=2887 vs selffeed_ms@3500=156. Ranking budget-independent, widens 9.8x->18.5x. Technique not compute.","timestamp":1783176234826,"segment":2,"confidence":35.85531587214965,"asi":{"finding":"FAIRNESS CHECK PASSED: technique ranking is BUDGET-INDEPENDENT and WIDENS with training. pixnoise: 6746@2000 -> 2887@3500. selffeed_ms: 690@2000 -> 156@3500. Ratio WIDENS 9.8x -> 18.5x. Both improve with training (compounding) but selffeed_ms improves MUCH faster. The win is the TECHNIQUE, not compute. Not overfitting to the 2000-step budget.","budget_axis":"selffeed_ms vs pixnoise: 9.8x@2000, 18.5x@3500. Technique robust across budgets. TRAIN_STEPS=5000 impractical (timeout). Standard regime = 2000 for iteration; 3500 (156) for max quality."}}
{"run":34,"commit":"3a3d423","metric":12711.995117,"metrics":{"ed_late":23463.605469,"mmd":0.404124,"sharpness_ratio":0.218178,"mass_drift":0.569277,"train_loss":0.181326,"ed_floor":0,"wall_s":79.68},"status":"discard","description":"DISCARD: vae_noise (beta=1e-3,noise=0.5) ED=12712 (worse than pixnoise!), sharpness 0.22. VAE gives blurry corruptions -> same mean-regression failure as pixel noise.","timestamp":1783177340111,"segment":2,"confidence":29.667416381997477,"asi":{"finding":"vae_noise (VAE-latent corruption, beta=1e-3, noise=0.5) FAILED: ED 12712 (worse than pixnoise 6746!), sharpness 0.22 (same catastrophic blur as pixel noise). DIAGNOSIS: VAE recon is blurry + latent noise -> decoder regresses to mean -> corrupted contexts are blurry/mean-ish -> model learns mean regression (identical failure to pixel noise). KEY INSIGHT reaffirmed: self-feed works because model's own outputs are SHARP-but-slightly-wrong; blurry corruptions (pixel OR VAE) just teach blur. Need SHARP on-manifold corruption.","next":"Try sharp autoencoder (beta=1e-5, basically AE) + smaller noise (0.2) so corruptions stay sharp and on-manifold"}}
{"run":35,"commit":"bd0cb51","metric":2077.054199,"metrics":{"ed_late":4179.978027,"mmd":0.404124,"sharpness_ratio":0.780902,"mass_drift":0.13941,"train_loss":0.219746,"ed_floor":0,"wall_s":82.09},"status":"discard","description":"DISCARD: vae_noise_blurj ED 1186->2077. Jitter over-corrupts with AE noise. Best no-self-feed VAE = vae_noise_blur (1186).","timestamp":1783177887957,"segment":2,"confidence":27.317938206006474,"asi":{"finding":"vae_noise_blurj (AE+blur+jitter) WORSE than vae_noise_blur: ED 1186->2077, sharp 0.93->0.78. Amplitude jitter over-corrupts on top of AE latent noise (unlike selffeed_m/manifold_noise where jitter helped). Best no-self-feed VAE variant = vae_noise_blur (AE-noise + mild blur, NO jitter), ED=1186, sharp 0.93.","next":"Get deterministic manifold_noise to complete no-self-feed comparison table for user"}}
{"run":36,"commit":"bd0cb51","metric":1186.483765,"metrics":{"ed_late":1572.813843,"mmd":0.404124,"sharpness_ratio":0.930548,"mass_drift":0.043219,"train_loss":0.141776,"ed_floor":0,"wall_s":83.51},"status":"discard","description":"vae_noise_blur (sharp AE+blur) CONFIRMED ED=1186 reproducible. Best no-self-feed technique (5.7x pixnoise). Worse than selffeed_ms(690) which needs self-outputs.","timestamp":1783178125199,"segment":2,"confidence":25.313280961318476,"asi":{"finding":"vae_noise_blur (sharp AE beta=1e-5 + latent noise 0.2 + mild blur 0.4) CONFIRMED reproducible: ED=1186.483765 (both runs identical). sharpness 0.93, mass_drift 0.04. This is the BEST no-self-feed technique (simulates rollout drift via a learned AE, no model self-outputs needed - answers user's 4->3 fixed-dataset constraint). 5.7x better than pixnoise. Worse than selffeed_ms (690) which needs self-outputs the user can't make.","no_self_feed_ranking":"pixnoise 6746 (sharp 0.22) < vae_noise_blurry 12712 (FAILS, sharp 0.22) < manifold_noise 2142 (sharp 1.26 artifacty) < vae_noise_sharpAE 2113 (sharp 0.77) < vae_noise_blur 1186 (sharp 0.93) BEST. Champion selffeed_ms 690 (needs self-outputs).","key_principle":"VAE/latent corruption MUST be sharp: a normal VAE (KL>0) blurs -> fails like pixel noise (mean regression). Use a sharp AUTOENCODER (beta~0, recon_mse~5e-6) + small latent noise + mild blur."}}
{"run":37,"commit":"65e2c92","metric":1600.429077,"metrics":{"ed_late":2758.655273,"mmd":0.404124,"sharpness_ratio":0.897484,"mass_drift":0.08699,"train_loss":0.164553,"ed_floor":0,"wall_s":77.05},"status":"discard","description":"DISCARD: VAE_NOISE=0.1 ED=1600 (>0.2's 1186). Less drift exposure hurts.","timestamp":1783178314431,"segment":2,"confidence":22.518849032556624,"asi":{"finding":"VAE_NOISE=0.1 (gentler) ED=1600, worse than 0.2 (1186). Less latent-noise drift exposure -> less robustness learned. Curve: 0.1->1600, 0.2->1186. Try higher (0.3, 0.4) to find optimum.","vae_noise_sweep":"0.1->1600 (sharp 0.90), 0.2->1186 (sharp 0.93). Optimum >= 0.2."}}
{"run":38,"commit":"65e2c92","metric":2111.916992,"metrics":{"ed_late":5209.83252,"mmd":0.404124,"sharpness_ratio":0.638979,"mass_drift":0.22952,"train_loss":0.134579,"ed_floor":0,"wall_s":80.24},"status":"discard","description":"DISCARD: VAE_NOISE=0.3 ED=2112. Sweep done: 0.2 optimal (1186). vae_noise_blur@0.2 = best no-self-feed.","timestamp":1783178461018,"segment":2,"confidence":20.28005461404126,"asi":{"finding":"VAE_NOISE=0.3 ED=2112 (worse), sharp 0.64 (off-manifold garbage). Sweep done: 0.1->1600, 0.2->1186 (OPTIMUM), 0.3->2112. Sharp valley at 0.2. vae_noise_blur@0.2=1186 confirmed best no-self-feed.","next":"Try manifold interpolation (latent blend toward another real frame) - stays on-manifold/sharp vs noise which drifts off-manifold"}}
{"run":39,"commit":"65e2c92","metric":1267.688354,"metrics":{"ed_late":1615.825073,"mmd":0.404124,"sharpness_ratio":1.1817,"mass_drift":0.080422,"train_loss":0.137321,"ed_floor":0,"wall_s":80.52},"status":"discard","description":"DISCARD: vae_interp_blur ED=1268 (>vae_noise_blur 1186), sharpness 1.18 artifacty. Interp gives two-blob blends. vae_noise_blur@0.2=1186 remains best no-self-feed.","timestamp":1783178681749,"segment":2,"confidence":20.033368913773558,"asi":{"finding":"vae_interp_blur (manifold interpolation: blend latent toward random real frame + blur) ED=1268, sharpness 1.18 (ARTIFACTY). Slightly worse than vae_noise_blur (1186, sharp 0.93). For blob data, latent interp produces two-blob blends (sharp but off-distribution -> artifacts); noise gives single-blob-slightly-off (better). vae_noise_blur@0.2=1186 remains best no-self-feed. NOTE: interp might differ for continuous weather fields (interpolating two plausible fields may be smoother than two blobs).","vae_summary":"No-self-feed ranking: vae_noise_blur@0.2=1186 (BEST, sharp 0.93) > vae_interp_blur=1268 (sharp 1.18) > vae_noise@0.2=2113 > manifold_noise=2142 > blurry VAE=12712 (fails). Champion selffeed_ms=690 needs self-outputs."}}
{"run":40,"commit":"53ce0e6","metric":1305.123901,"metrics":{"ed_late":2039.376831,"mmd":0.404124,"sharpness_ratio":1.026451,"mass_drift":0.005861,"train_loss":0.144665,"ed_floor":0,"wall_s":82.01},"status":"discard","description":"vae_interptemp_blur ED=1305 (vs noise 1186) but BEST sharpness 1.03, mass 0.006. Temporal interp = clean position shift. Tradeoff: noise=ED, temporal=sharpness.","timestamp":1783178984158,"segment":2,"confidence":19.792612438875775,"asi":{"finding":"vae_interptemp_blur (temporal-neighbor latent interpolation + blur): ED=1305 (slightly worse than vae_noise_blur 1186 on primary) BUT BEST per-frame quality of any no-self-feed technique: sharpness 1.03 (near-ideal, vs noise's 0.93), mass_drift 0.006 (vs 0.04). Temporal interpolation = clean single-blob position shift (realistic rollout error), vs noise = off-manifold drift. TRADEOFF: noise wins rollout-ED, temporal-interp wins frame sharpness/mass. For weather (blurry=failure), temporal-interp's sharpness may be preferable.","no_self_feed_final":"Two strong no-self-feed options: vae_noise_blur (ED 1186, sharp 0.93) and vae_interptemp_blur (ED 1305, sharp 1.03, mass 0.006). Both need sharp AE. selffeed_ms=690 still champion if self-outputs possible."}}
{"run":41,"commit":"53ce0e6","metric":1418.723999,"metrics":{"ed_late":2711.105957,"mmd":0.404124,"sharpness_ratio":0.989531,"mass_drift":0.011435,"train_loss":0.638644,"ed_floor":0,"wall_s":125.79},"status":"discard","description":"DISCARD: vae_noise_blur@3500 ED=1419 (worse than 1186@2000). VAE corruption is STATIC (no compounding with training) vs selffeed CLOSED-LOOP (690->156). Why selffeed is structurally superior.","timestamp":1783179186423,"segment":2,"confidence":16.589306192297325,"asi":{"finding":"vae_noise_blur at TRAIN_STEPS=3500: ED=1419, WORSE than 1186 at 2000 steps (sharpness improved 0.93->0.99, mass 0.04->0.01, but ED worse). OPPOSITE of selffeed_ms (which improved 690->156 at 3500). FUNDAMENTAL DIFFERENCE: selffeed is CLOSED-LOOP (corruption = model's own improving predictions -> compounding gains with training); VAE corruption is STATIC (fixed AE) -> no compounding, even overfitting/instability (train_loss 0.14->0.64). This is WHY selffeed is structurally superior and why the VAE approach plateaus (~1186).","implication":"For the user: the VAE no-self-feed approach is capped (~1186, doesn't improve with training budget). Selffeed is fundamentally better (closed-loop). If the user can enable ANY self-feeding (even a tiny aux AR head), they get the compounding benefit."}}
{"run":42,"commit":"b29793a","metric":2338.17749,"metrics":{"ed_late":2380.020996,"mmd":0.404124,"sharpness_ratio":1.282714,"mass_drift":0.171409,"train_loss":0.353756,"ed_floor":0,"wall_s":332.7},"status":"discard","description":"DISCARD: CFG GUIDANCE=2.0 ED 690->2338, sharpness 1.28 artifacts. High guidance amplifies drifted context.","timestamp":1783179935413,"segment":2,"confidence":14.278434038022313,"asi":{"finding":"CFG (UNCOND_PROB=0.1, GUIDANCE=2.0) on champion WORSE: ED 690->2338, sharpness 1.28 (artifacts), mass 0.17, train_loss 0.35 (up). High guidance AMPLIFIES the (drifted) context signal -> artifacts. Also UNCOND_PROB=0.1 dilutes conditional training (future is highly context-determined, so unconditional prior is uninformative/broad). Try GUIDANCE<1 (blend toward unconditional to dampen bad context).","next":"GUIDANCE=0.5 test (dampen context reliance)"}}
