{"run":104,"commit":"e69f498","metric":54667.43,"metrics":{"ed_late":60298.67,"mmd":0.404124,"sharpness_ratio":0.276452,"mass_drift":0.029768,"train_loss":1.28094,"wall_s":238.82},"status":"discard","description":"4000 steps strictly worse than 3000 (train_loss 1.28 vs 0.42, sharp 0.28 vs 0.32). ViT degrades past ~3000 steps — 'train more' doesn't help here. Session conclusion: latent corruption hurts (collapse), input-space aug is what works. Writing up findings.","timestamp":1783280414666,"segment":4,"confidence":null,"asi":{"finding":"4000 steps (clean stable settings) is STRICTLY WORSE than 3000: train_loss 1.28 vs 0.42, sharp 0.28 vs 0.32, mass 0.03 vs 0.002. The ViT optimization DEGRADES past ~3000 steps - the t~=0 loss-weight instability accumulates and the model gets worse, not better. 'Train more' does not help THIS ViT on THIS benchmark.","complete_picture":"Best ViT config = manifold_noise (input-space aug) LAST_ONLY jitter 0.20 blur 0.5 @ 3000 steps fp32 SAMPLE_AVG=4: sharp 0.32, mass_drift 0.002 (run #101). Latent corruption collapses to blur (sharp 0.07-0.10). ViT ceiling here is far below conv (sharp 1.0) due to tiny-data undertraining + optimization fragility.","session_conclusion":"User's latent-noise-corruption on jit3d: ANSWERED. It HURTS (blur collapse) on this benchmark. The production corruption is calibrated for large-data well-trained ViTs and doesn't transfer. Input-space aug (manifold_noise) is the mechanism that preserves forecast quality here. Recommend: for production, validate the corruption magnitude against a well-trained checkpoint, not this small benchmark."}}
{"run":105,"commit":"e69f498","metric":62226.92,"metrics":{"ed_late":69556.33,"mmd":0.404124,"sharpness_ratio":0.329659,"mass_drift":0.026202,"train_loss":1.951533,"wall_s":208.37},"status":"discard","description":"FINAL combo test: manifold_noise + ultra-mild latent (EMBED=0.01). Sharpness held (0.33) but corruption still destabilized training (loss 0.42→1.95), worsened mass, no ED gain. Definitive: latent corruption incompatible with this ViT here, alone or combined. Session complete.","timestamp":1783280736671,"segment":4,"confidence":null,"asi":{"finding":"Combination test (manifold_noise + ultra-mild latent EMBED=0.01): sharpness HELD (0.33 ~= manifold-only 0.32) confirming input aug protects against collapse, BUT latent corruption still destabilized training (train_loss 0.42->1.95) and worsened mass_drift (0.002->0.026) with NO ED gain (62227 ~= 64124). Even EMBED=0.01 is too disruptive for this ViT.","definitive_conclusion":"Latent-noise corruption is INCOMPATIBLE with this ViT on this benchmark, alone OR combined with input aug. The mechanism (context-token perturbation) fights the ViT's fragile optimization. Input-space aug (manifold_noise) alone remains the only thing that produces real forecast quality (sharp 0.32, mass 0.002).","session_complete":"User question fully answered with 15 experiments. Latent corruption fails here because the ViT is undertrained on 220 trajectories; it works in production only because the model is well-trained enough to learn genuine (not context-ignoring) robustness. Written up in JIT3D_FINDINGS.md."}}
{"run":106,"commit":"02d1a1f","metric":26104.58,"metrics":{"ed_late":46844.32,"mmd":0.404124,"sharpness_ratio":0.211147,"mass_drift":0.531858,"train_loss":0.067771,"wall_s":183.98},"status":"keep","description":"BETTER-TRAINED ViT BASELINE: RF_WCLAMP=50 tames the t≈0 instability (spikes 2.75→0.72), train_loss 0.22→0.068 (3× better, beats conv 0.11), sharpness 0.10→0.21 (doubled, real quality not collapse). First properly-trained ViT. Prerequisite for fair corruption test.","timestamp":1783281027159,"segment":4,"confidence":null,"asi":{"finding":"RF_WCLAMP=50 TAMED the t~=0 instability: max loss spike 2.75->0.72, final train_loss 0.22->0.068 (3x better, now BEATS conv's 0.11), sharpness 0.10->0.21 (doubled, NOT collapse - genuinely sharper). The ViT is now properly trained for the first time.","mechanism":"The 1/(1-t)^2 clamp at 200 was the root cause of the optimization fragility. Clamping at 50 reduces the high-t loss spikes 4x, letting the ViT fit cleanly. This is the missing prerequisite for testing corruption on a well-trained model.","next_action":"Now test latent corruption on THIS well-trained ViT (loss 0.068). Hypothesis: corruption failed before because the model was undertrained; on a well-trained model it may learn genuine robustness instead of context-ignoring collapse."}}
{"run":107,"commit":"01df15d","metric":23933.3,"metrics":{"ed_late":42130.04,"mmd":0.404124,"sharpness_ratio":0.22815,"mass_drift":0.570776,"train_loss":0.37361,"wall_s":208.02},"status":"keep","description":"HYPOTHESIS CONFIRMED: on the well-trained ViT (WCLAMP=50), production latent corruption (PROB=0.3 EMBED=0.10 BLOCK0=0.05) improves BOTH ED (26104→23933) and sharpness (0.21→0.23) — no collapse. The mechanism is sound; earlier failure was undertraining. Corruption forces genuine robustness (not context-ignoring) once the model fits well.","timestamp":1783281278402,"segment":4,"confidence":null,"asi":{"hypothesis_confirmed":"Latent corruption failed before because the ViT was UNDERTRAINED, not because the mechanism is wrong. On the well-trained ViT (WCLAMP=50, loss 0.068), production-default corruption (PROB=0.3 EMBED=0.10 BLOCK0=0.05) IMPROVES both ED (26104->23933) AND sharpness (0.21->0.23) - NO collapse. Opposite of undertrained case (sharp 0.10->0.075 collapse).","key_transferable_insight":"The LatentContextCorruptor's info-spreading robustness ONLY kicks in once the model is trained well enough that it can't afford to ignore context. Undertrained model -> context-ignoring -> blur. Well-trained model -> genuine robustness -> sharper stable rollout. This is why it works in production but failed initially here.","cost":"train_loss 0.068->0.37 (corruption costs per-step fit) but ROLLOUT is better (the whole point). Stable, no divergence.","next_action":"Sweep corruption magnitude on the well-trained ViT. Try PROB=0.5 (more) and PROB=0.15 (less), and EMBED variations, to find the optimum. Sharpness must stay >=0.21 (no collapse)."}}
{"run":108,"commit":"01df15d","metric":31610.75,"metrics":{"ed_late":40306.79,"mmd":0.404124,"sharpness_ratio":0.182137,"mass_drift":0.220088,"train_loss":0.146352,"wall_s":185.28},"status":"discard","description":"manifold_noise (jitter+blur input aug) on well-trained ViT: ED 31611, sharp 0.18 — worse than latent corruption (23933/0.23). Regime flip: input aug won when undertrained, latent corruption wins when well-trained. Getting conv reference next for backbone comparison.","timestamp":1783281727426,"segment":4,"confidence":null,"asi":{"finding":"manifold_noise (input jitter+blur) on the WELL-TRAINED ViT (WCLAMP=50): ED 31611, sharp 0.18, mass 0.22. WORSE than latent corruption (ED 23933, sharp 0.23) on this regime.","regime_flip":"On the UNDERTRAINED ViT (WCLAMP=200), manifold_noise won (sharp 0.32 vs corruption's 0.075 collapse). On the WELL-TRAINED ViT (WCLAMP=50), latent corruption wins (sharp 0.23 vs manifold's 0.18). The best aug DEPENDS on training maturity - important nuance.","next":"Run conv champion (manifold_noise + SAMPLE_AVG=4 + ODE32) in the same env for a fair backbone comparison."}}
{"run":109,"commit":"01df15d","metric":450.81,"metrics":{"ed_late":460.49,"mmd":0.404124,"sharpness_ratio":1.107219,"mass_drift":0.053783,"train_loss":0.132175,"wall_s":76.81},"status":"discard","description":"REFERENCE: conv2d + manifold_noise + SAMPLE_AVG=4 = ED 451, sharp 1.11, mass 0.054 (champion, matches docs). For backbone comparison: conv is ~53x better ED / ~5x sharper than best jit3d. ViT is data-hungry; conv's inductive bias wins on this tiny benchmark.","timestamp":1783281878053,"segment":4,"confidence":null,"asi":{"comparison_table":"BACKBONE COMPARISON (all best per-backbone, dt=0.012, ODE32): conv2d+manifold_noise+AVG4: ED 451, sharp 1.11, mass 0.054 (CHAMPION). jit3d+latent_corruption(PROP0.3)+WCLAMP50 fp32: ED 23933, sharp 0.23, mass 0.57. jit3d+manifold_noise+WCLAMP50: ED 31611, sharp 0.18, mass 0.22. jit3d no-aug well-trained: ED 26104, sharp 0.21, mass 0.53.","verdict":"conv2d is ~53x better on ED and ~5x better on sharpness than the best jit3d config. Expected: the ViT is data-hungry and this is a tiny benchmark (220 traj); the conv's locality/translation-equivariance inductive bias is perfect for blob forecasting while the ViT must learn it from scratch. The ViT would catch up with far more data/steps (its production advantage).","note":"This is a CONV reference run (different backbone), not the jit3d optimization target. Logging as discard to keep the jit3d baseline as the active comparison for further jit3d tuning."}}
{"run":110,"commit":"01224c7","metric":20333.88,"metrics":{"ed_late":34322.27,"mmd":0.404124,"sharpness_ratio":0.189153,"mass_drift":0.620144,"train_loss":0.30415,"wall_s":208.36},"status":"keep","description":"PROB=0.5 + SAMPLE_AVG=4: ED 23933→20334 (−15%, new best) but sharpness dipped 0.23→0.19, mass 0.57→0.62. Not collapse (sharpness still ~baseline) but edging toward it. Stronger corruption trades sharpness for ED.","timestamp":1783282203924,"segment":4,"confidence":null,"asi":{"finding":"Stronger corruption PROB=0.5 + SAMPLE_AVG=4: ED 23933->20334 (-15%, new best), but sharpness dipped 0.23->0.19 and mass_drift worsened 0.57->0.62. Still above no-aug baseline on ED (26104) and sharpness near baseline (0.21) - not collapse, but edging toward it.","tradeoff_emerging":"More corruption = lower ED but slowly eroding sharpness/mass. PROB=0.3 (sharp 0.23) vs PROB=0.5 (sharp 0.19). Need to find if AVG4 (variance reduction, orthogonal) lets me keep PROB=0.3's sharpness while lowering ED.","next_action":"Run PROB=0.3 + SAMPLE_AVG=4 (the earlier PROB=0.3 was AVG1=23933). If PROB=0.3+AVG4 beats PROB=0.5+AVG4 on sharpness at similar ED, gentler corruption + averaging is the better joint config."}}
{"run":111,"commit":"01224c7","metric":26770.23,"metrics":{"ed_late":43331.95,"mmd":0.404124,"sharpness_ratio":0.200524,"mass_drift":0.590926,"train_loss":0.373292,"wall_s":207.68},"status":"discard","description":"PROB=0.3 + AVG4: ED 26770 — worse than PROB=0.3+AVG1 (23933) and PROB=0.5+AVG4 (20334). AVG4 doesn't help at low PROB. Best stays PROB=0.5+AVG4 (20334).","timestamp":1783282477459,"segment":4,"confidence":null,"asi":{"finding":"PROB=0.3 + SAMPLE_AVG=4: ED 26770 - WORSE than PROB=0.3+AVG1 (23933) AND worse than PROB=0.5+AVG4 (20334). SAMPLE_AVG4 does NOT help at PROB=0.3 (non-monotonic; chaotic rollout amplifies small diffs).","current_best":"PROB=0.5 + EMBED=0.10 + BLOCK0=0.05 + AVG4: ED 20334, sharp 0.19 (run #110).","next_action":"Try PROB=0.5 with GENTLER per-token magnitude (EMBED=0.05, BLOCK0=0.0) + AVG4 to recover sharpness while keeping the ED gains from high PROB."}}
{"run":112,"commit":"01224c7","metric":38157.43,"metrics":{"ed_late":66585.66,"mmd":0.404124,"sharpness_ratio":0.205948,"mass_drift":0.418262,"train_loss":0.304508,"wall_s":207.99},"status":"discard","description":"PROB=0.5 + gentler magnitude (EMBED=0.05, no block0): ED 38157 — much worse. Production-default magnitudes (both stages) are load-bearing. Sweep complete; best is PROB=0.5 + defaults + AVG4 (ED 20334).","timestamp":1783282721988,"segment":4,"confidence":null,"asi":{"finding":"PROB=0.5 with GENTLER per-token (EMBED=0.05, BLOCK0=0.0) + AVG4: ED 38157 (much worse than 20334). The production-default magnitudes (EMBED=0.10 + BLOCK0=0.05, BOTH stages) are well-chosen and load-bearing. Removing block0 / halving embed hurts.","corruption_sweep_complete":"Best ED = PROB=0.5 + production defaults (EMBED=0.10, BLOCK0=0.05) + AVG4 = ED 20334, sharp 0.19. Pareto: PROB=0.3 + defaults = ED 23933, sharp 0.23 (better sharpness, worse ED). Real ED-vs-sharpness tradeoff; production magnitudes are well-tuned.","final_jit3d_best":"vs well-trained no-aug baseline (ED 26104, sharp 0.21): best corruption config is -22% ED. vs conv champion (451): ViT still ~45x worse (data-hungry architecture on tiny benchmark)."}}
{"run":113,"commit":"01224c7","metric":36716.93,"metrics":{"ed_late":46307.31,"mmd":0.404124,"sharpness_ratio":0.166289,"mass_drift":0.169366,"train_loss":0.656774,"wall_s":209.31},"status":"discard","description":"manifold_noise + latent corruption combo: ED 23933→36717 (much worse) despite fixing mass_drift (0.57→0.17). Mechanisms conflict on ViT — input aug's positional divergence outweighs mass benefit. Corruption-only stays best. Retesting longer training next.","timestamp":1783283069002,"segment":4,"confidence":null,"asi":{"disproven":"Combining manifold_noise (input jitter+blur) + latent corruption on the well-trained ViT does NOT work: manifold_noise RAISES ED sharply (23933->36717) even though it fixes mass_drift (0.57->0.17). The two CONFLICT - input perturbation causes positional divergence on the ViT that outweighs the mass/amplitude benefit. manifold_noise is just bad for ViT ED here (positional divergence).","implication":"Corruption-only configs remain best for ED. Their weakness (mass_drift 0.57-0.62) is NOT fixable by adding input aug (costs too much ED). The mass_drift is part of the ViT's dynamics-error signature, not a separate aug target.","next_hypothesis":"The 3000-step training ceiling was found at WCLAMP=200 (unstable). Now WCLAMP=50 tames the instability, so LONGER training may finally be stable -> more dynamics learning -> less positional divergence (the main ED driver). Retest best corruption config at 3500 steps."}}
{"run":114,"commit":"01224c7","metric":23179.94,"metrics":{"ed_late":43044.13,"mmd":0.404124,"sharpness_ratio":0.218342,"mass_drift":0.547093,"train_loss":0.285301,"wall_s":238.39},"status":"discard","description":"3500 steps stable under WCLAMP=50 (train_loss 0.29) but ED worse (20334→23180) despite sharper (0.22). Chaotic regime: sharper ≠ better trajectory. 3000-step PROB=0.5+AVG4 (20334) remains best. Technique space exhausted; corruption mechanism validated.","timestamp":1783283361761,"segment":4,"confidence":null,"asi":{"disproven":"Longer training (3500 steps) is now STABLE under WCLAMP=50 (train_loss 0.29, no divergence - confirms the 3000-step ceiling was a WCLAMP=200 artifact) BUT ED got WORSE (20334->23180) despite better sharpness (0.19->0.22). More training sharpens per-frame prediction but worsens trajectory divergence in the chaotic regime.","mechanism":"Chaotic-regime effect: a sharper single-step model isn't a more accurate trajectory model. The Lorenz rollout amplifies tiny dynamics errors; more training sharpens texture but the trajectory drifts further positionally -> higher ED.","session_conclusion":"Technique space for jit3d corruption EXHAUSTED on this benchmark. Best config: PROB=0.5 + production defaults (EMBED=0.10, BLOCK0=0.05) + AVG4 + 3000 steps fp32 WCLAMP=50 = ED 20334, sharp 0.19 (-22% vs no-aug 26104). ViT remains ~45x behind conv (451) due to data-hungry architecture on 220 trajectories - not fixable via aug, needs production-scale data. The corruption MECHANISM is validated (works on well-trained ViT); the gap is data/architecture."}}
{"run":115,"commit":"01224c7","metric":11152.63,"metrics":{"ed_late":18972.1,"mmd":0.412245,"sharpness_ratio":0.181435,"mass_drift":0.633165,"train_loss":0.080855,"wall_s":184.08},"status":"discard","description":"SEED=2 generalization baseline (no-aug): ED 11153, train_loss 0.08, sharp 0.18. Model trains well on SEED=2. Cross-seed ED not comparable (different reference set); testing champion corruption config at SEED=2 next for within-seed validation.","timestamp":1783283654149,"segment":4,"confidence":null,"asi":{"generalization_check":"SEED=2 no-aug well-trained baseline: ED 11153, train_loss 0.08, sharp 0.18. Model trains cleanly on SEED=2 (loss 0.08, even better than SEED=0's 0.068~). NOTE: absolute ED is NOT cross-seed comparable (reference/holdout set differs per seed - mmd 0.412 here vs 0.404 seed0); only the WITHIN-seED no-aug-vs-corruption comparison is valid.","next":"Run champion corruption config (PROB=0.5 + defaults + AVG4) at SEED=2 to test if the corruption win (22% at SEED=0) generalizes. If corruption ED < 11153 at SEED=2, the win is real and seed-robust."}}
{"run":116,"commit":"01224c7","metric":18588,"metrics":{"ed_late":24912.8,"mmd":0.412245,"sharpness_ratio":0.098891,"mass_drift":0.678283,"train_loss":0.06432,"wall_s":209.1},"status":"discard","description":"GENERALIZATION FAILURE: SEED=2 corruption PROB=0.5 HURTS (ED 11153→18588, sharp collapses 0.18→0.099) — opposite of SEED=0's win. The corruption benefit is seed-specific, not robust. No-aug ViT at SEED=2 already good; corruption reverts to blur-collapse. Testing gentler PROB=0.3 next.","timestamp":1783283912951,"segment":4,"confidence":null,"asi":{"CRITICAL_generalization_failure":"At SEED=2, corruption PROB=0.5 HURTS: ED 11153->18588 (worse) and sharpness COLLAPSES 0.18->0.099 (blur). OPPOSITE of SEED=0 where corruption helped (26104->20334). The SEED=0 '22% win' was SEED-SPECIFIC, not robust.","mechanism":"At SEED=0 the no-aug ViT was bad (high positional divergence 26104) so corruption's regularizer helped. At SEED=2 the no-aug ViT was already well-behaved (11153) and corruption just adds the context-ignoring blur-collapse (sharp 0.099). The collapse tendency is ALWAYS there; at SEED=0 it was masked by the no-aug model being bad.","implication":"The corruption is NOT a reliable win on this benchmark - its benefit is seed-dependent. This is the overfit-to-seed failure mode the prompt warns about. Must verify gentler PROB=0.3 before concluding.","next":"Run SEED=2 PROB=0.3 (gentler, had better sharpness 0.23 at SEED=0). If it ALSO hurts at SEED=2, corruption is definitively non-robust here and the recommendation reverts to: corruption magnitude is brittle/data-dependent, use cautiously."}}
{"run":117,"commit":"01224c7","metric":19690.18,"metrics":{"ed_late":30403.27,"mmd":0.412245,"sharpness_ratio":0.14427,"mass_drift":0.599997,"train_loss":0.778002,"wall_s":208.07},"status":"discard","description":"DEFINITIVE: SEED=2 PROB=0.3 also hurts (ED 11153→19690, sharp 0.18→0.14). Corruption does NOT generalize — helps SEED=0, hurts SEED=2 at both magnitudes. SEED=0 'win' was overfit. Corruption is brittle/data-dependent, not a reliable win. Most robust = well-trained no-aug ViT.","timestamp":1783284169165,"segment":4,"confidence":null,"asi":{"DEFINITIVE_non_generalization":"SEED=2 PROB=0.3 ALSO HURTS: ED 11153->19690, sharp 0.18->0.14, train_loss 0.08->0.78 (destabilized). The corruption does NOT generalize - helps at SEED=0 (26104->20334) but hurts at SEED=2 (11153->19690) at BOTH PROB=0.3 and PROB=0.5. The SEED=0 'win' was overfitting to that seed.","honest_conclusion":"Latent corruption is NOT a reliable improvement on this benchmark. Its effect is seed/data-dependent: it can help (SEED=0, where no-aug was bad) or hurt (SEED=2, where no-aug was already good). It has an inherent blur-collapse tendency (sharp always drops). This is exactly why the prompt mandates cross-seed generalization checks.","recommendation_revision":"For PRODUCTION: the corruption magnitude is BRITTLE/data-dependent. It is NOT a guaranteed win. It helps when the base model has high positional divergence, hurts when the base model is already well-behaved. Recommend: treat it as an OPTIONAL regularizer to A/B test per-dataset, not a default. Always validate on the target data with sharpness+mass monitoring. The most robust recipe on this benchmark is simply the well-trained no-aug ViT (fp32 + RF_WCLAMP=50)."}}
{"run":118,"commit":"850860c","metric":21636.39,"metrics":{"ed_late":40266.11,"mmd":0.404124,"sharpness_ratio":0.209548,"mass_drift":0.562954,"train_loss":0.063598,"wall_s":183.74},"status":"keep","description":"SAMPLE_AVG=4 robustly helps SEED=0 no-aug: ED 26104→21636 (−17%), sharp unchanged. Inference-only variance reduction (no retraining, no overfit risk). Completing 2×2 with SEED=2 AVG1 next.","timestamp":1783284471552,"segment":4,"confidence":null,"asi":{"finding":"SAMPLE_AVG=4 robustly helps SEED=0 no-aug: ED 26104->21636 (-17%), sharpness unchanged (0.21). Pure inference variance reduction - NO retraining, NO overfitting risk. This is the cleanest robust lever found.","confound_resolved_partial":"Earlier SEED=0 no-aug was AVG1 (26104) vs SEED=2 no-aug AVG4 (11153) - seed and AVG were entangled. Now SEED=0 AVG4 = 21636 confirms AVG helps SEED=0. Need SEED=2 AVG1 to complete the 2x2 and confirm AVG is robust across seeds.","next":"Run SEED=2 no-aug AVG1. If SEED=2 AVG1 >> 11153 (the AVG4 number), then AVG robustly helps both seeds = a production-applicable, overfit-free win."}}
