{"run":172,"commit":"39083b9","metric":1948.99,"metrics":{"ed_late":2146.663086,"mass_drift":0.035839,"mmd":0.395991,"sharpness_ratio":0.980191,"train_loss":0.000065,"wall_s":162.68},"status":"discard","description":"Bridge dt=0.024 sigma=0.7: ED 1949, ed_late 2147, sharp 0.98 (blurry) — WORSE than sigma=0.5 (1312/1153/1.07). dt=0.024 U-shape: 0.3->1541, 0.5->1312(min), 0.7->1949. Optimum sigma=0.5. Confirms regime-dependent sigma (dt=0.012->0.3, dt=0.024->0.5; harder->higher). Bridge fully characterized. Discard.","timestamp":1783370291152,"segment":4,"confidence":13.268913560666139,"asi":{"dt024_U_shape_optimum_0.5":"Bridge sigma sweep at dt=0.024: sigma 0.3->ED 1541, 0.5->1312 (MIN), 0.7->1949. U-shape, optimum sigma=0.5. sigma=0.7 over-regularizes (too much mid-path noise -> blur, sharp 0.98<1.0, ED/ed_late worse).","regime_dependent_sigma_COMPLETE":"Both regimes U-shaped; optimal sigma SHIFTS HIGHER for harder dynamics: dt=0.012 (easy) -> sigma=0.3; dt=0.024 (unstable) -> sigma=0.5. Transferable rule: tune BRIDGE_SIGMA per dynamics regime (faster/harder/more-unstable -> higher sigma, more mid-path Brownian regularization to tame instability).","bridge_fully_characterized":"COMPLETE bridge investigation: vloss loss (uniform collapses), wclamp=10, sigma_min=1e-3, sigma=0.3(dt012)/0.5(dt024). Bridge competitive on easy data (~1.4x RF), DRAMATICALLY better on unstable (dt=0.24: 3.3x RF ED, self-correcting rollout). Optimal sigma regime-dependent.","revert":"Resetting run.env to dt=0.012 sigma=0.3 (standard regime committed best)."}}
{"run":173,"commit":"eda3980","metric":1065.04,"metrics":{"ed_late":1111.862183,"mass_drift":0.013559,"mmd":0.406458,"sharpness_ratio":1.05642,"train_loss":0.000034,"wall_s":162.36},"status":"discard","description":"Bridge dt=0.018 sigma=0.4 (crossover probe): ED 1065, ed_late 1112, sharp 1.06, mass 0.014. Very stable. Now running RF@dt=0.018 to locate the bridge-vs-RF crossover (production-relevance threshold). Discard=revert to dt=0.012 standard.","timestamp":1783370614934,"segment":4,"confidence":13.798152780450263,"asi":{"bridge_dt018":"Bridge dt=0.018 sigma=0.4 (interpolated optimum between dt=0.012->0.3 and dt=0.024->0.5): ED 1065, ed_late 1112, sharp 1.06, mass 0.014. Very stable (ed_late~ED = rollout barely degrades), near-ideal sharpness, excellent mass. Note: dt=0.018 metric scale differs from dt=0.012, not comparable to the 803 champion.","crossover_characterization_in_progress":"Have: dt=0.012 RF 803 / bridge 1174 (RF wins); dt=0.018 bridge 1065 (RF TBD); dt=0.024 RF 4326 / bridge 1312 (bridge wins). Running RF at dt=0.018 to find the crossover point (where bridge starts beating RF = production-relevance threshold for the bridge).","production_question":"If RF@dt=0.018 > 1065 (with artifacts/mass drift), the crossover is <= dt=0.018 -> bridge wins for moderate-fast motion (strong production recommendation: use bridge for realistic weather dynamics). If RF@dt=0.018 < 1065, bridge only wins at extreme (dt>=0.02) motion.","sigma04_works":"Interpolated sigma=0.4 at dt=0.018 gave stable good results - confirms the regime-dependent sigma rule extends smoothly between the two characterized optima."}}
{"run":174,"commit":"eda3980","metric":1030.12,"metrics":{"ed_late":5141.000488,"mass_drift":0.156144,"mmd":0.406458,"sharpness_ratio":1.376959,"train_loss":0.005266,"wall_s":205.02},"status":"discard","description":"RF dt=0.018 (crossover): ED 1030 (early, tied w/ bridge 1065) but UNSTABLE — ed_late 5141 (bridge 1112, 4.6x), sharp 1.38 (artifacts), mass 0.156 (bridge 0.014, 11x). RF diverges over rollout; bridge stable. CROSSOVER at moderate motion (dt~0.018): bridge wins for dt>=0.018, not just extreme. Production: use bridge for moderate-fast dynamics. Discard=revert to dt=0.012.","timestamp":1783370870979,"segment":4,"confidence":14.304675960008552,"asi":{"CROSSOVER_FOUND_at_moderate_motion":"RF dt=0.018: ED 1030 (early, ~tied with bridge 1065) BUT already unstable: ed_late 5141 (vs bridge 1112, 4.6x worse), sharp 1.38 (ARTIFACTS), mass 0.156 (vs bridge 0.014, 11x worse). The RF's early rollout_ed looks fine but it DIVERGES over the long rollout; the bridge stays stable (ed_late~ED).","crossover_picture_COMPLETE":"dt=0.012: RF stable (sharp 1.03/mass 0.018/ed_late 802) -> RF wins (803 vs bridge 1174). dt=0.018: RF becoming unstable (sharp 1.38/mass 0.156/ed_late 5141), bridge stable (sharp 1.06/mass 0.014/ed_late 1112) -> BRIDGE WINS on stability (early ED tied). dt=0.024: RF catastrophically unstable (sharp 2.87/mass 0.60) -> bridge wins massively. CROSSOVER ~dt=0.015-0.018.","production_recommendation_STRENGTHENED":"The bridge wins for dt>=~0.018 (MODERATE-FAST dynamics, realistic weather motion), NOT just extreme motion. For any non-trivial dynamics the RF champion develops artifacts + mass drift in long rollouts while the bridge stays stable. Use the bridge for production weather forecasting (moderate-fast dynamics).","methodology_lesson":"rollout_ed (early/overall) HIDES the RF instability at dt=0.018 (1030 looks fine). The instability shows in ed_late (5141), sharpness (1.38), mass (0.156) = the late-rollout/quality metrics. Confirms 'trust sharpness/mass/ed_late not just rollout_ed'. The bridge's value is precisely in long-rollout stability (ed_late), which rollout_ed underweights.","done":"Crossover fully characterized: bridge > RF for dt>=~0.018. Bridge thread + crossover complete. Reverting run.env to dt=0.012 standard."}}
{"run":175,"commit":"f0402c3","metric":1691.35,"metrics":{"ed_late":2009.039185,"mass_drift":0.080485,"mmd":0.396215,"sharpness_ratio":0.936581,"train_loss":0.000068,"wall_s":157.32},"status":"discard","description":"Bridge C_CHAN=2 dt=0.018 sigma=0.4 (multichannel production test): ED 1691, ed_late 2009, sharp 0.94 (mild blur), mass 0.080. Harder than C=1. Running RF@C=2/dt=0.018 to judge if bridge still wins on multichannel. Discard=revert.","timestamp":1783371158980,"segment":4,"confidence":14.849804749132218,"asi":{"bridge_C2_dt018":"Bridge C_CHAN=2 dt=0.018 sigma=0.4: ED 1691, ed_late 2009, sharp 0.94 (slightly blurry), mass 0.080. Different (harder) reference scale than C=1, not comparable to the C=1 numbers. 2 blobs = harder per-frame; sharpness dipped below 1.0 (mild blur) vs C=1's 1.06.","need_RF_comparison":"Running RF at C=2/dt=0.018 next. If RF is unstable here too (artifacts/mass drift like C=1/dt=0.018 where RF ed_late 5141/sharp 1.38/mass 0.156), the bridge still wins on multichannel -> production recommendation holds. If RF is stable on C=2/dt=0.018, the bridge advantage is C=1-specific.","sigma_may_need_retune":"Bridge sharp 0.94 (blurry) on C=2 suggests sigma=0.4 may over-regularize the 2-channel data; might want lower sigma for C=2. Will assess after RF comparison."}}
{"run":176,"commit":"f0402c3","metric":1447.13,"metrics":{"ed_late":1615.753906,"mass_drift":0.112257,"mmd":0.396215,"sharpness_ratio":0.840647,"train_loss":0.008709,"wall_s":203.68},"status":"discard","description":"RF C=2/dt=0.018: ED 1447, sharp 0.84 (blurry, under-fits — different from C=1's overshoot artifacts). Bridge sharper/better-mass (0.94/0.080 vs 0.84/0.112) but RF lower ED (blur-gaming). C=2 under-trains both at 4500 steps -> muddy comparison. Bridge advantage clearest on C=1; depends on RF overshooting (artifacts) vs blurring. Discard=revert.","timestamp":1783371451233,"segment":4,"confidence":15.634310809337675,"asi":{"RF_C2_dt018_different_failure_mode":"RF C=2/dt=0.018: ED 1447, ed_late 1616, sharp 0.84 (BLURRY), mass 0.112. Contrast C=1/dt=0.018 where RF OVERSHOT (sharp 1.38 artifacts, ed_late 5141). On C=2 (harder, 2 blobs) the RF UNDER-FITS -> blur, not overshoot/artifacts. No catastrophic divergence (ed_late 1616 ~ ED 1447).","bridge_vs_RF_C2_muddy":"Bridge C=2/dt=0.018: ED 1691, sharp 0.94, mass 0.080. RF: ED 1447, sharp 0.84, mass 0.112. Bridge is SHARPER (0.94 vs 0.84) + better mass (0.080 vs 0.112) but RF has lower ED. By methodology, RF's lower ED is likely blur-gaming (blurry frames regress pooled features to mean). Bridge has better per-frame QUALITY but the advantage is modest (both blurry <1.0, under-trained on 2 blobs).","KEY_NUANCE_bridge_value_depends_on_RF_failure_mode":"The bridge's dramatic advantage (C=1/dt>=0.018) is when the RF OVERSHOOTS (artifacts) at moderate-fast motion (well-trained + fast dynamics). When the RF UNDER-FITS/BLURS (hard task like C=2, or under-trained), the bridge's stability advantage is less relevant and its quality edge is modest. For production: the bridge helps MOST when the RF model exhibits rollout ARTIFACTS (overshoot); if the RF model blurs, the bridge helps less.","C2_undertrains_both":"C_CHAN=2 at 4500 steps under-trains BOTH models (sharp<1.0 for both). Clean bridge-vs-RF on C=2 needs more compute. The C=2 comparison is confounded by under-training. The clear bridge-win is on C=1.","conclusion":"Bridge advantage clearly demonstrated on C=1 (single-channel) at moderate-fast motion; on C=2 (multichannel) the comparison is muddy (both under-train, RF blurs instead of overshooting). Production guidance: bridge helps most when RF shows rollout artifacts."}}
{"run":177,"commit":"f0402c3","metric":922.98,"metrics":{"ed_late":1317.386475,"mass_drift":0.065913,"mmd":0.396215,"sharpness_ratio":0.896657,"train_loss":0.005512,"wall_s":265.66},"status":"discard","description":"RF C=2/dt=0.018/6000steps: ED 923, sharp 0.90 (still blurry, NOT overshoot). More training improves C=2 but RF under-fits/blurs instead of overshooting -> bridge's overshoot-taming advantage doesn't apply on C=2. Bridge value = RF failure mode: overshoot(artifacts)->bridge wins; blur->bridge helps little. Bridge thread complete. Discard=revert.","timestamp":1783371829468,"segment":4,"confidence":16.506330085168422,"asi":{"hypothesis_NOT_confirmed":"RF C=2/dt=0.018 with MORE training (6000 steps): ED 1447->923 (better), sharp 0.84->0.90 (sharper but STILL BLURRY <1.0, NOT overshoot/artifacts), mass 0.112->0.066. More training improves C=2 but the RF under-fits/blurs rather than overshooting.","bridge_advantage_doesnt_apply_on_C2":"The bridge tames RF OVERSHOOT (artifacts at moderate-fast motion, seen on C=1). On C=2 the RF BLURS (under-fits the harder 2-blob task) instead of overshooting -> the bridge's dramatic advantage doesn't apply. The bridge would be only modestly better on C=2 (sharper but RF isn't unstable).","PRODUCTION_NUANCE_final":"Bridge value depends on the RF's failure mode: (1) RF OVERSHOOTS (rollout artifacts, well-trained + moderate-fast dynamics, e.g. C=1/dt>=0.018) -> bridge wins BIG. (2) RF BLURS (under-fits, hard task or under-trained, e.g. C=2) -> bridge helps little. For the user's production model: CHECK whether the RF exhibits rollout ARTIFACTS (overshoot) or BLUR. If artifacts -> use the bridge; if blur -> the bridge won't help much (need more capacity/data instead).","C2_needs_more_compute":"C=2 at 6000 steps: RF ED 923 (improved from 1447@4500). C=2 is a harder task that benefits from more training/compute (consistent with prior '2k data needs ~9x compute'). The benchmark (220 traj, 800k, ~6000 steps) under-serves C=2.","bridge_thread_COMPLETE":"Brownian-bridge fully characterized: loss (vloss required), sigma (regime-dependent: 0.3 dt=0.012, 0.5 dt=0.024), crossover (dt~0.018 on C=1), and now the failure-mode dependence (bridge tames overshoot, not blur). Clear on C=1; C=2 confounded by under-training + different RF failure mode. Resetting run.env to standard."}}
{"run":178,"commit":"1a0ce9b","metric":1174.41,"metrics":{"ed_late":1221.93,"mmd":0.404124,"sharpness_ratio":1.057199,"mass_drift":0.024846,"train_loss":0,"wall_s":161.68},"status":"keep","description":"BASELINE re-confirm: bridge + none + jit3d 800k (committed champion). ED 1174, ed_late 1222, sharp 1.06, mass 0.025. Starting point for bridge-context-aug sub-experiment.","timestamp":1783500773383,"segment":4,"confidence":16.880365880315438,"asi":{"env":"dt=0.012, bridge vloss sigma=0.3 wclamp=10","hypothesis":"baseline","run_wall_s":162}}
{"run":179,"commit":"ac84271","metric":1482.88,"metrics":{"ed_late":1876.19,"mmd":0.404124,"sharpness_ratio":0.975588,"mass_drift":0.019862,"train_loss":0,"wall_s":160.39},"status":"discard","description":"ctx_bridge scale=1.0 (bridge-sigma-matched, sample time, last-only): ED 1483 vs baseline 1174, ed_late 1876. Over-corrupts context (bridge already regularizes target). Sweep gentler.","timestamp":1783501065600,"segment":4,"confidence":17.271746111850256,"asi":{"ctx_std_peak":0.15,"ctx_std_avg":0.122,"hypothesis":"bridge-shaped gaussian on context (scale=1.0, sample time, last-only)","next_action_hint":"sweep gentler scale 0.3/0.5; if monotonic worse -> dead like latent corruption","result":"WORSE - conflicts with bridge regularization, over-corrupts context"}}
{"run":180,"commit":"ac84271","metric":1195.72,"metrics":{"ed_late":1281.39,"mmd":0.404124,"sharpness_ratio":1.055828,"mass_drift":0.02014,"train_loss":0,"wall_s":171.88},"status":"discard","description":"ctx_bridge scale=0.3 @dt=0.012 (easy regime): ED 1196 vs baseline 1174, ed_late 1281 vs 1222. NEUTRAL (within noise). At dt=0.012 bridge is already optimal -> no room for context aug. Sweeping scale 0.3..1.0: neutral..worse, monotonic tax no sweet spot.","timestamp":1783501351370,"segment":4,"confidence":17.7087368365349,"asi":{"ctx_std_peak":0.045,"hypothesis":"gentle bridge-shaped context noise scale=0.3 at easy dt=0.012","next_action_hint":"PIVOT to hard regime dt=0.024 where bridge has room / AR drift exists","result":"NEUTRAL (within noise) - bridge already well-calibrated at dt=0.012, no drift to address"}}
{"run":181,"commit":"ac84271","metric":951.19,"metrics":{"ed_late":1002.55,"mmd":0.395991,"sharpness_ratio":1.019074,"mass_drift":0.009474,"train_loss":0,"wall_s":159.71},"status":"discard","description":"BASELINE bridge+none @dt=0.024 (fast motion): ED 951, ed_late 1003, sharp 1.02, mass 0.009. Much better than documented 1541 (weaker config). Bridge well-calibrated here too. Reference for ctx_bridge sweep.","timestamp":1783501610663,"segment":4,"confidence":18.168414067684143,"asi":{"baseline_for":"ctx_bridge sweep at dt=0.024","hypothesis":"bridge+none baseline at fast-motion regime","note":"much better than documented 1541 (weaker config then); bridge well-calibrated at 4500 steps here too"}}
{"run":182,"commit":"5f04260","metric":855.06,"metrics":{"ed_late":857.07,"mmd":0.395991,"sharpness_ratio":1.046368,"mass_drift":0.012938,"train_loss":0,"wall_s":162.07},"status":"keep","description":"ctx_bridge scale=0.5 @dt=0.024 (fast motion): ED 855 vs baseline 951 (-10%), ed_late 857 vs 1003 (-14.5%), sharp 1.05, mass 0.013. FIRST HELP - fast dynamics have AR drift the bridge-shaped context noise addresses (neutral at dt=0.012). Needs SEED=2 confirm (within noise floor).","timestamp":1783501870748,"segment":4,"confidence":18.357895635106882,"asi":{"ctx_std_peak":0.075,"hypothesis":"bridge-shaped context noise scale=0.5 at fast-motion dt=0.024 (more AR drift)","mechanism":"faster dynamics -> larger per-step error -> context drift; bridge-shaped noise matches target's own noise shape","next_action_hint":"CONFIRM with SEED=2 (within 17% ViT noise floor); sweep scale 0.3/0.7","result":"HELPED: ED 855<951 (-10%), ed_late 857<1003 (-14.5%), sharp 1.05"}}
{"run":183,"commit":"5f04260","metric":1242.25,"metrics":{"ed_late":1316.78,"mmd":0.405609,"sharpness_ratio":0.777941,"mass_drift":0.125136,"train_loss":0,"wall_s":160.11},"status":"discard","description":"BASELINE bridge+none @dt=0.024 SEED=2: ED 1242, ed_late 1317, sharp 0.78 (blurry), mass 0.125. S2 is HARDER than S0 (951/sharp1.02) - genuine AR drift here. Strong test for ctx_bridge.","timestamp":1783502076075,"segment":4,"confidence":18.55411399423376,"asi":{"baseline_for":"ctx_bridge SEED=2 confirm","harder_seed":true,"hypothesis":"bridge+none baseline SEED=2 dt=0.024","note":"S2 is HARDER than S0: blurry (sharp 0.78), mass drift 0.125 - genuine AR drift to address"}}
{"run":184,"commit":"81038e2","metric":1008.69,"metrics":{"ed_late":1081.08,"mmd":0.405609,"sharpness_ratio":1.049079,"mass_drift":0.023235,"train_loss":0,"wall_s":160.51},"status":"keep","description":"ctx_bridge scale=0.5 @dt=0.024 SEED=2 (CONFIRM): ED 1009 vs baseline 1242 (-18.8%), ed_late 1081 vs 1317 (-17.9%), sharp 1.05 vs 0.78 (cures blur), mass 0.023 vs 0.125 (5.4x better). Reproduces across seeds. The technique transforms a failing blurry/mass-drifting rollout into sharp+stable.","timestamp":1783502308055,"segment":4,"confidence":18.889252652969063,"asi":{"confirmed_seeds":"S0 (855<951 -10%) + S2 (1009<1242 -18.8%)","hypothesis":"ctx_bridge scale=0.5 SEED=2 confirmation","mechanism":"bridge-shaped context noise robustifies AR rollout; helps MOST where drift worst","result":"CONFIRMED + cures blur (sharp 0.78->1.05) and mass drift (0.125->0.023) at S2","strongest_evidence":"sharpness+mass recovery at hard S2 seed"}}
{"run":185,"commit":"81038e2","metric":866.14,"metrics":{"ed_late":953.73,"mmd":0.395991,"sharpness_ratio":0.959293,"mass_drift":0.034093,"train_loss":0,"wall_s":159.39},"status":"discard","description":"ctx_bridge scale=0.3 @dt=0.024 S0: ED 866, ed_late 954, sharp 0.96, mass 0.034. Slightly worse than scale=0.5 (855/857/1.05/0.013). Optimum >= 0.5.","timestamp":1783502512853,"segment":4,"confidence":19.164988864142536,"asi":{"hypothesis":"scale=0.3 sweep point","next_action_hint":"try 0.7; 0.5 still best","result":"866 vs 0.5's 855 - 0.5 better, optimum >=0.5"}}
{"run":186,"commit":"81038e2","metric":974.22,"metrics":{"ed_late":969.41,"mmd":0.395991,"sharpness_ratio":1.111807,"mass_drift":0.053986,"train_loss":0,"wall_s":161.29},"status":"discard","description":"ctx_bridge scale=0.7 @dt=0.024 S0: ED 974, sharp 1.11 (artifacts), mass 0.054. Worse than 0.5. U-shape: 0.3->866, 0.5->855, 0.7->974. Optimum=0.5 (sharp 1.05 ideal, mass 0.013).","timestamp":1783502769491,"segment":4,"confidence":19.37931433866111,"asi":{"hypothesis":"scale=0.7 sweep point","result":"974 worse than 0.5 (855), sharp 1.11=artifacts, mass 0.054. U-shape optimum at 0.5"}}
{"run":187,"commit":"81038e2","metric":1165.45,"metrics":{"ed_late":1492.78,"mmd":0.404124,"sharpness_ratio":1.060731,"mass_drift":0.017568,"train_loss":0,"wall_s":158.92},"status":"discard","description":"ctx_bridge scale=0.5 @dt=0.012 S0 (easy regime): ED 1165~baseline 1174 (neutral), ed_late 1493>1222 (worse). Confirms: helps ONLY where AR drift exists (dt=0.024). Correct robustness-mechanism behavior.","timestamp":1783502982793,"segment":4,"confidence":19.598487707744972,"asi":{"hypothesis":"ctx_bridge at easy dt=0.012 champion regime scale=0.5","result":"NEUTRAL ED (1165~1174) but worse ed_late (1493>1222) - no drift to fix, late-rollout tax","takeaway":"ctx_bridge helps ONLY where AR drift exists (dt=0.024), neutral where not - correct robustness behavior"}}
{"run":188,"commit":"5c7c310","metric":791.58,"metrics":{"ed_late":697.61,"mmd":0.395991,"sharpness_ratio":1.007413,"mass_drift":0.00536,"train_loss":0,"wall_s":159.2},"status":"keep","description":"ABLATION: uniform (flat) gaussian std=0.06 @dt=0.024 S0: ED 792, ed_late 698, sharp 1.01, mass 0.005. BEATS bridge-scheduled sample mode (855/857/1.05/0.013) at matched magnitude. KEY FINDING: bridge schedule is NOT the active ingredient - flat gaussian magnitude is. Simpler + better. Needs S2 confirm.","timestamp":1783503208859,"segment":4,"confidence":20.1573896353167,"asi":{"ablation":"flat gaussian vs bridge-scheduled at MATCHED magnitude (std~0.06)","finding":"bridge SCHEDULE not active ingredient - flat gaussian magnitude is. flat is simpler + better (consistent reg vs sample-mode wide variance range)","hypothesis":"uniform flat gaussian std=0.06 on last ctx frame","matched_std":0.06,"result":"792<855 (sample), ed_late 698<857, sharp 1.01 ideal, mass 0.005 lowest"}}
{"run":189,"commit":"5c7c310","metric":1096.72,"metrics":{"ed_late":1166.73,"mmd":0.405609,"sharpness_ratio":1.041866,"mass_drift":0.022469,"train_loss":0,"wall_s":161.41},"status":"discard","description":"CONFIRM uniform flat gaussian std=0.06 @dt=0.024 SEED=2: ED 1097 vs baseline 1242 (-12%), sharp 1.04 vs 0.78 (cures blur), mass 0.022 vs 0.125. CROSS-SEED: schedule (sample vs uniform) flips S0/S2 = within noise; MAGNITUDE is the active ingredient. Both robustly beat baseline ~14% avg ED.","timestamp":1783503466628,"segment":4,"confidence":20.819741659183535,"asi":{"avg_ED":"baseline 1097, sample 932, uniform 945","confirmed_seeds":"S0 (1097<1242) - cures blur 0.78->1.04, mass 0.125->0.022","flip":"S0 prefers flat/uniform, S2 prefers sample-scheduled = overfitting frontier signature -> schedule within noise","hypothesis":"uniform flat gaussian SEED=2 confirm","robust_finding":"gaussian ctx-noise MAGNITUDE (~std 0.06) helps; bridge schedule not uniquely important"}}
{"run":190,"commit":"931fd49","metric":2033.05,"metrics":{"ed_late":2040.5,"mmd":0.390672,"sharpness_ratio":0.968311,"mass_drift":0.040227,"train_loss":0,"wall_s":160.71},"status":"discard","description":"BASELINE bridge+none C_CHAN=2 @dt=0.024 S0: ED 2033, ed_late 2040, sharp 0.97, mass 0.040. Harder than C=1 (951). Multichannel generalization reference for ctx_bridge.","timestamp":1783503874400,"segment":4,"confidence":20.58779653144446,"asi":{"baseline_for":"ctx_bridge C=2 multichannel generalization","hypothesis":"bridge+none C=2 dt=0.024 baseline","note":"C=2 harder (ED 2033 vs C=1 951), sharp 0.97 slightly blurry, mass 0.040 - room for ctx_bridge"}}
