{"run":191,"commit":"931fd49","metric":2053.78,"metrics":{"ed_late":1803.21,"mmd":0.390672,"sharpness_ratio":1.0181,"mass_drift":0.021293,"train_loss":0,"wall_s":162.57},"status":"discard","description":"GENERALIZATION ctx_bridge flat gaussian C_CHAN=2 @dt=0.024 S0: ED 2054~baseline 2033 (neutral within noise), but ed_late 1803<2040 (-12%), sharp 1.02>0.97, mass 0.021<0.040 (2x better). Soft positive: quality/stability improves on multichannel, ED neutral. Benefit transfers.","timestamp":1783504090237,"segment":4,"confidence":20.360962494595768,"asi":{"generalization":"C=2 multichannel: quality metrics improve (ed_late -12%, sharp 0.97->1.02, mass 0.040->0.021), ED neutral within noise -> soft positive transfer","hypothesis":"ctx_bridge flat gaussian on multichannel C=2","note":"ED neutral but sharp/mass/ed_late improve - matches trust-sharp+mass methodology; benefit transfers to multichannel"}}
{"run":192,"commit":"931fd49","metric":1246.29,"metrics":{"ed_late":1355.16,"mmd":0.395991,"sharpness_ratio":1.056327,"mass_drift":0.031347,"train_loss":0,"wall_s":160.44},"status":"discard","description":"K=3 + ctx_bridge @dt=0.024 S0: ED 1246, ed_late 1355, sharp 1.06, mass 0.031. MUCH worse than K=2+ctx_bridge champion (792/698/1.01/0.005). Synergy hypothesis FALSIFIED - extra context adds divergence the small gaussian can't tame. K=2 optimal.","timestamp":1783504432341,"segment":4,"confidence":21.33449889224715,"asi":{"hypothesis":"K=3 + ctx_bridge synergy (more context info + drift dampening)","result":"FALSIFIED: K=3+ctx_bridge 1246 >> K=2+ctx_bridge 792. Extra context frame adds divergence ctx_bridge can't counteract","synergy":"none - K=3 worse regardless"}}
{"run":193,"commit":"931fd49","metric":1015.94,"metrics":{"ed_late":1000.73,"mmd":0.395991,"sharpness_ratio":0.963706,"mass_drift":0.016661,"train_loss":0,"wall_s":160.07},"status":"discard","description":"BASELINE K=3 bridge+none @dt=0.024 S0: ED 1016, ed_late 1001, sharp 0.96, mass 0.017. vs K=3+ctx_bridge 1246 -> ctx_bridge HURTS at K=3 (opposite of K=2). Benefit is K-dependent: helps scarce-context K=2, hurts robust K=3. K=2 optimal.","timestamp":1783504723180,"segment":4,"confidence":22.405807228557414,"asi":{"finding":"ctx_bridge benefit is K-DEPENDENT: helps K=2 (scarce context, over-reliance), HURTS K=3 (model robust with more context, noise is pure degradation)","hypothesis":"K=3 baseline none","k3_ctx_bridge":1246,"k3_none":1016,"mechanism_refined":"ctx_bridge prevents over-reliance on scarce drifted context"}}
{"run":194,"commit":"931fd49","metric":916.99,"metrics":{"ed_late":898.74,"mmd":0.395991,"sharpness_ratio":1.079638,"mass_drift":0.028682,"train_loss":0,"wall_s":163.11},"status":"discard","description":"ctx_bridge LAST_ONLY=0 (both frames) @dt=0.024 S0: ED 917, ed_late 899, sharp 1.08, mass 0.029. WORSE than LAST_ONLY=1 champion (792/698/1.01/0.005). Older frame[0] is clean in training; corrupting it degrades dynamics signal. Last-frame-only confirmed optimal. Champion holds.","timestamp":1783504935030,"segment":4,"confidence":22.64382306097305,"asi":{"finding":"LAST_ONLY=0 (both frames) WORSE than LAST_ONLY=1 (792). Older frame[0] is clean in training -> corrupting it degrades dynamics signal. Last-frame-only optimal for gaussian too (matches manifold finding).","hypothesis":"corrupt both context frames to match late-rollout drift","result":"FALSIFIED - 917>792, mass 0.029>0.005"}}
{"run":195,"commit":"942c3b5","metric":754.8,"metrics":{"ed_late":749.57,"mmd":0.395991,"sharpness_ratio":1.014382,"mass_drift":0.001618,"train_loss":0,"wall_s":205.13},"status":"keep","description":"ctx_bridge TRAIN_STEPS=6000 @dt=0.024 S0: ED 755 vs 4500's 792 (-4.7%), mass 0.0016 (near-perfect, best yet) vs 0.005. ctx_bridge KEEPS IMPROVING with training (no plateau like static manifold_noise). Control (6000 none) needed to confirm advantage holds vs compute.","timestamp":1783505261581,"segment":4,"confidence":22.86710058275941,"asi":{"compounding_test":"6000 vs 4500 ctx_bridge: 755<792, mass 0.0016<0.005 -> keeps improving, does NOT plateau like manifold_noise","control_needed":"6000 none baseline to separate technique from compute","hypothesis":"does ctx_bridge compound with training or plateau?","wall_s":205}}
{"run":196,"commit":"942c3b5","metric":645.62,"metrics":{"ed_late":650.66,"mmd":0.395991,"sharpness_ratio":1.023757,"mass_drift":0.01709,"train_loss":0,"wall_s":207.32},"status":"discard","description":"CONTROL none@6000 @dt=0.024 S0: ED 646, ed_late 651, sharp 1.02, mass 0.017. BEATS ctx_bridge@6000 (755). COMPOUNDING ANSWER: ctx_bridge advantage reverses w/ training (4500: ctx 792<none 951 wins -16.7%; 6000: none 646<ctx 755 wins -14.2%). ctx_bridge = compute-efficient ACCELERATOR, not a compounder. Base model outgrows it. Caveat for production.","timestamp":1783505577594,"segment":4,"confidence":22.62802750026212,"asi":{"compounding_answer":"ctx_bridge does NOT compound - advantage REVERSES with training (4500: ctx wins -16.7%; 6000: none wins -14.2%). Static regularizer the model outgrows, not a self-feed compounder.","control_for":"6000 ctx_bridge compounding test","hypothesis":"6000 none control","none_6000":645.6,"production_caveat":"ctx_bridge = compute-efficient ACCELERATOR (helps moderate budget); at high budget base model learns robustness alone, noise becomes tax (only mass stays better: 0.0016 vs 0.017)"}}
{"run":197,"commit":"4fee2d8","metric":677.79,"metrics":{"ed_late":622.61,"mmd":0.395991,"sharpness_ratio":0.974953,"mass_drift":0.023387,"train_loss":0,"wall_s":207.56},"status":"keep","description":"ctx_bridge ANNEAL=0.8 @6000 dt=0.024 S0: ED 678, ed_late 623 (best), sharp 0.97, mass 0.023. Annealing recovers late-tax penalty vs static (755) but doesn't beat none@6000 (646, within 5% noise). Confirms none optimal at high budget. Real test = moderate budget (anneal@4500 next).","timestamp":1783506269568,"segment":4,"confidence":23.30574656188605,"asi":{"anneal_vs_static":"anneal@6000 677.8 < static 754.8 - recovers late-tax penalty; best ed_late 623","hypothesis":"anneal ctx_bridge noise to 0 over training (early regularize + late refine)","next_test":"anneal@4500 moderate budget - does it beat the 792 champion?","vs_none":"677.8 > none 645.6 - can't beat none at high budget (within 5% noise)"}}
{"run":198,"commit":"4fee2d8","metric":894.43,"metrics":{"ed_late":878.6,"mmd":0.395991,"sharpness_ratio":0.906894,"mass_drift":0.056233,"train_loss":0,"wall_s":163.8},"status":"discard","description":"ctx_bridge ANNEAL=0.8 @4500 dt=0.024 S0: ED 894, ed_late 879, sharp 0.91, mass 0.056. WORSE than static@4500 (792/698/1.01/0.005). At moderate budget the model still NEEDS the regularizer; annealing it off -> blur/mass revert (same failure as manifold_anneal). Static ctx_bridge is the correct design. ANNEAL DEAD.","timestamp":1783506481368,"segment":4,"confidence":23.510168691114874,"asi":{"anneal_conclusion":"anneal FAILS both budgets. Moderate(4500): model still needs regularizer -> removing it reverts to blur (sharp 0.91, mass 0.056). High(6000): helps vs static but can't beat none. STATIC is correct - same failure mode as manifold_anneal.","hypothesis":"anneal ctx_bridge to 0 at moderate budget","result":"WORSE than static 792 (894/0.91/0.056) - regularizer removed too early -> blur revert"}}
{"run":199,"commit":"4fee2d8","metric":1350.11,"metrics":{"ed_late":1235.24,"mmd":0.395991,"sharpness_ratio":1.122011,"mass_drift":0.061652,"train_loss":0,"wall_s":160.94},"status":"discard","description":"BRIDGE_SIGMA=0.5 @dt=0.024 none 4500 S0: ED 1350 vs sigma=0.3's 951 (+42%), sharp 1.12 (overshoot), mass 0.062. MORE sigma HURTS at dt=0.024. 'Harder regime wants more mid-path reg' FALSIFIED - 0.3 optimal in both regimes. Bridge sigma settled.","timestamp":1783506918718,"segment":4,"confidence":23.86620980164094,"asi":{"hypothesis":"harder dt=0.024 regime wants more bridge sigma (mid-path reg)","result":"FALSIFIED - sigma=0.5 ED 1350 >> sigma=0.3 951, sharp 1.12 overshoot, mass 0.062. 0.3 optimal at dt=0.024 too (matches dt=0.012 finding)"}}
{"run":200,"commit":"4fee2d8","metric":1942.3,"metrics":{"ed_late":2057.43,"mmd":0.395991,"sharpness_ratio":1.268848,"mass_drift":0.115684,"train_loss":0,"wall_s":163.95},"status":"discard","description":"FLOW_SOURCE=lastctx (delta flow: source=last ctx frame) @dt=0.024 none 4500 S0, deterministic (SRC_NOISE=0, AVG1): ED 1942 vs noise-source baseline 951 (+104%), sharp 1.27 (overshoot), mass 0.116. SEVERE exposure bias: train source=clean real frame, inference=drifted prediction; delta-flow amplifies it. Need source-noise during training.","timestamp":1783508144766,"segment":4,"confidence":23.636612702366122,"asi":{"diagnosis":"SEVERE exposure bias: train source = clean real last frame; inference source = model's drifted prediction. Delta-flow is acutely source-sensitive -> drift amplifies (overshoot sharp 1.27, mass 0.116).","fix":"add SRC_NOISE to TRAINING source (perturb eps) so model is robust to drifted sources","hypothesis":"lastctx delta flow (source = last context frame instead of noise), deterministic","result":"WORSE: ED 1942 vs noise-source 951 (+104%), sharp 1.27 overshoot, mass 0.116"}}
{"type":"config","name":"Block-bridge flow matching (3-frame -> 3-frame) rollout stability","metricName":"rollout_ed","metricUnit":"","bestDirection":"lower"}
{"run":201,"commit":"9f1016f","metric":23445.14,"metrics":{"ed_late":35728.82,"mmd":0.396,"sharpness_ratio":0.159,"mass_drift":0.58,"train_loss":0.000151,"ed_floor":0.00362,"num_blocks":17,"wall_s":262.5},"status":"keep","description":"BASELINE: block-bridge 3->3, source=ctx, vloss, sigma=0.3, wclamp=10, 1500 steps. COLLAPSED — sharpness 0.16 (blurry), mass_drift 0.58, train_loss~0. vloss weight (1-t c'/c)^2 down-weights low-t forecasting (~0.25) and over-emphasizes high-t copying (10x) → model collapses to blurry mean. First run of new benchmark, so kept as reference.","timestamp":1783509866661,"segment":5,"confidence":null,"asi":{"hypothesis":"block-bridge with source=ctx + vloss would give a stable 3->3 forecaster","finding":"COLLAPSE. x-pred bridge + vloss: high-t copy is trivial & 10x-weighted, low-t forecasting under-weighted (0.25x) → mean regression. More training deepens collapse (1000 steps ED4845/sharp0.69 -> 1500 steps ED23445/sharp0.16). train_loss~0 is misleading (measures high-t copy, not rollout quality).","root_cause":"loss weighting: vloss down-weights the forecasting region (low t, where z_t~source and model must predict future)","next_action_hint":"emphasize low-t: try uniform loss, or FLOW_SOURCE=noise (no copy-cheat), or larger sigma_min"}}
{"run":202,"commit":"uncommi","metric":7260.93,"metrics":{"ed_late":11792.91,"mmd":0.396,"sharpness_ratio":0.214,"mass_drift":0.683,"train_loss":0.000183,"ed_floor":0.003619,"num_blocks":17,"wall_s":262.65},"status":"discard","description":"source=noise + uniform loss, 1500 steps. ED 7260 < baseline 23445 BUT COLLAPSED to blur (sharp 0.21, mass 0.68). At 400 steps sharp (1.0); by 1500 slid into blurry mean. train_loss DECREASED 0.00037->0.00018 while sharpness crashed 1.0->0.21 = x-pred MSE regressing to conditional mean. ED drop is metric-gaming from blur.","timestamp":1783510566952,"segment":5,"confidence":null,"asi":{"finding":"uniform prevents the 400-step blur collapse BUT a DEEPER failure remains: the model slides into a lower-MSE blurry-mean basin with more training (sharp 1.0@400 -> 0.21@1500, train_loss 0.00037->0.00018). x-pred MSE for the stochastic 3-frame task regresses to conditional mean.","hypothesis":"uniform loss + noise source would prevent the vloss collapse at full training","next_action_hint":"test lower LR, more capacity, larger sigma_min, velocity prediction, early stopping. Run 600-step batch.","root_cause":"x-prediction MSE misaligned with rollout quality; data has residual projection ambiguity so conditional mean is blurry; more training -> deeper mean regression"}}
{"type":"config","name":"Video rollout (JiT-3D + Brownian-bridge): random-sigma context aug","metricName":"rollout_ed","metricUnit":"","bestDirection":"lower"}
{"run":203,"commit":"87a8e2d","metric":951.19,"metrics":{},"status":"keep","description":"BASELINE (re-init): video bridge+none, jit3d 800k/PHW8, K=2, dt=0.024, 4500 steps, fp32, AVG4, vloss bridge sigma=0.3 wclamp=10. ED 951, ed_late 1002, sharp 1.02, mass 0.009. Reproduces prior reference exactly. New benchmark target (video_rollout bridge) — fresh baseline for random-sigma context aug experiments.","timestamp":1783512285395,"segment":6,"confidence":null,"asi":{"baseline_ed":951.19,"champion_to_beat":"ctx_bridge flat gaussian std~0.06 (CTX_BRIDGE_SCALE=0.2 uniform) -> ED 792 @4500 dt=0.024 S0","env_check":"reproduces prior 951 exactly -> env stable, deterministic","hypothesis":"re-establish bridge baseline on video_rollout experiment (switched from block_bridge)","prior_ctx_bridge_champion":"CTX_BRIDGE_TIME=uniform SCALE=0.2 -> flat std=0.06, last-frame-only -> ED 792"}}
{"run":204,"commit":"87a8e2d","metric":1222.87,"metrics":{},"status":"discard","description":"randsigma SCALE=1.0 (sigma~U(0,1), mean std 0.5): ED 1223, ed_late 1319, sharp 1.14, mass 0.098. OVER-CORRUPTS — 8x the champion magnitude (0.06). High-sigma samples destroy mass/structure. Sweep down.","timestamp":1783512491174,"segment":6,"confidence":null,"asi":{"hypothesis":"randsigma sigma~U(0,1) per sample (SCALE=1.0) robustifies context like the user's idea","mean_std":0.5,"result":"OVER-CORRUPTS: ED 1223>951, mass 0.098 (10x baseline 0.009), sharp 1.14 overshoot. High-sigma samples (up to 1.0) destroy mass/structure. Prior flat-gaussian champion used fixed std~0.06; SCALE=1.0 avg std 0.5 is ~8x too much.","next_action":"sweep SCALE down: 0.5, 0.2, 0.1 (mean std 0.25/0.1/0.05 ~ champion magnitude)"}}
{"run":205,"commit":"87a8e2d","metric":1050.91,"metrics":{},"status":"discard","description":"randsigma SCALE=0.2 (sigma~U(0,0.2), mean std 0.1): ED 1051, ed_late 1015, sharp 1.03, mass 0.010. Still > baseline 951. Better than SCALE=1.0 (1223). Random spread under-regularizes half the samples. Try smaller.","timestamp":1783512689178,"segment":6,"confidence":null,"asi":{"hypothesis":"randsigma SCALE=0.2 (mean std 0.1)","mean_std":0.1,"result":"ED 1051 still > baseline 951 but quality metrics fine (sharp 1.03, mass 0.010). Monotonic improvement vs SCALE=1.0 (1223). The random spread (many near-zero samples under-regularize) may hurt vs consistent flat gaussian.","next_action":"try SCALE=0.1 (mean std 0.05 ~ champion region) and 0.05"}}
{"run":206,"commit":"bb43bed","metric":874.78,"metrics":{},"status":"keep","description":"randsigma SCALE=0.1 (sigma~U(0,0.1), mean std 0.05): ED 875, ed_late 874, sharp 1.02, mass 0.007. BEATS baseline 951 (-8%). U-shape (1.0->1223, 0.2->1051, 0.1->875). Random non-conditional sigma works at the right magnitude. New best.","timestamp":1783512885154,"segment":6,"confidence":0.8676545733265206,"asi":{"hypothesis":"randsigma SCALE=0.1 (sigma~U(0,0.1), mean std 0.05 ~ champion magnitude region)","mean_std":0.05,"result":"BEATS baseline: ED 875<951 (-8%), ed_late 874<1002, sharp 1.02, mass 0.007. U-shape confirmed (1.0->1223, 0.2->1051, 0.1->875). Random non-conditional sigma helps at the right magnitude.","next_action":"sweep 0.05 (mean 0.025) and 0.15 to find randsigma optimum; compare to flat-gaussian champion (ED 792)"}}
{"run":207,"commit":"bb43bed","metric":914.32,"metrics":{},"status":"discard","description":"randsigma SCALE=0.05 (mean std 0.025): ED 914, ed_late 945, sharp 0.98, mass 0.027. WORSE than SCALE=0.1 (875). U-shape low side confirmed (0.05->914 > 0.1->875). SCALE=0.1 is the optimum.","timestamp":1783513068120,"segment":6,"confidence":1,"asi":{"hypothesis":"randsigma SCALE=0.05 (mean std 0.025)","mean_std":0.025,"result":"ED 914 > SCALE=0.1's 875, sharp 0.98, mass 0.027 (worse). U-shape low side confirmed: 0.05->914, 0.1->875, 0.2->1051. SCALE=0.1 is the optimum.","next_action":"confirm 0.1 is bottom with SCALE=0.15"}}
{"run":208,"commit":"bb43bed","metric":1051.93,"metrics":{},"status":"discard","description":"randsigma SCALE=0.15 (mean std 0.075): ED 1052, ed_late 1061, sharp 1.11 (overshoot), mass 0.048. WORSE than 0.1 (875). SCALE=0.1 confirmed optimum. U-shape complete: 0.05->914, 0.1->875, 0.15->1052, 0.2->1051, 1.0->1223.","timestamp":1783513446904,"segment":6,"confidence":1.1105297580117734,"asi":{"finding":"SCALE=0.1 is the randsigma optimum (U-shape bottom). Complete sweep: 0.05->914, 0.1->875, 0.15->1052, 0.2->1051, 1.0->1223.","hypothesis":"randsigma SCALE=0.15","result":"ED 1052 > 0.1's 875, sharp 1.11 overshoot, mass 0.048. Confirms 0.1 optimum."}}
{"run":209,"commit":"3269de2","metric":789.39,"metrics":{},"status":"keep","description":"randsigma SCALE=0.1 @6000 steps /500 traj (longer+bigger): ED 789, ed_late 853, sharp 1.05, mass 0.021. NEW BEST (-10% vs 4500/220 champion 875). Longer training + bigger dataset helped. ed_floor 0.0047 (stable). Need matched none control to confirm technique still beats base.","timestamp":1783513731953,"segment":6,"confidence":1.6225431207380667,"asi":{"control_needed":"none @6000/500 matched control (does randsigma still beat none, or did base model outgrow it like flat-gaussian did?)","hypothesis":"randsigma SCALE=0.1 + longer training (6000) + bigger dataset (500 traj) compounds","result":"ED 789, new best (-10% vs 4500/220's 875). Longer+bigger IMPROVED the randsigma model. ed_floor 0.0047 slightly up (bigger ref set) but stable/trustworthy.","vs_flat_gaussian":"flat-gaussian champion was 792 @4500/220 and 755 @6000/220; randsigma 789 @6000/500 is competitive"}}
{"run":210,"commit":"2138000","metric":634.47,"metrics":{},"status":"keep","description":"CONTROL none @6000/500: ED 634, ed_late 623, sharp 1.00, mass 0.0075. BEATS randsigma@6000/500 (789) by 20% AND best absolute metric+quality. KEY: randsigma is an ACCELERATOR the model outgrows (like flat-gaussian). @4500/220 noise helps (875<951); @6000/500 base wins (634<789). Longer+bigger helps the base model most.","timestamp":1783514026026,"segment":6,"confidence":2.669026250368686,"asi":{"accelerator_vs_compounder":"randsigma = ACCELERATOR not compounder (same as flat-gaussian). @4500/220 randsigma 875<none 951 (helps -8%); @6000/500 randsigma 789>none 634 (base outgrows it, +24% tax).","answer_to_user":"longer+bigger helps the BASE model most. Random pixel noise on context gets outgrown with more compute+data. none@6000/500 sharp 1.00/mass 0.0075 is best quality.","hypothesis":"matched none control @6000/500 - does randsigma still beat base at higher compute+data?","result":"none ED 634 < randsigma 789 (-20%). Base model OUTGROWS the random pixel noise at high compute+data. none@6000/500 is best absolute metric+quality (sharp 1.00 ideal, mass 0.0075 lowest).","sharpness_mass_confirm":"none sharp 0.999 (ideal) mass 0.0075 vs randsigma sharp 1.05 mass 0.021 - base genuinely better, not metric-gaming"}}
{"run":211,"commit":"2138000","metric":787.25,"metrics":{},"status":"discard","description":"none @6000/1000 (bigger data, same compute): ED 787, sharp 0.91 (blurry), mass 0.060. WORSE than 6000/500 (634) - undertraining (7 vs 15 epochs). Bigger dataset at fixed compute HURTS; needs proportionally more compute. 6000/500 is the sweet spot at this compute level.","timestamp":1783514343293,"segment":6,"confidence":2.492484457385692,"asi":{"epoch_tradeoff":"500@6000=15 epochs (best 634); 1000@6000=7 epochs (undertrained 787). Bigger data needs proportionally more compute.","finding":"BIGGER DATASET at fixed compute UNDERTRAINS. 1000 traj@6000 (7 epochs) sharp 0.91 blurry, mass 0.060 vs 500@6000 (15 epochs) sharp 1.00 mass 0.0075. Confirms prior '2k needs ~9x compute'.","hypothesis":"none@6000/1000 - does doubling data at fixed compute help?","result":"WORSE: ED 787>634, sharp 0.91 (undertraining blur), mass 0.060. 6000/500 is the sweet spot at this compute.","sweet_spot":"none@6000/500 = 634"}}
{"run":212,"commit":"2138000","metric":877.43,"metrics":{},"status":"discard","description":"none @9000/750 (scaling test, ~15 epochs): ED 877, sharp 1.08, mass 0.029. WORSE than 6000/500 (634). OVERTRAINING - train_loss 0.000018 (tiny) but rollout degrades (ViT overfits training traj, AR drift amplifies). 6000/500 confirmed sweet spot: both undertrain (1000@6000) & overtrain (9000) worse.","timestamp":1783514723702,"segment":6,"confidence":2.9447259541629864,"asi":{"compute_u_shape":"none: 4500/220=951, 6000/500=634(best), 6000/1000=787(undertrain,7ep), 9000/750=877(overtrain). 6000/500 is the sweet spot - both under&over-training worse.","finding":"OVERTRAINING: 9000 steps/750 traj ED 877 > 6000/500's 634 (+38%, way above 17% noise). train_loss 0.000018 (tiny) but rollout degrades = ViT overfits training trajectories at long training, AR drift amplifies. Even with similar epochs (~15), more steps destabilizes bridge+ViT.","hypothesis":"none@9000/750 (compute+data 1.5x, keep ~15 epochs) - does scaling keep helping?","result":"WORSE: ED 877, sharp 1.08 (overshoot), mass 0.029. 6000/500 is the practical optimum."}}
