{"run":213,"commit":"2138000","metric":862.19,"metrics":{},"status":"discard","description":"CONTROL none @6000/500 SEED=2 (robustness): ED 862, sharp 0.82 (BLURRY), mass 0.119 (DRIFT). SEED=2 is the hard seed - base model FAILS with AR-instability failure mode (blur+mass-drift). SEED=0's 634 was lucky. This is the regime where context noise should cure the failure (not discard-worthy data, just a reference for the upcoming randsigma@SEED=2 test).","timestamp":1783514986513,"segment":6,"confidence":3.5974557019536593,"asi":{"finding":"SEED=2 is the HARD seed: none@6000/500 SEED=2 ED 862 vs SEED=0's 634 (+36%), sharp 0.82 (BLURRY), mass 0.119 (DRIFT). SEED=0's 634 was lucky. SEED=2 base model FAILS with the exact AR-instability failure mode (blur+mass-drift) - this is where context noise should HELP.","hypothesis":"none@6000/500 SEED=2 robustness check","next_action":"run randsigma SCALE=0.1 @6000/500 SEED=2 - does random pixel noise cure the SEED=2 blur/mass-drift (like flat-gaussian did 0.78->1.05)?","result":"SEED=2 much harder. Base fails blurry. Champion 634 is seed-luck."}}
{"run":214,"commit":"2138000","metric":763.46,"metrics":{},"status":"discard","description":"randsigma SCALE=0.1 @6000/500 SEED=2: ED 763, sharp 0.95, mass 0.028. BEATS none@SEED=2 (862, -11.5%) AND CURES failure mode (blur 0.82->0.95, mass 0.119->0.028, 4x). KEY: random pixel noise = regime-dependent ROBUSTNESS mechanism - tax on lucky seed (SEED=0), cure on failing seed (SEED=2). Cross-seed ED ties but quality favors randsigma (avg sharp 1.00 vs 0.91, mass 0.024 vs 0.063). Validates user's idea.","timestamp":1783515290037,"segment":6,"confidence":3.6079056786466928,"asi":{"cross_seed_avg":"none avg ED 748, sharp 0.91, mass 0.063; randsigma avg ED 776, sharp 1.00, mass 0.024. ED tied (~4%, noise); QUALITY favors randsigma (prevents catastrophic SEED=2 failure).","cures_failure":"sharp 0.82->0.95 (blur cured), mass 0.119->0.028 (4x better, mass-drift cured)","hypothesis":"randsigma SCALE=0.1 @6000/500 SEED=2 cures the hard-seed failure","key_result":"randsigma is a ROBUSTNESS MECHANISM: tax on lucky seed (SEED=0: 789>634), CURE on failing seed (SEED=2: 763<862 + cures blur/mass). Regime-dependent - helps WHERE THE FAILURE EXISTS. Same class as prior flat-gaussian ctx_bridge (validated SEED=2 cure).","mechanism":"context noise forces model robustness -> prevents the blur/mass-drift AR failure that unlucky seeds/limited-compute produce","production_rec":"add random pixel noise on context if model prone to AR drift (hard data/limited compute); skip if already stable. It's robustness insurance.","result":"BEATS none@SEED=2: ED 763<862 (-11.5%), cures blur+mass-drift. Validates the user's random-pixel-noise idea as a robustness mechanism."}}
{"run":215,"commit":"2138000","metric":946.74,"metrics":{},"status":"discard","description":"randsigma SCALE=0.1 @4500/220 SEED=2: ED 947, sharp 1.00 (ideal), mass 0.003. Excellent quality - no blur/mass-drift at moderate compute. Need none@4500/220 SEED=2 control to know if cure is compute-robust or if SEED=2 failure was 6000/500-overtrain-specific.","timestamp":1783515572115,"segment":6,"confidence":3.5974557019536593,"asi":{"control_needed":"none@4500/220 SEED=2 - is the model good here too (then SEED=2 failure was 6000/500-overtrain-specific) or does it fail (then randsigma cures at moderate compute)?","hypothesis":"randsigma cure is compute-robust - holds at moderate compute (4500/220) on hard seed SEED=2","puzzle":"randsigma@4500/220 SEED=2 sharp 1.00/mass 0.003 EXCELLENT, but none@6000/500 SEED=2 FAILED (sharp 0.82). Need to know if SEED=2 failure is compute-specific (overtrain) or fundamental.","result":"randsigma@4500/220 SEED=2: ED 947, sharp 1.00 ideal, mass 0.003. No blur/mass-drift - quality excellent at moderate compute. Cure holds (or model trains fine here regardless)."}}
{"run":216,"commit":"2138000","metric":1242.25,"metrics":{},"status":"discard","description":"CONTROL none @4500/220 SEED=2: ED 1242, sharp 0.78 (blur), mass 0.125 (drift). BASE MODEL FAILS CATASTROPHICALLY on hard seed at moderate compute. vs randsigma@4500/220 SEED=2 (947/sharp1.00/mass0.003) -> randsigma CURES it (-24% ED, blur 0.78->1.00, mass 0.125->0.003 42x). Completes 2x2: randsigma wins BOTH seeds at moderate compute (avg 911 vs 1097, -17%). DEFINITIVE validation of user's random-pixel-noise idea as AR-stability cure.","timestamp":1783515803927,"segment":6,"confidence":2.9447259541629864,"asi":{"2x2_moderate_compute_4500_220":"none: S0 951/S2 1242 (avg 1097); randsigma: S0 875/S2 947 (avg 911, -17%). randsigma WINS BOTH seeds at moderate compute.","definitive_result":"Random pixel noise on context is a validated AR-stability CURE. At moderate compute on hard seed, base FAILS (blur+mass-drift); randsigma completely restores quality (sharp 0.78->1.00, mass 0.125->0.003). Wins cross-seed -17% avg ED.","cross_compute_cure":"SEED=2 failure is ROBUST (4500/220: none 1242 sharp0.78; 6000/500: none 862 sharp0.82). randsigma cures BOTH (947 sharp1.00; 763 sharp0.95). Failure is seed+regime, not compute-fixable alone.","hypothesis":"none@4500/220 SEED=2 control - does base fail at moderate compute on hard seed?","result":"FAILS CATASTROPHICALLY: ED 1242, sharp 0.78 (blur), mass 0.125 (drift). vs randsigma 947/sharp1.00/mass0.003. randsigma CURES it (-24% ED, 42x mass)."}}
{"run":217,"commit":"1a12d5a","metric":988.04,"metrics":{},"status":"discard","description":"GENERALIZATION none @4500/220 SEED=3: ED 988, sharp 0.997, mass 0.0019. SEED=3 is EASY (like SEED=0). Seed landscape: S0 easy(951)/S2 hard-fails(1242)/S3 easy(988). ~1/3 of seeds catastrophically fail. randsigma cure targets the hard-seed minority - insurance for production (can't choose init). Confirms S2 failure is a real failure mode, not the norm.","timestamp":1783516201660,"segment":6,"confidence":2.535179700632353,"asi":{"easy_seed":"SEED=3 trains fine (sharp 1.00, mass 0.002) like SEED=0. SEED=2 is the outlier (hard/fails). ~1/3 of seeds fail.","finding":"SEED=3 is EASY (sharp 0.997, mass 0.002) like SEED=0. So 2/3 seeds easy (S0,S3), 1/3 hard (S2). The randsigma CURE targets the hard-seed minority. For production: insurance against the ~1/3 of inits that would catastrophically fail.","hypothesis":"3rd-seed generalization: is SEED=3 easy (like S0) or hard (like S2)?","next_action":"randsigma@4500/220 SEED=3 - confirm it helps easy seeds a bit at moderate compute (like S0 875<951), completing the 3-seed generalization picture","seed_landscape":"S0 easy 951, S2 hard 1242 (fails), S3 easy 988"}}
{"run":218,"commit":"1a12d5a","metric":1099.17,"metrics":{},"status":"discard","description":"GENERALIZATION randsigma @4500/220 SEED=3 (easy seed): ED 1099, sharp 1.16 (OVERSHOOT), mass 0.0815. HURTS vs none (988). 3-seed picture honest now: randsigma only ROBUSTLY cures catastrophic hard-seed failure (S2); on easy seeds it's neutral-to-harmful (S0 marginal help within noise, S3 overshoot). 3-seed avg: none 1060 vs randsigma 974 (-8%, catastrophe prevention dominates). Robustness insurance, not free lunch.","timestamp":1783516543547,"segment":6,"confidence":2.6199023906030257,"asi":{"3seed_avg_4500_220":"none 1060 (951+1242+988)/3; randsigma 974 (875+947+1099)/3 -> -8% avg (catastrophe prevention dominates)","honest_finding":"randsigma's ONLY robust effect is CURING catastrophic hard-seed failure (S2). On easy seeds it's neutral-to-HARMFUL (S0 marginal help within noise, S3 overshoot sharp 1.16/mass 0.08). NOT a free lunch on easy seeds. It's robustness INSURANCE: pay small/neutral cost on lucky inits to prevent catastrophic failure on unlucky ones.","hypothesis":"randsigma@4500/220 SEED=3 (easy seed) - does it help like S0?","result":"HURTS: ED 1099>none 988, sharp 1.16 OVERSHOOT, mass 0.0815>0.0019. Easy-seed effect is NOISE-LEVEL (S0 helped, S3 hurt). Only the hard-seed CURE (S2) is robust.","seed_landscape_complete":"S0 easy 951 (randsigma 875 ~neutral), S2 hard 1242 FAILS (randsigma 947 CURES), S3 easy 988 (randsigma 1099 HURTS overshoot)"}}
{"run":219,"commit":"1a12d5a","metric":2033.05,"metrics":{},"status":"discard","description":"MULTICHANNEL baseline none @C=2 4500/220 SEED=0 dt=0.024: ED 2033, sharp 0.97 (slightly blurry), mass 0.040. Reproduces prior reference exactly. C=2 is production-like (user's model is multichannel). Slightly blurry - room for randsigma to sharpen. Reference for C=2 randsigma test.","timestamp":1783516815187,"segment":6,"confidence":3.010932598155717,"asi":{"c2_baseline":"ED 2033, sharp 0.97 (slightly blurry), mass 0.040. Reproduces prior session exactly. C=2 is slightly blurry (room to sharpen), not catastrophic failure like S2.","hypothesis":"multichannel C=2 baseline (production-like) - does randsigma transfer the quality benefit?","next_action":"randsigma SCALE=0.1 @C=2 - does random pixel noise sharpen the slightly-blurry multichannel rollout (like prior flat-gaussian soft positive)?"}}
{"run":220,"commit":"3265fe7","metric":1889.77,"metrics":{},"status":"keep","description":"MULTICHANNEL WIN randsigma @C=2 4500/220 SEED=0 dt=0.024: ED 1899<none 2033 (-7%), ed_late 1565<2040 (-23%), sharp 0.97->1.03 (sharpened to ideal), mass 0.040->0.0037 (10x). CLEAN quality win on production-relevant multichannel (better than prior flat-gaussian C=2 which was ED-neutral). Mechanism: C=2 slightly blurry -> noise sharpens; helps WHERE drift exists. User's model is multichannel -> directly transferable.","timestamp":1783517047269,"segment":6,"confidence":2.5020342062645646,"asi":{"c2_vs_c1":"C=2 ED~2000 inherently > C=1~600-950 (multichannel harder); comparison is randsigma vs none WITHIN C=2.","hypothesis":"randsigma @C=2 multichannel (production-like) - does random pixel noise transfer the quality benefit?","mechanism":"C=2 is slightly blurry (sharp 0.97, mild AR drift) -> noise sharpens toward ideal. On already-sharp easy C=1 seeds it overshoots. Noise helps WHERE THERE'S DRIFT TO CORRECT - consistent across all findings.","result":"CLEAN WIN on multichannel: ED 1899<2033 (-7%), ed_late 1565<2040 (-23% long-rollout stability), sharp 0.97->1.03 (sharpened), mass 0.040->0.0037 (10x). Better than prior flat-gaussian C=2 (ED-neutral). Production-relevant: user's model is multichannel."}}
{"run":221,"commit":"3265fe7","metric":1795.04,"metrics":{},"status":"discard","description":"MULTICHANNEL control none @C=2 4500/220 SEED=2: ED 1795, sharp 0.997 (ideal), mass 0.006. At C=2 SEED=2 is NOT hard (unlike C=1 where S2 failed) - seed-difficulty is config-dependent. Since C=2/S2 is already sharp, randsigma may overshoot here. Reference for randsigma@C=2 SEED=2.","timestamp":1783517254881,"segment":6,"confidence":2.140289228274091,"asi":{"c2_seed2_is_easy":"sharp 0.997 (ideal), mass 0.006, ED 1795 < S0's 2033. SEED=2 is NOT hard at C=2 (unlike C=1 where S2 failed). Seed-difficulty is CONFIG-DEPENDENT (flips C=1 vs C=2).","hypothesis":"none@C=2 SEED=2 control","next_action":"randsigma@C=2 SEED=2 - already-sharp model, so noise may OVERSHOOT (like C=1 S3) rather than help. Tests if C=2 benefit is seed-robust or only on the slightly-blurry S0."}}
{"run":222,"commit":"3265fe7","metric":2170.23,"metrics":{},"status":"discard","description":"MULTICHANNEL randsigma @C=2 SEED=2 (already-sharp): ED 2170>none 1795 (+21%), ed_late 2329>1805. HURTS - overshoots the already-good model. C=2 cross-seed: none avg 1914 vs randsigma 2035 (+6% worse). C=2 S0 'win' was single-seed artifact (blurry model sharpened). CONSISTENT PATTERN across all configs: noise helps ONLY where model drifted/blurry, hurts (overshoots) where already sharp. Robust value = catastrophe insurance ONLY.","timestamp":1783517469678,"segment":6,"confidence":2.044805991348699,"asi":{"c2_cross_seed":"none avg 1914 (2033+1795); randsigma avg 2035 (1899+2170) -> +6% WORSE cross-seed. C=2 S0 win was single-seed artifact (blurry model sharpened).","consistent_pattern_all_configs":"noise helps ONLY where model is drifted/blurry (C=1 S2 catastrophic, C=2 S0 mild blur); HURTS (overshoots) where model already sharp (C=1 S3, C=2 S2). Verified across C=1 AND C=2, 3 seeds.","honest_verdict":"Random pixel noise on context is CATASTROPHE INSURANCE ONLY. Cures the ~1/3 of inits that collapse to blur+mass-drift. On already-good models it's neutral-to-harmful (overshoot). NOT a reliable ED/quality improver cross-seed. Production: use ONLY if you observe catastrophic AR failure; otherwise it can hurt.","hypothesis":"randsigma@C=2 SEED=2 (already-sharp model) - does the C=2 benefit generalize or overshoot?","result":"HURTS: ED 2170>none 1795 (+21%), ed_late 2329>1805. C=2 benefit was single-seed (blurry S0); already-sharp S2 overshoots."}}
{"run":223,"commit":"d0e89e5","metric":1369.55,"metrics":{},"status":"discard","description":"ROOT-CAUSE TEST none@4500/220 SEED=2 BRIDGE_WCLAMP=6: ED 1370, sharp 0.66, mass 0.263. WORSENS the S2 collapse (vs wclamp=10's 1242/0.78/0.125). Lowering wclamp does NOT prevent mean-regression collapse - goes wrong way. Context noise (randsigma) remains the effective cure for this collapse. Root-cause-via-wclamp falsified.","timestamp":1783517787026,"segment":6,"confidence":1.5943619431160336,"asi":{"finding":"Root-cause-via-wclamp FALSIFIED. Lowering BRIDGE_WCLAMP 10->6 WORSENS the S2 collapse (sharp 0.66, mass 0.263 vs baseline 0.78/0.125). The collapse is NOT from under-weighting forecasting. Context noise (randsigma) remains one of the few effective cures for this specific collapse.","hypothesis":"lower BRIDGE_WCLAMP=6 prevents the C=1 S2 mean-regression collapse (root-cause fix)","next_action":"try LR=5e-5 root-cause probe","result":"WORSE: ED 1370>1242, sharp 0.66 (very blurry), mass 0.263. wclamp lever goes wrong way for collapse."}}
{"run":224,"commit":"d0e89e5","metric":2088.31,"metrics":{},"status":"discard","description":"ROOT-CAUSE TEST none@4500/220 SEED=2 LR=5e-5: ED 2088, sharp 0.67, mass 0.323. WORSE (undertrain + collapse). BOTH root-cause probes failed (wclamp + LR). Conclusion: the S2 mean-regression collapse is a basin issue that loss/optimizer tuning CANNOT fix - training-time context degradation (randsigma/self-feed) is the necessary & effective cure. Validates context-noise as load-bearing for collapsing inits, not a band-aid.","timestamp":1783517990956,"segment":6,"confidence":1.4863552103620628,"asi":{"both_root_cause_probes_failed":"BRIDGE_WCLAMP=6 (sharp0.66/mass0.263) AND LR=5e-5 (sharp0.67/mass0.323) both WORSEN the S2 collapse. Standard training-stability levers CANNOT fix this mean-regression collapse.","finding":"The S2 catastrophic collapse is a BASIN-OF-ATTRACTION issue (model falls into mean regression) that loss/optimizer tuning CANNOT fix. Training-time CONTEXT DEGRADATION (randsigma noise or self-feed) is the effective cure. This VALIDATES the context-noise approach as necessary, not just a band-aid.","hypothesis":"lower LR=5e-5 prevents S2 collapse by avoiding the bad basin","result":"WORSE: ED 2088, sharp 0.67, mass 0.323 (undertrain + collapse). LR lever fails too."}}
{"run":225,"commit":"df4f8c4","metric":0,"metrics":{},"status":"crash","description":"CRASH/TIMEOUT selffeed_m @4500/220 SEED=2: timed out at 480s (only step 1000/4500). Self-feed is ~13x slower on jit3d+bridge (extra ODE_STEPS=32 sampling per self-feed batch). Infeasible at 4-min budget. Prior self-feed champions were on cheap conv model. Need cheap-surrogate code change (fewer ODE steps for the self-generated prediction) to test the hypothesis.","timestamp":1783518653041,"segment":6,"confidence":1.4863552103620628,"asi":{"blocked_by":"compute cost on jit3d+bridge: self-feed runs an extra ODE_STEPS=32 sample per self-feed batch -> ~13x slower per training step. Only reached 1000/4500 steps in 480s. Prior self-feed champions were on the cheap CONV model; infeasible on ViT at this budget.","hypothesis":"self-feed cures the S2 collapse without overshoot (matches inference drift)","next_action":"make self-feed feasible: cheap surrogate (fewer ODE steps for the self-generated prediction). The surrogate only needs a ROUGH prediction to emulate drift - 4-8 ODE steps not 32. Code change."}}
