{"run":88,"commit":"0fe840a","metric":1656.67,"metrics":{"ed_late":1784.03,"mmd":0.393784,"sharpness_ratio":1.183745,"mass_drift":0.003719,"train_loss":0.642018,"wall_s":88.96},"status":"discard","description":"TRANSFER: recipe is SPARSE-DATA-SPECIFIC. Dense (N_BLOBS=2): none=1392 (already stable), manifold_noise->3304 (hurts, artifacts), averaging->1657 (hurts, ghosts blobs). Both levers hurt on dense. Use recipe ONLY for sparse fields; dense fields need neither. Key weather insight.","timestamp":1783261248179,"segment":3,"confidence":2.1446472585621454,"asi":{"hypothesis":"Transfer test: does the champion recipe (manifold_noise + averaging) generalize to DENSER/multi-blob data (closer to complex weather)?","finding":"REGIME-DEPENDENT - both levers are SPARSE-DATA-SPECIFIC. Dense data (N_BLOBS=2): none (no aug) is already stable (ED 1392, sharp 1.18, mass 0.005 - the dense mean is non-degenerate so no blur collapse). manifold_noise HURTS dense (1392->3304, artifacts sharp 2.30). Averaging HURTS dense (1392->1657 - different noise samples place blobs differently -> averaging ghosts them).","complete_regime_picture":"Sparse (1 blob): manifold_noise+averaging=451 (essential, 5622->451). Dense (2 blobs): NONE is best (1392); both levers hurt. The recipe is SPARSE-DATA-SPECIFIC.","transferable_insight_for_user":"CRITICAL for weather: use manifold_noise+averaging ONLY on SPARSE fields (convective cells, lightning, clear-air - where 'blurry cells' failure occurs). On DENSE fields (stratiform, overcast) the model is naturally stable - apply NEITHER lever (they cause artifacts/ghosting). Match the technique to the data density. This extends/confirms FINDINGS_VIDEO.md's regime-dependence conclusion.","not_overfitting":"This is a transfer/generalization characterization across data regimes (sparse vs dense), not seed-0 hyperparameter tuning."}}
{"run":89,"commit":"0fe840a","metric":9447.61,"metrics":{"ed_late":10449.86,"mmd":0.404124,"sharpness_ratio":2.176976,"mass_drift":0.412301,"train_loss":0.085623,"wall_s":74.2},"status":"discard","description":"ABLATION: amplitude jitter is ESSENTIAL. Blur-only (jitter=0) -> ED 9448 (21x worse than champion 451), sharp 2.18 artifacts, mass_drift 0.41. Blur alone over-sharpens; jitter balances it + teaches mass robustness. Both components load-bearing.","timestamp":1783261744357,"segment":3,"confidence":2.03559918200409,"asi":{"ablation":"manifold_noise blur-ONLY (MANIFOLD_JITTER=0) vs champion (jitter=0.20), both LAST_ONLY + SAMPLE_AVG=4 + ODE32","finding":"AMPLITUDE JITTER IS ESSENTIAL, not a minor add-on. Blur-only -> ED 9448, sharp 2.18 (ARTIFACTS), mass_drift 0.41. ~21x worse than champion (451, sharp 1.11, mass 0.05).","mechanism":"Blur corruption teaches the model to deblur/sharpen. WITHOUT amplitude jitter, the model OVER-COMPENSATES -> artifacts (sharp 2.18) and mass drift (0.41). The amplitude jitter BALANCES the blur: it also teaches amplitude/mass robustness, preventing over-sharpening and keeping mass_drift low. The two operations are complementary - blur alone is actively harmful (worse than no-aug).","conclusion":"Both components are load-bearing: blur (positional/width robustness) + amplitude jitter (mass/amplitude robustness + prevents over-sharpening). Neither alone works. The full manifold_noise (blur+jitter) is required."}}
{"run":90,"commit":"0fe840a","metric":1118.84,"metrics":{"ed_late":1176.2,"mmd":0.404124,"sharpness_ratio":0.899253,"mass_drift":0.010671,"train_loss":0.106465,"wall_s":74.2},"status":"discard","description":"COMPLETE 2x2 ablation: jitter is PRIMARY (jitter-only 1119 >> blur-only 9448). Blur adds ~2.5x on top of jitter (1119->451) but is catastrophic alone. If forced to pick one component, keep amplitude jitter.","timestamp":1783261912905,"segment":3,"confidence":2.16105529165545,"asi":{"ablation":"COMPLETE 2x2 of manifold_noise components (LAST_ONLY + SAMPLE_AVG=4 + ODE32): blur-only(jitter=0)=9448 sharp2.18; jitter-only(blur=0)=1119 sharp0.90; both=451 sharp1.11","finding":"JITTER IS THE PRIMARY STABILIZER; blur is a complementary enhancer. Jitter-only (1119) >> blur-only (9448 catastrophic artifacts). Jitter is what prevents the over-sharpening catastrophe (sharp 0.90 vs 2.18). Blur then ADDS ~2.5x ON TOP of jitter (1119->451) via width-robustness, but blur is UNUSABLE ALONE (9448).","complete_picture":"Amplitude jitter = load-bearing primary (mass/amplitude robustness + prevents over-sharpening). Blur = secondary enhancer that only helps when jitter present (width/positional-smoothing robustness). Both needed for the full 451, but if forced to choose one, jitter alone (1119) >> blur alone (9448).","transferable":"For weather: if you simplify, keep the amplitude jitter (it's the essential part). Add blur for the extra ~2.5x. Never use blur alone."}}
{"type":"config","name":"JiT-3D production architecture: latent-context-noise corruption sweep for rollout stability","metricName":"rollout_ed","metricUnit":"","bestDirection":"lower"}
{"run":91,"commit":"adfa58a","metric":15861.95,"metrics":{"ed_late":21222.42,"mmd":0.404124,"sharpness_ratio":0.074237,"mass_drift":0.563048,"train_loss":0.25151,"wall_s":116.3},"status":"keep","description":"BASELINE: jit3d (production ViT, 800k params) + manifold_noise aug, built-in latent corruption OFF. ED=15862, sharp=0.07 (catastrophic blur collapse). Architecture + aug recipe don't transfer from conv2d; transformer needs its built-in LatentContextCorruptor. train_loss 0.25 (learns dynamics).","timestamp":1783275583550,"segment":4,"confidence":null,"asi":{"hypothesis":"JiT-3D transformer baseline with manifold_noise aug (conv2d champion recipe), latent corruptor off","finding":"CATASTROPHIC blur collapse (sharp 0.07, ED 15862) — 35x worse than conv2d champion (451). The conv2d augmentation recipe does NOT transfer to the ViT. The transformer is clearly meant to use its in-network LatentContextCorruptor (the whole design). Next: enable JIT_CORRUPT_* and sweep latent noise scales.","params":"embed_dim=128 depth=4 heads=4 patch=(1,4,4) ~800k params","next_action":"Turn ON LatentContextCorruptor (JIT_CORRUPT_PROB, EMBED, BLOCK0) and sweep magnitudes — this is the architecture's native AR-stability mechanism"}}
{"run":92,"commit":"adfa58a","metric":16911.47,"metrics":{"ed_late":21119.86,"mmd":0.404124,"sharpness_ratio":0.140823,"mass_drift":0.678161,"train_loss":0.364337,"wall_s":116.03},"status":"discard","description":"Bare jit3d (no aug, no latent corruption), LR 2e-4 (transformer-appropriate), 2000 steps. ED=16911, sharp=0.14, train_loss 0.36. Still catastrophic — ViT is UNDERTRAINED (conv reaches 0.11; ViT stuck at 0.36). Need more steps before judging corruption.","timestamp":1783275929571,"segment":4,"confidence":null,"asi":{"hypothesis":"Bare ViT at lower LR would produce a non-blank rollout","finding":"NO — still blur collapse (sharp 0.14). The ViT is undertrained: train_loss 0.36 vs conv 0.11. None of the corruption/aug techniques can be evaluated until the model actually fits the dynamics.","next_action":"Increase TRAIN_STEPS to 4000 + LR 4e-4 to get the ViT to conv-level training loss, THEN re-evaluate corruption techniques. Fix the training before tuning the stability lever."}}
{"run":93,"commit":"adfa58a","metric":20027.94,"metrics":{"ed_late":22936.51,"mmd":0.404124,"sharpness_ratio":0.128338,"mass_drift":0.674102,"train_loss":0.488871,"wall_s":115.34},"status":"discard","description":"LR 1e-4 stable but underfits (train_loss 0.49, worse than LR 2e-4's 0.36). Rollout still collapses (sharp 0.13). ViT needs both better training AND a working corruption mechanism — but model is too undertrained to evaluate either.","timestamp":1783276350772,"segment":4,"confidence":null,"asi":{"hypothesis":"Lower LR 1e-4 stabilizes ViT training","finding":"Stable but underfits (0.49 vs 0.36 at LR 2e-4). LR sweep so far: 1e-4->0.49, 2e-4->0.36, 4e-4->unstable(spike to 2.8). Sweet spot ~2-3e-4. But even best (0.36) gives catastrophic rollout (sharp 0.14).","viability_concern":"800k-param ViT may be too big to train well in 2000 steps on this small dataset (conv model is much smaller and reaches 0.11). Consider shrinking the ViT (embed_dim=64, depth=3) so it converges faster, THEN evaluate corruption.","next_action":"Shrink ViT to ~250k params + LR 2-3e-4 + 3000 steps to reach conv-level train_loss, then sweep latent corruption"}}
{"run":94,"commit":"adfa58a","metric":32976.76,"metrics":{"ed_late":39035.97,"mmd":0.404124,"sharpness_ratio":0.310654,"mass_drift":0.456917,"train_loss":0.252692,"wall_s":135.94},"status":"discard","description":"Smaller ViT (embed=64,depth=3,~170k params ≈ conv size) trains better: loss 0.25 (vs 0.36 @800k), sharp 0.31 (vs 0.14). But ED WORSE (32977) — sharper texture yet more positional divergence in rollout. Anchoring corruption sweep on 800k production model.","timestamp":1783276576766,"segment":4,"confidence":null,"asi":{"anchor_decision":"Use 800k production-size model (LR 2e-4, 2000 steps, ED 16911 baseline) for the corruption sweep — it's the user's actual production architecture, so corruption results transfer directly.","hypothesis":"Shrink ViT to conv-size (~200k) for faster convergence","lr_sweep_summary":"800k model: LR 1e-4->loss0.49, 2e-4->0.36(best,stable), 4e-4->unstable(spike2.8). Use 2e-4.","next_action":"Sweep JIT_CORRUPT_{PROB,EMBED,BLOCK0} on the 800k anchor (LR 2e-4). Production defaults: PROB=0.3 EMBED=0.10 BLOCK0=0.05."}}
{"run":95,"commit":"adfa58a","metric":27327.95,"metrics":{"ed_late":33475.6,"mmd":0.404124,"sharpness_ratio":0.142919,"mass_drift":0.586498,"train_loss":1.064685,"wall_s":129.41},"status":"discard","description":"Latent corruption at PRODUCTION defaults (PROB=0.3,EMBED=0.10,BLOCK0=0.05) on 800k anchor: ED 16911→27328, train_loss 0.36→1.06. TOO STRONG for this small-data regime — corruption prevents the undertrained ViT from fitting. Production calibrations assume a well-trained model on large data.","timestamp":1783276753350,"segment":4,"confidence":null,"asi":{"hypothesis":"Production latent corruption defaults stabilize the ViT rollout","finding":"OPPOSITE — too strong. train_loss 0.36->1.06 (corruption prevents fitting), ED 16911->27328. The production ViT corruption is calibrated for large weather data where the model trains well; here the ViT is undertrained (220 traj) and can't absorb the perturbation.","mechanism_note":"Corruption forces info-spreading robustness, but requires enough training budget that the model can both fit AND spread. Undertrained model just gets noisier.","next_action":"Try MUCH milder corruption (EMBED=0.02-0.03, BLOCK0=0.01) to find if a sweet spot exists where it helps without destroying the fit."}}
{"run":96,"commit":"adfa58a","metric":0,"metrics":{"ed_late":550091.5,"mmd":0.404124,"sharpness_ratio":20.710204,"mass_drift":3.208231,"train_loss":1035.650635,"wall_s":115.12},"status":"crash","description":"CRASH: warmup(300)+LR2e-4 diverged (loss 855, train_loss 1036, sharp 20.7). Warmup→cosine holds peak LR longer; combined with ViT's knife-edge at 2e-4 → divergence. Confirms LR 2e-4 is unsafe. Switching to stable LR 1e-4 + longer training per user direction.","timestamp":1783277234003,"segment":4,"confidence":null,"asi":{"finding":"WARMUP DIVERGED the ViT (loss 855, sharp 20.7, train_loss 1035). My warmup->cosine holds peak LR LONGER than cosine-from-0, and LR 2e-4 is on a divergent knife-edge for this ViT - run #92's 0.36 was a lucky landing, not stable.","lr_stability_map":"1e-4=stable(0.49), 2e-4=knife-edge(spike 2.5, landed 0.36 once, diverged with warmup), 4e-4=diverge. SAFE LR is ~1e-4.","next_action":"Per user: train LONGER. Use safe LR 1e-4 + short warmup 200 + 4000 steps to get train_loss well under 0.2 reliably, THEN re-test corruption. Don't chase the unstable 2e-4 basin."}}
{"run":97,"commit":"32b0863","metric":24433.4,"metrics":{"ed_late":31111.15,"mmd":0.404124,"sharpness_ratio":0.100722,"mass_drift":0.634416,"train_loss":0.224604,"wall_s":183.7},"status":"keep","description":"STABLE BASELINE established: jit3d fp32 (AMP=0) trains stably for 3000 steps (loss 0.22, best stable fit). fp32 prevents the bf16 cascade-divergence (optimizer recovered from inherent t≈0 loss spikes instead of blowing up). Added AMP/WARMUP/GRAD_CLIP env infra. Rollout still collapses (sharp 0.10) = AR exposure bias, NOT training failure. This unblocks the corruption sweep.","timestamp":1783278380415,"segment":4,"confidence":null,"asi":{"finding":"fp32 (AMP=0) PREVENTS cascade divergence - the ViT still has inherent loss spikes from the 1/(1-t)^2 weighting when t~=0 (2.13,0.65,2.75,0.51,1.46,0.22 cycle) BUT fp32 has enough range to RECOVER each time; bf16 cascaded to NaN-ish (loss 2453).","root_cause":"bf16 precision/range insufficient for the 200x loss-weight spikes - optimizer state corrupts irrecoverably. fp32 recovers.","infrastructure":"Added AMP, WARMUP_STEPS, GRAD_CLIP env vars. AMP=0 (fp32) is REQUIRED for jit3d to train >2000 steps. These edits are foundational - all corruption experiments depend on them.","new_stable_baseline":"jit3d fp32 3000 steps: train_loss 0.22 (best stable), but rollout still collapses (sharp 0.10, ED 24433) - same AR exposure-bias as conv. NOW corruption can be fairly tested.","next_action":"Sweep latent corruption on this stable fp32 baseline. Expect mild corruption to finally help since the model now trains cleanly."}}
{"run":98,"commit":"32b0863","metric":40013.77,"metrics":{"ed_late":50458.41,"mmd":0.404124,"sharpness_ratio":0.129693,"mass_drift":0.539099,"train_loss":1.463498,"wall_s":207.01},"status":"discard","description":"Latent corruption EMBED=0.05 on stable fp32 baseline: train_loss 0.22→1.46 (6.5x worse), ED 24433→40014. ViT is extremely sensitive to embed-stage context corruption at this budget. Need much milder corruption + more training headroom.","timestamp":1783278653635,"segment":4,"confidence":null,"asi":{"finding":"Latent corruption EMBED=0.05 (mild, 5% of token norm) STILL wrecks ViT training even in stable fp32: train_loss 0.22->1.46 (6.5x), ED 24433->40014. The ViT is far more sensitive to context-token corruption than conv is to input-space aug.","hypothesis_update":"Production corruption is calibrated for a WELL-trained ViT on large data. Here the ViT is undertrained (loss 0.22 vs conv 0.11) on tiny data (220 traj) and can't absorb context perturbation.","next_action":"Try VERY mild corruption (EMBED=0.01-0.02, low PROB) + MORE steps (4000, now stable in fp32) so the model has budget to both fit AND learn robustness. Corruption needs sufficient training headroom."}}
{"run":99,"commit":"e69f498","metric":19709.27,"metrics":{"ed_late":23742.57,"mmd":0.404124,"sharpness_ratio":0.081044,"mass_drift":0.738661,"train_loss":0.162079,"wall_s":267.32},"status":"keep","description":"FIRST CORRUPTION WIN: mild latent corruption (PROB=0.15, EMBED=0.02) + 4000 steps fp32. ED 24433→19709 (-19%), train_loss 0.16 (best stable). 4000-step budget lets the ViT both fit and absorb the corruption regularizer. Caveat: sharpness 0.10→0.08 (watch for collapse).","timestamp":1783278961737,"segment":4,"confidence":null,"asi":{"finding":"Mild corruption (PROB=0.15, EMBED=0.02) + 4000 steps fp32 = FIRST WIN. train_loss 0.16 (best ever, stable - corruption didn't prevent fitting), ED 24433->19709 (-19%). The extra training budget (4000 vs 3000) lets the model both fit AND absorb the corruption regularizer.","caveat":"Sharpness DROPPED 0.10->0.08 and mass_drift worsened 0.63->0.74 even as ED improved. Could be partial collapse (lower-amplitude rollout frames move pooled features toward reference). Need to verify sharpness doesn't keep degrading as corruption increases.","sweet_spot_hypothesis":"ViT corruption needs (a) mild magnitude (EMBED<=0.02), (b) low prob (<=0.15), (c) enough steps (>=4000) to fit+regularize simultaneously. Production defaults (0.3/0.10) are 5x too strong here.","next_action":"Sweep around this point: try EMBED=0.02+BLOCK0=0.01, and EMBED=0.03+PROB=0.15. Watch sharpness - want ED down WITHOUT further sharpness loss."}}
{"run":100,"commit":"e69f498","metric":12797.03,"metrics":{"ed_late":16107.09,"mmd":0.404124,"sharpness_ratio":0.075173,"mass_drift":0.787843,"train_loss":0.158613,"wall_s":267.06},"status":"discard","description":"DISCARD (collapse): +block0=0.01 lowered ED 19709→12797 but sharpness collapsed 0.08→0.075 and mass_drift 0.74→0.79. This is blur-collapse gaming ED, not real stability. Embed-stage latent corruption makes the ViT ignore context → mean regression. Pivoting to input-space aug on the stable fp32 ViT.","timestamp":1783279296753,"segment":4,"confidence":null,"asi":{"collapse_detected":"ED keeps dropping (24433->19709->12797) as corruption increases, BUT sharpness collapses (0.10->0.08->0.075) and mass_drift worsens (0.63->0.74->0.79). This is the metric-gaming failure mode: blurrier/low-amplitude rollout frames whose avg-pool features regress toward the reference distribution mean. NOT real stability.","mechanism":"Embed-stage context-token corruption makes the ViT underweight context (it's noisy) -> mean regression -> blur. Opposite of the intended stabilization. Latent corruption HURTS the ViT here.","discard_reason":"Catastrophic sharpness degradation (0.075, 13x below ideal 1.0) invalidates the ED 'improvement' per the keep/discard rule. The prior keep (#99, sharp 0.08) was already borderline collapse too.","next_action":"Pivot: test conv-champion INPUT-space aug (manifold_noise, LAST_ONLY=1, blur=0.5, jitter=0.20) on the now-STABLE fp32 ViT. Earlier manifold_noise ViT test (run #91) collapsed but that was UNSTABLE bf16 training. With stable fp32 it may finally work - input-space corruption teaches deblur WITHOUT making context ignorable."}}
{"run":101,"commit":"e69f498","metric":64124.2,"metrics":{"ed_late":68752.05,"mmd":0.404124,"sharpness_ratio":0.318415,"mass_drift":0.002255,"train_loss":0.424722,"wall_s":184.81},"status":"discard","description":"manifold_noise on stable fp32 ViT: sharp 0.32 + mass_drift 0.002 (REAL forecast quality, 3-4x sharper than latent corruption) but ED high (64124) from positional divergence, not blur. PROVES latent corruption is wrong for this ViT (collapses to blur) while input aug preserves quality. ED metric is gamed by blur here; trust sharpness+mass.","timestamp":1783279550413,"segment":4,"confidence":null,"asi":{"critical_finding":"INPUT-space aug (manifold_noise) on the stable fp32 ViT gives sharpness 0.32 (3-4x better than latent corruption's 0.075-0.10!) AND mass_drift 0.002 (near-perfect). Latent corruption COLLAPSES to blur; input aug PRESERVES real forecast quality. This directly answers the user's question: latent noise corruption is the WRONG mechanism for this ViT - it makes context ignorable -> mean regression -> blur.","metric_gaming_confirmed":"ED says latent corruption (12797) 'beats' manifold_noise (64124), but sharpness/mass show the OPPOSITE is true: corruption=blurry collapse (sharp 0.075, mass_drift 0.79), manifold=real forecast (sharp 0.32, mass 0.002). At these large ED magnitudes (vs conv's 451), the metric is dominated by positional/mass features and rewards blur-collapse. Trust sharpness+mass_drift, not ED, for the ViT.","high_ED_explanation":"manifold_noise ED=64124 is high because of POSITIONAL divergence (sharp blob in wrong place) from chaos amplifying the undertrained ViT's dynamics error - NOT blur. ed_late 68752 >> early confirms late-frame divergence.","next_action":"Gentler manifold_noise (jitter 0.10, less fit cost) + 4000 steps (more dynamics learning) + SAMPLE_AVG=4 to reduce positional divergence while keeping the sharp/mass-correct quality."}}
{"run":102,"commit":"e69f498","metric":30834.94,"metrics":{"ed_late":34084.42,"mmd":0.404124,"sharpness_ratio":0.176395,"mass_drift":0.38772,"train_loss":1.228156,"wall_s":238.69},"status":"discard","description":"Gentler manifold (jitter 0.10) + 4000 steps: unstable (train_loss 1.23), worse quality (sharp 0.18, mass 0.39). Longer training + aug destabilizes even in fp32. Best quality stays at jitter 0.20/3000 steps. Need lower LR for longer stable training.","timestamp":1783279842590,"segment":4,"confidence":null,"asi":{"finding":"Gentler manifold_noise (jitter 0.10, blur 0.4) + 4000 steps = WORSE and UNSTABLE: train_loss 1.23 (vs 0.42 @3000-step jitter0.20), sharp 0.18 (vs 0.32), mass_drift 0.39 (vs 0.002). Longer training + aug destabilizes even in fp32 - the aug noise compounds the t~=0 weight spikes.","best_real_quality_config":"manifold_noise LAST_ONLY jitter=0.20 blur_frac=0.5 @3000 steps fp32 SAMPLE_AVG=4: sharp 0.32, mass_drift 0.002 (run #101). This is the ViT's best REAL forecast quality.","next_action":"Keep the good aug (jitter 0.20) but train 4000 steps at LOWER LR (7e-5) + tighter grad clip for stability - more training time (user request) without the destabilization."}}
{"run":103,"commit":"e69f498","metric":0,"metrics":{"ed_late":615044.19,"mmd":0.404124,"sharpness_ratio":28.343333,"mass_drift":3.652081,"train_loss":1632.735596,"wall_s":238.28},"status":"crash","description":"CRASH: clip 0.5 + warmup + 4000 steps diverged (train_loss 1632). Re-confirms clip 0.5 (Adam amplification) and warmup (peak-LR hold) are both poisonous for this ViT. Clean isolation next.","timestamp":1783280136756,"segment":4,"confidence":null,"asi":{"finding":"CRASH again: grad_clip 0.5 + warmup + 4000 steps = full divergence (train_loss 1632). Confirms (again) clip 0.5 causes Adam amplification instability and warmup holds peak LR too long. These two are poisonous for this ViT.","stable_recipe":"fp32 + clip 1.0 + NO warmup + LR 1e-4 + <=3000 steps = stable. Anything else diverges.","next_action":"Clean isolation: good manifold config (jitter 0.20 blur 0.5) at 4000 steps with ONLY the step count changed from the stable 3000 recipe (clip 1.0, no warmup, LR 1e-4, fp32). Tests if 4000 steps is viable when nothing else is perturbed."}}
