{"run":147,"commit":"1e4c0b9","metric":5411.91,"metrics":{"ed_late":10836.386719,"mmd":0.404124,"sharpness_ratio":0.33439,"mass_drift":0.493097,"train_loss":0.048488,"wall_s":298.66},"status":"discard","description":"Texture-constrained adversary (hp=2.5): sharp 0.33, mass 0.49 — WORSE than unconstrained (0.63). Constraining to texture attacks texture (=sharpness) directly. Every adversarial direction the model needs → always hurts. Input-space adversarial = robustness-accuracy tradeoff, OOD for clean inference. Direction DEAD.","timestamp":1783343871086,"segment":4,"confidence":1.5287976360896987,"asi":{"result":"Texture-CONSTRAINED adversary (ADV_HP=2.5 high-pass, eps=0.05): ED 5412, sharp 0.33, mass 0.49, train_loss 0.048. WORSE than unconstrained (sharp 0.63) AND baseline (0.84).","counterintuitive_mechanism":"Constraining the adversary to high-frequency makes it attack TEXTURE directly - and texture IS what sharpness measures. So the texture adversary collapses sharpness HARDER (0.33) than the position adversary (0.63). After high-pass + power-norm, eps energy concentrates in few high-freq pixels -> strong per-pixel texture noise -> model loses sharpness.","DEFINITIVE_negative":"Every attackable direction (position OR texture) is a direction the ViT needs. There is NO safe adversarial direction for a position+texture-critical forecasting task. Input-space adversarial robustness training is fundamentally unsuitable here.","root_cause":"Classic robustness-accuracy tradeoff: the adversarial WORST-CASE input is out-of-distribution for CLEAN inference (rollout uses clean/decoupled context). Training on OOD-hard examples degrades performance on the actual inference distribution. Pure cost, no benefit. The adversary's best case (disabled) = neutral = no-aug.","gan_lr_imbalance_secondary":"Adversary LR 1e-3 (10x model LR 1e-4) lets the adversary dominate - but even balanced, the OOD-worst-case issue is fundamental.","direction_dead":"Learned adversarial augmentor (both unconstrained and texture-constrained) FAILS. Combined with the latent-corruption negatives this session: robustness/augmentation mechanisms do not help this well-calibrated ViT. The found levers (WCLAMP=6, fp32, AVG4, ODE32) stand. Remaining gap to conv is inductive-bias/data-scale."}}
{"run":148,"commit":"b0f84b3","metric":1511.91,"metrics":{"ed_late":2023.076538,"mmd":0.404124,"sharpness_ratio":0.933677,"mass_drift":0.023674,"train_loss":0.008507,"wall_s":163.92},"status":"keep","description":"JIT_PATCH_HW=8 WIN: 48 tokens vs 192 → sharp 0.93 (vs 0.84, +10.7%), mass 0.024 (vs 0.086, −72%), ED 1512. Less overfitting on 220 traj (prior hypothesis verified). Capacity axis, not perturbation tax = why it works where all aug failed.","timestamp":1783344249034,"segment":4,"confidence":1.8941979588367348,"asi":{"WIN":"JIT_PATCH_HW=8 (48 tokens vs 192) at champion config: ED 1512, SHARP 0.93 (vs 0.84 baseline, +10.7%), MASS 0.024 (vs 0.086, -72%), train_loss 0.0085. All metrics improve or hold.","mechanism_confirmed":"Prior session hypothesis VERIFIED: 'larger patch -> cut token count -> less overfitting on tiny data'. 4x fewer tokens (48 vs 192) -> less overfitting on 220 trajectories -> sharper (0.93, near ideal/near conv 1.11) + better mass conservation (0.024, was 0.086). Operates on capacity/overfitting axis, NOT a perturbation tax (why it works where all augmentation failed).","real_not_noise":"Sharpness is a STABLE metric (~0.84 across baseline runs 0.844/0.836); 0.93 is a +10.7% jump FAR beyond the noise floor. Mass 0.024 vs 0.074-0.086 also large+robust. Qualitatively different from the ED-noise false positives (gentle corruption) - those improved only the noisy ED while sharp/mass degraded; here sharp/mass IMPROVE.","caveat":"ED 1512 vs baseline mean ~1689 is only ~10% (within the 17% ED noise). Trust sharp/mass. Will verify with re-run + SEED=2.","next":"Verify PATCH_HW=8 robustness (re-run + SEED=2). Then probe: PATCH_HW=8 may enable larger embed_dim or more depth (now that tokens are cheap) to push further. Also consider the ViT-vs-conv gap may shrink."}}
{"run":149,"commit":"ce0bc0e","metric":886.34,"metrics":{"ed_late":1015.94989,"mmd":0.412245,"sharpness_ratio":0.899058,"mass_drift":0.05598,"train_loss":0.060289,"wall_s":162.7},"status":"keep","description":"PATCH_HW=8 generalizes to SEED=2: sharp 0.90, mass 0.056, ED 886 (vs prior SEED=2 PATCH_HW=4 sharp 0.63-0.71). Both seeds sharp ~0.90+. Win robust.","timestamp":1783344499495,"segment":4,"confidence":2.489950818200259,"asi":{"generalization_confirmed":"PATCH_HW=8 at SEED=2: sharp 0.90, mass 0.056, ED 886. Sharpness 0.90 >> prior SEED=2 PATCH_HW=4 (0.63-0.71 old env). Win generalizes across seeds: SEED=0 sharp 0.93, SEED=2 sharp 0.90 (both ~0.90+ vs PATCH_HW=4 ~0.84/0.71).","cross_seed_note":"ED not cross-seed comparable (different reference set); sharpness/mass are normalized ratios, roughly comparable. Both trustworthy metrics confirm the win at both seeds.","next":"Run current-env SEED=2 PATCH_HW=4 baseline to complete clean within-env 2x2 (SEED=0 PATCH_HW=4 baseline already done: sharp 0.84)."}}
{"run":150,"commit":"ce0bc0e","metric":1609.66,"metrics":{"ed_late":1701.297729,"mmd":0.412245,"sharpness_ratio":0.869693,"mass_drift":0.065464,"train_loss":0.056093,"wall_s":178.07},"status":"discard","description":"SEED=2 PATCH_HW=4 baseline: sharp 0.87, mass 0.065, ED 1610. Completes 2×2: PATCH_HW=8 ≥ PATCH_HW=4 on ALL metrics BOTH seeds (robust). Next: 800k config + PATCH_HW=8.","timestamp":1783344779589,"segment":4,"confidence":2.6809879597662314,"asi":{"baseline_completed_2x2":"SEED=2 PATCH_HW=4 baseline (current env): sharp 0.87, mass 0.065, ED 1610. NOTE: env drifted hugely - prior session SEED=2 PATCH_HW=4 was sharp 0.63-0.71, now 0.87.","clean_2x2":"PATCH_HW=8 >= PATCH_HW=4 on EVERY metric at BOTH seeds. SEED=0: sharp 0.84->0.93, mass 0.080->0.024, ED 1689->1512. SEED=2: sharp 0.87->0.90, mass 0.065->0.056, ED 1610->886. Direction unanimous; magnitude seed-dependent (SEED=0 wins sharp/mass most, SEED=2 wins ED most). PATCH_HW=8 is a ROBUST win.","important_realization":"This whole session ran the 170k ViT (embed=64/depth=3). Prior session found the 800k config (embed=128/depth=4) BETTER at PATCH_HW=4 (ED 1210 vs 1706). The PATCH_HW=8 win is on the 170k config. Next: combine 800k capacity + PATCH_HW=8 coarse patches (tokens now cheap).","next":"800k (embed=128/depth=4) + PATCH_HW=8 at SEED=0. Strong prior: capacity helped at PATCH_HW=4; with 48 tokens the 800k is affordable. If it improves, the ViT-vs-conv gap shrinks further."}}
{"run":151,"commit":"b4acca5","metric":803.06,"metrics":{"ed_late":802.661926,"mmd":0.404124,"sharpness_ratio":1.033738,"mass_drift":0.017743,"train_loss":0.004723,"wall_s":208.98},"status":"keep","description":"800k + PATCH_HW=8 MAJOR WIN: ED 803, sharp 1.03 (near conv 1.11), mass 0.018. Capacity(800k)+coarse-patch wins compound. ViT now 1.8× conv (was 45×). Verifying SEED=2.","timestamp":1783345043360,"segment":4,"confidence":3.046002888454677,"asi":{"MAJOR_WIN":"800k (embed=128/depth=4) + PATCH_HW=8 at SEED=0: ED 803, SHARP 1.03, mass 0.018, train_loss 0.0047, ed_late 803. ALL metrics jump.","two_wins_compounded":"(1) capacity: 800k > 170k (prior session found this at PATCH_HW=4); (2) coarse patches: PATCH_HW=8 > 4 (this session). Combined: 170k/PHW4 ~1689 ED sharp 0.84 -> 170k/PHW8 1512/0.93 -> 800k/PHW8 803/1.03.","vit_now_competitive":"ED 803 vs conv 451 = 1.8x gap (was 45x originally, ~3.7x at WCLAMP6/170k). Sharpness 1.03 vs conv 1.11 (near-ideal, above 1.0). Mass 0.018 (excellent). The ViT is no longer crippled.","real_not_overfitting":"train_loss 0.0047 (LOWER than 170k's 0.0085) but rollout metrics all BETTER (sharp 1.03, mass 0.018, ED 803). If overfitting, rollout would degrade - instead it improves = genuine generalization. Sharpness (stable metric) +0.10 beyond the 0.84-0.93 range = real.","next":"VERIFY SEED=2 (overfitting/generalization check). If 800k/PHW8 also wins at SEED=2, the ViT-vs-conv gap is largely closed by capacity + coarse patches, NOT augmentation."}}
{"run":152,"commit":"b4acca5","metric":805.42,"metrics":{"ed_late":685.269653,"mmd":0.412245,"sharpness_ratio":0.859334,"mass_drift":0.081021,"train_loss":0.048865,"wall_s":207.55},"status":"discard","description":"SEED=2 800k verification MIXED: ED 805 (confirms) but sharp 0.86/mass 0.081 worse than 170k at S2. 800k is net ED/sharpness win but per-seed mass regression. PATCH_HW=8 remains the robust win.","timestamp":1783345422072,"segment":4,"confidence":3.1535918729339674,"asi":{"SEED2_verification_MIXED":"800k + PATCH_HW=8 at SEED=2: ED 805 (confirms big ED win: 803 S0 / 805 S2, both ~half of 170k), BUT sharp 0.86 + mass 0.081 - WORSE than 170k/PATCH_HW=8 at SEED=2 (sharp 0.90, mass 0.056).","overfitting_discipline_catches_seed_specific":"The 800k sharpness win (1.03 at S0) does NOT cleanly generalize: at S2 mass drift regresses (0.081 vs 170k 0.056) - the trustworthy signal. 800k trades mass/dynamics-accuracy for ED/sharpness at S2.","averaged_across_seeds":"170k/PHW8: sharp 0.915, mass 0.040, ED 1199. 800k/PHW8: sharp 0.945, mass 0.050, ED 804. 800k wins ED (big) + sharpness (small), loses mass (small). Net 800k is better but with a real per-seed mass caveat.","robust_conclusion":"PATCH_HW=8 is the ROBUST win (all metrics both seeds at 170k). 800k capacity is a NET ED/sharpness win but seed-dependent mass regression - monitor mass per-seed in production. 170k/PATCH_HW=8 is the mass-robust alternative.","next":"Probe middle capacity (embed=96/depth=4) to find a cleaner robust sweet spot between 170k (mass-robust) and 800k (ED-best). Or accept current state."}}
{"run":153,"commit":"b4acca5","metric":1027.22,"metrics":{"ed_late":999.170105,"mmd":0.404124,"sharpness_ratio":0.994015,"mass_drift":0.001932,"train_loss":0.005699,"wall_s":206.13},"status":"discard","description":"embed=96/depth=4 + PHW8 (S0): ED 1027, sharp 0.99, mass 0.002 (best mass). Capacity landscape: ED/sharp ↑ with capacity, mass best at middle. ED worse than 800k so not ED champ, but excellent genuine mass. Verifying SEED=2.","timestamp":1783345744431,"segment":4,"confidence":3.269059522543195,"asi":{"result":"embed=96/depth=4 + PATCH_HW=8 SEED=0: ED 1027, sharp 0.99, mass 0.002 (!), train_loss 0.0057.","capacity_landscape_PHW8_S0":"64/3(170k): ED1512/sharp0.93/mass0.024. 96/4: ED1027/sharp0.99/mass0.002. 128/4(800k): ED803/sharp1.03/mass0.018. ED+sharpness improve monotonically with capacity; MASS is best at the MIDDLE (96/4: 0.002, near-perfect mass conservation).","real_not_metric_gaming":"96/4 has BETTER mass (0.002) + WORSE ED (1027) = OPPOSITE of metric-gaming (which is better-ED-worse-mass via blur). So 96/4's excellent mass is genuine; its worse ED is from positional/texture components, not blur.","primary_metric":"ED 1027 > committed 800k's 803, so NOT the ED champion (discard on primary). But mass 0.002 is the best yet.","next":"Verify 96/4 at SEED=2. If mass stays excellent (~0.002-0.05) there, 96/4 is the robust MASS/quality alternative to 800k's ED-best config (avoids 800k's SEED=2 mass regression 0.081)."}}
{"run":154,"commit":"b4acca5","metric":1154.08,"metrics":{"ed_late":1212.976807,"mmd":0.412245,"sharpness_ratio":0.809642,"mass_drift":0.118784,"train_loss":0.055266,"wall_s":203.81},"status":"discard","description":"96/4 SEED=2: sharp 0.81, mass 0.119 — SEED=0 'best mass' (0.002) was a fluke, doesn't generalize. 96/4 ELIMINATED (worst avg). 800k champion confirmed (best ED+sharp both seeds). Capacity axis exhausted.","timestamp":1783346010675,"segment":4,"confidence":3.7044419680745087,"asi":{"96_4_SEED2":"embed=96/depth=4 + PHW8 at SEED=2: sharp 0.81, mass 0.119, ED 1154. The SEED=0 'best mass' (0.002) was a SEED FLUKE - does NOT generalize.","SEED2_capacity_ranking_trustworthy":"At SEED=2 (sharp/mass): 170k(64/3) sharp0.90/mass0.056 > 800k(128/4) sharp0.86/mass0.081 > 96/4 sharp0.81/mass0.119. MORE capacity HURTS sharp/mass at SEED=2. Capacity benefit is SEED-DEPENDENT.","averaged_across_seeds":"170k: sharp0.915/mass0.040/ED1199. 800k: sharp0.945/mass0.050/ED804. 96/4: sharp0.900/mass0.061/ED1090. 800k wins ED+sharp; 170k wins mass; 96/4 worst (ELIMINATED).","champion_confirmed":"800k (embed=128/depth=4) + PATCH_HW=8 stands as champion: best ED both seeds (803/805), best avg sharpness, slight mass caveat at SEED=2. 96/4 is a dead end (seed-fluky).","session_capacity_axis_EXHAUSTED":"Capacity landscape at PATCH_HW=8 fully characterized: 800k is the sweet spot (best ED+sharp, acceptable mass). 170k is the mass-robust alternative. The ViT is now ~1.8x conv (was 45x). Remaining gap is data-scale, not capacity/aug."}}
{"run":155,"commit":"b4acca5","metric":857.62,"metrics":{"ed_late":1508.459351,"mmd":0.404124,"sharpness_ratio":1.18052,"mass_drift":0.103994,"train_loss":0.004788,"wall_s":204.39},"status":"discard","description":"K_CTX=3 on 800k champion (S0): sharp 1.18 (artifacts), mass 0.104 (5.7× worse), ed_late 1508 (1.9× worse). Extra context + high capacity → overshoot. K=3 worse than K=2 on trustworthy metrics. Verifying SEED=2.","timestamp":1783346441572,"segment":4,"confidence":4.239063058599656,"asi":{"result":"K_CTX=3 on 800k+PATCH_HW=8 champion SEED=0: ED 858 (~803 within noise), sharp 1.18 (ABOVE ideal=artifacts), mass 0.104 (5.7x worse than 0.018!), ed_late 1508 (vs 803, late rollout diverges 1.9x more), train_loss 0.0048.","interpretation":"Extra context + high capacity -> OVERSHOOTING. The 800k model uses 3 frames to confidently extrapolate, producing sharp-but-wrong-mass blobs (hallucinated high-freq). Sharpness>1.0 here is BAD (artifacts, not quality), confirmed by mass drift 0.104 and ed_late 1508. Compounds into worse long-range rollout.","vs_K2":"K=2 champion: ED803/sharp1.03/mass0.018/ed_late803. K=3: ED858/sharp1.18/mass0.104/ed_late1508. K=3 worse on mass, ed_late, and artifact-prone sharpness. ED similar (noise).","hypothesis":"More context helps a SMALLER/less-confident model but lets a high-capacity model overshoot. K=3 might help 170k (less overshoot) but hurts 800k. Verifying SEED=2 before concluding."}}
{"run":156,"commit":"b4acca5","metric":919.93,"metrics":{"ed_late":1146.390625,"mmd":0.404124,"sharpness_ratio":0.984657,"mass_drift":0.003572,"train_loss":0.009034,"wall_s":165.14},"status":"discard","description":"K=3 HELPS 170k/PHW8 (S0): ED 920 (vs K=2 1512), sharp 0.98, mass 0.0036. Hypothesis confirmed (K=3 helps small model, overshoots big). ED>800k champion so not primary win; verifying SEED=2 (mass could be fluke like 96/4).","timestamp":1783346720227,"segment":4,"confidence":4.580650950570343,"asi":{"result":"K=3 on 170k + PATCH_HW=8 SEED=0: ED 920, sharp 0.98 (near-ideal, CLEAN - not artifacts), mass 0.0036 (near-perfect), ed_late 1146, train_loss 0.009.","hypothesis_confirmed":"K=3 HELPS the smaller 170k model (extra context -> better dynamics, no overshoot) but OVERSHOOTS the 800k (sharp 1.18 artifacts, mass 0.104). Capacity x context interaction: high capacity + more context = overshoot; low capacity + more context = benefit.","vs_baselines":"K=3/170k/PHW8: ED920/sharp0.98/mass0.0036. K=2/170k/PHW8: ED1512/sharp0.93/mass0.024. K=3 is +39% ED, better sharp, MUCH better mass for the 170k config. BUT ED 920 > 800k/K=2 champion's 803 (worse on primary).","MUST_verify_S2":"The 96/4 'best mass' (0.002 at S0) was a FLUKE (S2 mass 0.119). K=3/170k mass 0.0036 at S0 could同样 be seed-specific. MUST verify SEED=2 before trusting. If K=3/170k keeps good mass (~0.005) AND ED ~900 at S2, it beats 800k/K=2 at S2 (which had mass 0.081) = more robust champion."}}
{"run":157,"commit":"b4acca5","metric":1061.15,"metrics":{"ed_late":1084.08728,"mmd":0.412245,"sharpness_ratio":0.888591,"mass_drift":0.057629,"train_loss":0.050193,"wall_s":165.65},"status":"discard","description":"K=3/170k SEED=2: sharp 0.89, mass 0.058, ED 1061 — K=3 seed-dependent (S2 worse than K=2). Overfitting frontier reached: capacity & K_CTX tuning now seed-noisy. Robust win (PATCH_HW=8) stands; 800k ED champion stands.","timestamp":1783346958039,"segment":4,"confidence":4.93522126562034,"asi":{"K3_170k_SEED2":"K=3/170k/PHW8 SEED=2: sharp 0.89, mass 0.058, ED 1061. At SEED=2 it's WORSE than 170k/K=2 (sharp0.90/mass0.056/ED886) on all metrics. K=3 benefit is SEED-DEPENDENT (S0 helps 1512->920, S2 hurts 886->1061).","mass_NOT_a_fluke":"K=3/170k mass S2=0.058 is decent (not the 96/4 fluke 0.119), but not the S0 excellence (0.0036). Averaged mass 0.031 (best of all configs) but ED 990 > 800k champion's 804.","session_champions":"(1) 800k/K=2/PHW8: best ED 804 avg + sharp 0.945, mass 0.050. (2) K=3/170k/PHW8: best mass 0.031 avg, ED 990, sharp 0.935. 800k/K=2 is the overall ED champion.","OVERFITTING_FRONTIER_reached":"Every further hyperparameter (capacity 96/4, K_CTX=3) now produces SEED-DEPENDENT noise, not robust gains. S0 and S2 disagree. This is the signature of the overfitting frontier - continuing to tune risks overfitting the benchmark. STOP tuning.","robust_win_stands":"PATCH_HW=8 (coarse patches) remains the ONE robust, principled win this session (all metrics both seeds at 170k). 800k capacity is a net ED win with mass caveat. ViT now ~1.8x conv (was 45x). Remaining gap is data-scale (production)."}}
{"run":158,"commit":"b4acca5","metric":4326.49,"metrics":{"ed_late":39816.875,"mmd":0.395991,"sharpness_ratio":2.86769,"mass_drift":0.602368,"train_loss":0.009665,"wall_s":212.47},"status":"discard","description":"dt=0.024 (fast motion) champion PATCH_HW=8: ED 4326, sharp 2.87 (artifacts), mass 0.60 — much harder regime (prior: rankings flip here). Running PATCH_HW=4 control for relative comparison.","timestamp":1783347336939,"segment":4,"confidence":4.679536859507214,"asi":{"dt024_champion":"800k + PATCH_HW=8 at dt=0.024 (fast motion): ED 4326, sharp 2.87 (!!), mass 0.60, ed_late 39817. VERY different/harder regime - massive artifacts (sharpness 2.87 = 2.8x reference high-freq), blob mass way off, late rollout fully diverges.","regime_note":"dt=0.024 = fast motion (blob moves more per frame). Much harder forecasting. Prior session noted 'ranking FLIPS' here. Absolute numbers NOT comparable to dt=0.012. The model overshoots badly in fast motion regardless of patch size.","purpose":"Generalization validation: does the PATCH_HW=8 win (vs PATCH_HW=4) hold in this different regime? Running PATCH_HW=4 control at dt=0.024 next. If PATCH_HW=8 < PATCH_HW=4 on ED here, the architectural win is dt-robust."}}
{"run":159,"commit":"b4acca5","metric":5422.59,"metrics":{"ed_late":23923.542969,"mmd":0.395991,"sharpness_ratio":0.498559,"mass_drift":0.267304,"train_loss":0.009084,"wall_s":267.13},"status":"discard","description":"dt=0.024 PATCH_HW=4 control: ED 5423, ed_late 23924, sharp 0.50. PATCH_HW=8 win does NOT cleanly generalize to fast motion (lower early-ED but worse late/mass/artifacts). Win is dt=0.012-specific; robust across seeds there.","timestamp":1783347690392,"segment":4,"confidence":4.411607543057358,"asi":{"dt024_control":"PATCH_HW=4 (800k) at dt=0.024: ED 5423, ed_late 23924, sharp 0.50 (blurry), mass 0.27.","dt024_comparison":"At dt=0.024: PATCH_HW=8 ED4326 < PATCH_HW=4 ED5423 (better early ED, -20%), BUT PATCH_HW=8 ed_late 39817 > 23924 (worse late), mass 0.60 > 0.27 (worse), sharp 2.87 (artifacts) vs 0.50 (blurry). MIXED/messy.","generalization_verdict":"PATCH_HW=8 win does NOT cleanly generalize to fast motion (dt=0.024). The fast-motion regime is unstable for this RF forecaster regardless of patch size (both ED ~5000 vs 803 at dt=0.012; both sharpness far from 1.0). Matches prior session 'rankings flip in fast motion'. The PATCH_HW=8 win is dt=0.012-SPECIFIC but robust across SEED=0/2 there.","honest_caveat":"For production: validate PATCH_HW on the target data regime. The coarse-patch win holds in the moderate-motion regime (dt=0.012) but fast motion needs separate tuning (or is fundamentally harder for this RF velocity model)."}}
{"run":160,"commit":"b4acca5","metric":1167.54,"metrics":{"ed_late":1093.337524,"mmd":0.404124,"sharpness_ratio":1.03604,"mass_drift":0.020821,"train_loss":0.003281,"wall_s":207.91},"status":"discard","description":"WCLAMP=4 on champion: ED 1168 (vs 803, worse). Over-emphasizes t≈0 → lower train_loss but worse rollout. WCLAMP=6 confirmed optimal for new arch too. Champion well-tuned on all major levers; optimization complete.","timestamp":1783348151694,"segment":4,"confidence":4.704087641175984,"asi":{"result":"WCLAMP=4 on champion (800k/PHW8) SEED=0: ED 1168 (vs WCLAMP=6's 803, +45% WORSE), sharp 1.04 (~same), mass 0.021 (~same), train_loss 0.0033 (LOWER than 6's 0.0047).","mechanism":"Lower clamp over-emphasizes t~=0 forecasting direction -> model fits TRAINING better (lower train_loss) but generalizes WORSE to rollout (higher ED). Over-fits the forecasting direction. So WCLAMP=6 is still optimal for the new architecture.","confirms_champion_well_tuned":"WCLAMP optimum did NOT shift with the architecture change (PHW4/170k -> PHW8/800k). 6 remains optimal (this test: 4 worse; prior sweep: 12 worse, 3 reversed). The champion is well-tuned on the dominant lever.","all_major_levers_confirmed":"Champion (800k/PHW8/WCLAMP6/AVG4/ODE32/LR1e-4/fp32) is now confirmed optimal on ALL major levers. WCLAMP=6 re-verified for new arch. Optimization COMPLETE; remaining ViT-vs-conv gap (~1.8x) is data-scale (production), not tunable here without overfitting."}}
